id,source_sentence,target_sentence,source_word,target_word,level,phenomenon,PID,subtype,domain,tree_depth
24309,"От золотого сердца, которого скорее всего не существует?","От золотого сердца, которого скорее всего не существую?",существует,существую,Syntax,Subject-Predicate Agreement,genitive_subj_predicate_agreement_person,genitive_subj_predicate_agreement_person,librusec,3
35669,И уж у нее проблем с водой не бывает.,И уж у нее проблем с водой не бываю.,бывает,бываю,Syntax,Subject-Predicate Agreement,genitive_subj_predicate_agreement_person,genitive_subj_predicate_agreement_person,librusec,4
35156,"Льешо понял, что ответа от него не требуется.","Льешо понял, что ответа от него не требуюсь.",требуется,требуюсь,Syntax,Subject-Predicate Agreement,genitive_subj_predicate_agreement_person,genitive_subj_predicate_agreement_person,librusec,3
33024,"Все будет жить, и только нас не станет...","Все будет жить, и только нас не станешь...",станет,станешь,Syntax,Subject-Predicate Agreement,genitive_subj_predicate_agreement_person,genitive_subj_predicate_agreement_person,librusec,3
22251,"А шалманы начнет перечислять, так пальцев не хватит.","А шалманы начнет перечислять, так пальцев не хвачу.",хватит,хвачу,Syntax,Subject-Predicate Agreement,genitive_subj_predicate_agreement_person,genitive_subj_predicate_agreement_person,librusec,3
27078,"Хотя Шемдаль говорил, что безвредных чудиков не бывает.","Хотя Шемдаль говорил, что безвредных чудиков не бываю.",бывает,бываю,Syntax,Subject-Predicate Agreement,genitive_subj_predicate_agreement_person,genitive_subj_predicate_agreement_person,librusec,3
16410,Твоих тысячи рубликов в месяц и одному не хватит.,Твоих тысячи рубликов в месяц и одному не хвачу.,хватит,хвачу,Syntax,Subject-Predicate Agreement,genitive_subj_predicate_agreement_person,genitive_subj_predicate_agreement_person,librusec,5
27276,Поменял двух людей местами - ничего ж не изменится!,Поменял двух людей местами - ничего ж не изменюсь!,изменится,изменюсь,Syntax,Subject-Predicate Agreement,genitive_subj_predicate_agreement_person,genitive_subj_predicate_agreement_person,librusec,4
13051,Только не наш Микки — этого не может быть.,Только не наш Микки — этого не могу быть.,может,могу,Syntax,Subject-Predicate Agreement,genitive_subj_predicate_agreement_person,genitive_subj_predicate_agreement_person,librusec,4
35963,"Нет, господин Русениек, так дела не делают.","Нет, господин Русениек, так дела не делаете.",делают,делаете,Syntax,Subject-Predicate Agreement,genitive_subj_predicate_agreement_person,genitive_subj_predicate_agreement_person,librusec,2
14375,"Наверное, именно та – похожих вроде не наблюдается.","Наверное, именно та – похожих вроде не наблюдаюсь.",наблюдается,наблюдаюсь,Syntax,Subject-Predicate Agreement,genitive_subj_predicate_agreement_person,genitive_subj_predicate_agreement_person,librusec,3
15383,У спящего никогда не бывает таких врущих напряженных век!,У спящего никогда не бываю таких врущих напряженных век!,бывает,бываю,Syntax,Subject-Predicate Agreement,genitive_subj_predicate_agreement_person,genitive_subj_predicate_agreement_person,librusec,3
36526,Но не делается ничего и в случае убийства животных.,Но не делаюсь ничего и в случае убийства животных.,делается,делаюсь,Syntax,Subject-Predicate Agreement,genitive_subj_predicate_agreement_person,genitive_subj_predicate_agreement_person,wikinews,3
5244,Агент: Рыбуса никак не коснется возможный переход Тикнизяна.,Агент: Рыбуса никак не коснусь возможный переход Тикнизяна.,коснется,коснусь,Syntax,Subject-Predicate Agreement,genitive_subj_predicate_agreement_person,genitive_subj_predicate_agreement_person,wikinews,4
43235,"Машково - ни гари, ни химии не ощущается.","Машково - ни гари, ни химии не ощущаюсь.",ощущается,ощущаюсь,Syntax,Subject-Predicate Agreement,genitive_subj_predicate_agreement_person,genitive_subj_predicate_agreement_person,wikinews,3
47106,Но на улице наших слов все равно не хватает.,Но на улице наших слов все равно не хватаю.,хватает,хватаю,Syntax,Subject-Predicate Agreement,genitive_subj_predicate_agreement_person,genitive_subj_predicate_agreement_person,wikinews,4
46017,Мне что ли не хватает давки после этого боя?,Мне что ли не хватаю давки после этого боя?,хватает,хватаю,Syntax,Subject-Predicate Agreement,genitive_subj_predicate_agreement_person,genitive_subj_predicate_agreement_person,wikinews,3
28524,Но шесть других поселений рядом такой базы не имеют.,Но шесть других поселений рядом такой базы не имеем.,имеют,имеем,Syntax,Subject-Predicate Agreement,genitive_subj_predicate_agreement_person,genitive_subj_predicate_agreement_person,wikinews,3
4296,О количестве северокорейских мин здесь пока сведений не имеется.,О количестве северокорейских мин здесь пока сведений не имеюсь.,имеется,имеюсь,Syntax,Subject-Predicate Agreement,genitive_subj_predicate_agreement_person,genitive_subj_predicate_agreement_person,wikinews,3
44421,Примеров же реализации собственной оперативной информации практически не встречается.,Примеров же реализации собственной оперативной информации практически не встречаюсь.,встречается,встречаюсь,Syntax,Subject-Predicate Agreement,genitive_subj_predicate_agreement_person,genitive_subj_predicate_agreement_person,wikinews,5
39571,На словах - поскольку на деле не получается устрашения.,На словах - поскольку на деле не получаюсь устрашения.,получается,получаюсь,Syntax,Subject-Predicate Agreement,genitive_subj_predicate_agreement_person,genitive_subj_predicate_agreement_person,wikinews,3
26370,Серебряному веку серебра Не хватит на стихов моих медали.,Серебряному веку серебра Не хвачу на стихов моих медали.,хватит,хвачу,Syntax,Subject-Predicate Agreement,genitive_subj_predicate_agreement_person,genitive_subj_predicate_agreement_person,wikinews,4
45404,Взаимодействия же у Зе с Федором не наблюдается совершенно.,Взаимодействия же у Зе с Федором не наблюдаюсь совершенно.,наблюдается,наблюдаюсь,Syntax,Subject-Predicate Agreement,genitive_subj_predicate_agreement_person,genitive_subj_predicate_agreement_person,wikinews,4
193,"Самой рубки не производится, но она была вчера.","Самой рубки не произвожусь, но она была вчера.",производится,произвожусь,Syntax,Subject-Predicate Agreement,genitive_subj_predicate_agreement_person,genitive_subj_predicate_agreement_person,wikinews,3
28258,Руководителю департамента судейства Виктору Кашшаи же ничего не угрожает.,Руководителю департамента судейства Виктору Кашшаи же ничего не угрожаю.,угрожает,угрожаю,Syntax,Subject-Predicate Agreement,genitive_subj_predicate_agreement_person,genitive_subj_predicate_agreement_person,wikinews,5
45767,"А вот, почему у ЦСКА ничего не получается?","А вот, почему у ЦСКА ничего не получаюсь?",получается,получаюсь,Syntax,Subject-Predicate Agreement,genitive_subj_predicate_agreement_person,genitive_subj_predicate_agreement_person,wikinews,3
2013,У церкви вообще в этом районе не хватает площадей.,У церкви вообще в этом районе не хватаю площадей.,хватает,хватаю,Syntax,Subject-Predicate Agreement,genitive_subj_predicate_agreement_person,genitive_subj_predicate_agreement_person,wikinews,3
1030,Однако речи о снижении цены данных игроков не идет.,Однако речи о снижении цены данных игроков не иду.,идет,иду,Syntax,Subject-Predicate Agreement,genitive_subj_predicate_agreement_person,genitive_subj_predicate_agreement_person,wikinews,5
45795,А вот в Европе явного лидера торгов не наблюдается.,А вот в Европе явного лидера торгов не наблюдаюсь.,наблюдается,наблюдаюсь,Syntax,Subject-Predicate Agreement,genitive_subj_predicate_agreement_person,genitive_subj_predicate_agreement_person,wikinews,3
1966,Но с ЖА таких мыслей у инспектора не появится.,Но с ЖА таких мыслей у инспектора не появлюсь.,появится,появлюсь,Syntax,Subject-Predicate Agreement,genitive_subj_predicate_agreement_person,genitive_subj_predicate_agreement_person,wikinews,4
46011,"Не хватает лишь последнего голосования, теперь почти формального.","Не хватаю лишь последнего голосования, теперь почти формального.",хватает,хватаю,Syntax,Subject-Predicate Agreement,genitive_subj_predicate_agreement_person,genitive_subj_predicate_agreement_person,wikinews,4
38136,"По словам Реисяна, жизни Талшяна ничего не угрожает.","По словам Реисяна, жизни Талшяна ничего не угрожаю.",угрожает,угрожаю,Syntax,Subject-Predicate Agreement,genitive_subj_predicate_agreement_person,genitive_subj_predicate_agreement_person,wikinews,3
38691,По этому году у нас не стоит такой задачи.,По этому году у нас не стою такой задачи.,стоит,стою,Syntax,Subject-Predicate Agreement,genitive_subj_predicate_agreement_person,genitive_subj_predicate_agreement_person,wikinews,4
1981,"Соглашусь, мясного гола и не хватает, мусорного.","Соглашусь, мясного гола и не хватаю, мусорного.",хватает,хватаю,Syntax,Subject-Predicate Agreement,genitive_subj_predicate_agreement_person,genitive_subj_predicate_agreement_person,wikinews,4
34230,Однако юридически этой дороги не существуют до сего дня.,Однако юридически этой дороги не существуем до сего дня.,существуют,существуем,Syntax,Subject-Predicate Agreement,genitive_subj_predicate_agreement_person,genitive_subj_predicate_agreement_person,wikinews,3
4112,На рынке СМИ вроде бы не существует военных тайн.,На рынке СМИ вроде бы не существую военных тайн.,существует,существую,Syntax,Subject-Predicate Agreement,genitive_subj_predicate_agreement_person,genitive_subj_predicate_agreement_person,wikinews,4
47749,И им как раз не хватает поддержки опытных людей.,И им как раз не хватаю поддержки опытных людей.,хватает,хватаю,Syntax,Subject-Predicate Agreement,genitive_subj_predicate_agreement_person,genitive_subj_predicate_agreement_person,wikinews,4
3776,"И ни хрена не происходит, - продолжал президент.","И ни хрена не происхожу, - продолжал президент.",происходит,происхожу,Syntax,Subject-Predicate Agreement,genitive_subj_predicate_agreement_person,genitive_subj_predicate_agreement_person,wikinews,3
47805,Однако для полной передачи пока не хватает некоторых документов.,Однако для полной передачи пока не хватаю некоторых документов.,хватает,хватаю,Syntax,Subject-Predicate Agreement,genitive_subj_predicate_agreement_person,genitive_subj_predicate_agreement_person,wikinews,3
42450,Для ЦСКА не существует никакого другого места кроме первого.,Для ЦСКА не существую никакого другого места кроме первого.,существует,существую,Syntax,Subject-Predicate Agreement,genitive_subj_predicate_agreement_person,genitive_subj_predicate_agreement_person,wikinews,4
3539,Но только не хватает обновленных и качественных марок машин.,Но только не хватаю обновленных и качественных марок машин.,хватает,хватаю,Syntax,Subject-Predicate Agreement,genitive_subj_predicate_agreement_person,genitive_subj_predicate_agreement_person,wikinews,4
37913,"Его состав — люди, которых официально не существует.","Его состав — люди, которых официально не существую.",существует,существую,Syntax,Subject-Predicate Agreement,genitive_subj_predicate_agreement_person,genitive_subj_predicate_agreement_person,wikipedia,3
7395,Сейчас улуса Онгой в его прежнем месте не существует.,Сейчас улуса Онгой в его прежнем месте не существую.,существует,существую,Syntax,Subject-Predicate Agreement,genitive_subj_predicate_agreement_person,genitive_subj_predicate_agreement_person,wikipedia,3
7990,Но тут появляется Обжорство и живых почти не остается.,Но тут появляется Обжорство и живых почти не остаюсь.,остается,остаюсь,Syntax,Subject-Predicate Agreement,genitive_subj_predicate_agreement_person,genitive_subj_predicate_agreement_person,wikipedia,3
36391,Но страшная дата проходит — и ничего не происходит.,Но страшная дата проходит — и ничего не происхожу.,происходит,происхожу,Syntax,Subject-Predicate Agreement,genitive_subj_predicate_agreement_person,genitive_subj_predicate_agreement_person,wikipedia,3
33770,Крестьян за Борисом Иванисовичем в Кечасово уже не числится.,Крестьян за Борисом Иванисовичем в Кечасово уже не числюсь.,числится,числюсь,Syntax,Subject-Predicate Agreement,genitive_subj_predicate_agreement_person,genitive_subj_predicate_agreement_person,wikipedia,3
33680,Денег на снаражение и дорогу у них не хватает.,Денег на снаражение и дорогу у них не хватаю.,хватает,хватаю,Syntax,Subject-Predicate Agreement,genitive_subj_predicate_agreement_person,genitive_subj_predicate_agreement_person,wikipedia,5
10424,Трелевать к Бурлиту за пять верст? – трактора не выдержат.,Трелевать к Бурлиту за пять верст? – трактора не выдержим.,выдержат,выдержим,Syntax,Subject-Predicate Agreement,genitive_subj_predicate_agreement_person,genitive_subj_predicate_agreement_person,librusec,4
31960,"А потом – сами понимаете, вечно не хватает времени для души.","А потом – сами понимаете, вечно не хватаю времени для души.",хватает,хватаю,Syntax,Subject-Predicate Agreement,genitive_subj_predicate_agreement_person,genitive_subj_predicate_agreement_person,librusec,4
14870,"Я воскликнул затем, что в его позиции не чувствуется уз товарищества.","Я воскликнул затем, что в его позиции не чувствуюсь уз товарищества.",чувствуется,чувствуюсь,Syntax,Subject-Predicate Agreement,genitive_subj_predicate_agreement_person,genitive_subj_predicate_agreement_person,librusec,4
8986,"Поэтому каждый журнал делает вид, что других на этом поле не существует.","Поэтому каждый журнал делает вид, что других на этом поле не существую.",существует,существую,Syntax,Subject-Predicate Agreement,genitive_subj_predicate_agreement_person,genitive_subj_predicate_agreement_person,librusec,5
33086,"Однако Атр твердо знал, что такого не может быть.","Однако Атр твердо знал, что такого не могу быть.",может,могу,Syntax,Subject-Predicate Agreement,genitive_subj_predicate_agreement_person,genitive_subj_predicate_agreement_person,librusec,2
15533,"Не существует никакого другого способа, чтобы Ванька мог покинуть Дубодам.","Не существую никакого другого способа, чтобы Ванька мог покинуть Дубодам.",существует,существую,Syntax,Subject-Predicate Agreement,genitive_subj_predicate_agreement_person,genitive_subj_predicate_agreement_person,librusec,4
16174,"И как потом стало страшно, что на обратную дорогу Силы не хватит.","И как потом стало страшно, что на обратную дорогу Силы не хвачу.",хватит,хвачу,Syntax,Subject-Predicate Agreement,genitive_subj_predicate_agreement_person,genitive_subj_predicate_agreement_person,librusec,4
14667,"И жены только на сезон, и тещ вообще не бывает.","И жены только на сезон, и тещ вообще не бываю.",бывает,бываю,Syntax,Subject-Predicate Agreement,genitive_subj_predicate_agreement_person,genitive_subj_predicate_agreement_person,librusec,3
35722,"Минус в работе на себя, что выходных не остается.","Минус в работе на себя, что выходных не остаюсь.",остается,остаюсь,Syntax,Subject-Predicate Agreement,genitive_subj_predicate_agreement_person,genitive_subj_predicate_agreement_person,librusec,3
30571,"Ничего с вашим командиром не случится, придет через час.","Ничего с вашим командиром не случусь, придет через час.",случится,случусь,Syntax,Subject-Predicate Agreement,genitive_subj_predicate_agreement_person,genitive_subj_predicate_agreement_person,librusec,4
17965,"Цель будет прекрасна, а при всем том ничего не выйдет.","Цель будет прекрасна, а при всем том ничего не выйду.",выйдет,выйду,Syntax,Subject-Predicate Agreement,genitive_subj_predicate_agreement_person,genitive_subj_predicate_agreement_person,librusec,3
33517,"А может, и везения никакого тоже объективно не существует.","А может, и везения никакого тоже объективно не существую.",существует,существую,Syntax,Subject-Predicate Agreement,genitive_subj_predicate_agreement_person,genitive_subj_predicate_agreement_person,librusec,3
18842,"И Язон сильно усомнился, что террористов на планете совсем не бывает.","И Язон сильно усомнился, что террористов на планете совсем не бываю.",бывает,бываю,Syntax,Subject-Predicate Agreement,genitive_subj_predicate_agreement_person,genitive_subj_predicate_agreement_person,librusec,4
16458,"Пожалуй, остаточных явлений от мрачного события у нее не имеется.","Пожалуй, остаточных явлений от мрачного события у нее не имеюсь.",имеется,имеюсь,Syntax,Subject-Predicate Agreement,genitive_subj_predicate_agreement_person,genitive_subj_predicate_agreement_person,librusec,5
29676,"Явно спешил в новый зал, где не случится такого облома.","Явно спешил в новый зал, где не случусь такого облома.",случится,случусь,Syntax,Subject-Predicate Agreement,genitive_subj_predicate_agreement_person,genitive_subj_predicate_agreement_person,librusec,4
16559,"Могилы от вас не останется, но хоть день и обстоятельства знать будут.","Могилы от вас не останусь, но хоть день и обстоятельства знать будут.",останется,останусь,Syntax,Subject-Predicate Agreement,genitive_subj_predicate_agreement_person,genitive_subj_predicate_agreement_person,librusec,5
9853,"А ведь говорила – не принесешь яйца, не сбудется ничего.","А ведь говорила – не принесешь яйца, не сбудусь ничего.",сбудется,сбудусь,Syntax,Subject-Predicate Agreement,genitive_subj_predicate_agreement_person,genitive_subj_predicate_agreement_person,librusec,3
21949,"Именно так, понял Леня, идиллии с семьей не получится.","Именно так, понял Леня, идиллии с семьей не получусь.",получится,получусь,Syntax,Subject-Predicate Agreement,genitive_subj_predicate_agreement_person,genitive_subj_predicate_agreement_person,librusec,5
33462,"Тани не может ""слушать"" щелкунов одна — это очевидно.","Тани не могу ""слушать"" щелкунов одна — это очевидно.",может,могу,Syntax,Subject-Predicate Agreement,genitive_subj_predicate_agreement_person,genitive_subj_predicate_agreement_person,librusec,3
23360,"Храад представлялся ему местом исключительно страшным, где ничего хорошего случиться не может.","Храад представлялся ему местом исключительно страшным, где ничего хорошего случиться не могу.",может,могу,Syntax,Subject-Predicate Agreement,genitive_subj_predicate_agreement_person,genitive_subj_predicate_agreement_person,librusec,5
15199,"И долгов было столько, что никакого магазина расплатиться не хватит.","И долгов было столько, что никакого магазина расплатиться не хвачу.",хватит,хвачу,Syntax,Subject-Predicate Agreement,genitive_subj_predicate_agreement_person,genitive_subj_predicate_agreement_person,librusec,3
13144,"Залезаем даже в резервацию, будто и пустоты уж не хватает.","Залезаем даже в резервацию, будто и пустоты уж не хватаю.",хватает,хватаю,Syntax,Subject-Predicate Agreement,genitive_subj_predicate_agreement_person,genitive_subj_predicate_agreement_person,librusec,4
33309,"Работать Крис не любит, и белья постоянно не хватает.","Работать Крис не любит, и белья постоянно не хватаю.",хватает,хватаю,Syntax,Subject-Predicate Agreement,genitive_subj_predicate_agreement_person,genitive_subj_predicate_agreement_person,librusec,2
