id,source_sentence,target_sentence,source_word,target_word,level,phenomenon,PID,subtype,domain,tree_depth
11908,На Мелаквине у нас такой проблемы не существует.,На Мелаквине у нас такой проблемы не существую.,существует,существую,Syntax,Subject-Predicate Agreement,genitive_subj_predicate_agreement_person,genitive_subj_predicate_agreement_person,librusec,4
10665,На второй визит врача денег не хватит.,На второй визит врача денег не хвачу.,хватит,хвачу,Syntax,Subject-Predicate Agreement,genitive_subj_predicate_agreement_person,genitive_subj_predicate_agreement_person,librusec,2
9897,"Или нет, быть этого не может!","Или нет, быть этого не могу!",может,могу,Syntax,Subject-Predicate Agreement,genitive_subj_predicate_agreement_person,genitive_subj_predicate_agreement_person,librusec,2
25014,"А ничего не выходит, с моралью.","А ничего не выхожу, с моралью.",выходит,выхожу,Syntax,Subject-Predicate Agreement,genitive_subj_predicate_agreement_person,genitive_subj_predicate_agreement_person,librusec,2
12024,Этой их истины для книги не существует.,Этой их истины для книги не существую.,существует,существую,Syntax,Subject-Predicate Agreement,genitive_subj_predicate_agreement_person,genitive_subj_predicate_agreement_person,librusec,3
11758,Схватился за день настоящий – сил не хватает.,Схватился за день настоящий – сил не хватаю.,хватает,хватаю,Syntax,Subject-Predicate Agreement,genitive_subj_predicate_agreement_person,genitive_subj_predicate_agreement_person,librusec,3
20922,От селения камня на камне не останется!,От селения камня на камне не останусь!,останется,останусь,Syntax,Subject-Predicate Agreement,genitive_subj_predicate_agreement_person,genitive_subj_predicate_agreement_person,librusec,4
25439,Именно потому Екатерины Мноян больше не существует.,Именно потому Екатерины Мноян больше не существую.,существует,существую,Syntax,Subject-Predicate Agreement,genitive_subj_predicate_agreement_person,genitive_subj_predicate_agreement_person,librusec,4
25173,"Море поглотит капли, вашей силы не станет.","Море поглотит капли, вашей силы не стану.",станет,стану,Syntax,Subject-Predicate Agreement,genitive_subj_predicate_agreement_person,genitive_subj_predicate_agreement_person,librusec,3
9220,"Да, конечно, – другого не остается.","Да, конечно, – другого не остаюсь.",остается,остаюсь,Syntax,Subject-Predicate Agreement,genitive_subj_predicate_agreement_person,genitive_subj_predicate_agreement_person,librusec,3
17018,И гостей никого к себе не водит.,И гостей никого к себе не вожу.,водит,вожу,Syntax,Subject-Predicate Agreement,genitive_subj_predicate_agreement_person,genitive_subj_predicate_agreement_person,librusec,2
36066,"Их просто не бывает, — сказал Том.","Их просто не бываю, — сказал Том.",бывает,бываю,Syntax,Subject-Predicate Agreement,genitive_subj_predicate_agreement_person,genitive_subj_predicate_agreement_person,librusec,3
21894,"Мне, лично мне ничего не угрожает.","Мне, лично мне ничего не угрожаю.",угрожает,угрожаю,Syntax,Subject-Predicate Agreement,genitive_subj_predicate_agreement_person,genitive_subj_predicate_agreement_person,librusec,3
17065,"Света хочет то, Света этак не хочет.","Света хочет то, Света этак не хочу.",хочет,хочу,Syntax,Subject-Predicate Agreement,genitive_subj_predicate_agreement_person,genitive_subj_predicate_agreement_person,librusec,2
22036,Было ясно: кадров у них не хватает.,Было ясно: кадров у них не хватаю.,хватает,хватаю,Syntax,Subject-Predicate Agreement,genitive_subj_predicate_agreement_person,genitive_subj_predicate_agreement_person,librusec,3
15938,А пукалок ему и на взвод не хватит.,А пукалок ему и на взвод не хвачу.,хватит,хвачу,Syntax,Subject-Predicate Agreement,genitive_subj_predicate_agreement_person,genitive_subj_predicate_agreement_person,librusec,2
23310,Тебе не хватает только практики и тренировки.,Тебе не хватаю только практики и тренировки.,хватает,хватаю,Syntax,Subject-Predicate Agreement,genitive_subj_predicate_agreement_person,genitive_subj_predicate_agreement_person,librusec,3
14031,"Что думаете, этого не может быть?","Что думаете, этого не могу быть?",может,могу,Syntax,Subject-Predicate Agreement,genitive_subj_predicate_agreement_person,genitive_subj_predicate_agreement_person,librusec,2
27780,И на этот раз рядом не оказывается учителя.,И на этот раз рядом не оказываюсь учителя.,оказывается,оказываюсь,Syntax,Subject-Predicate Agreement,genitive_subj_predicate_agreement_person,genitive_subj_predicate_agreement_person,librusec,2
13417,И здесь ничего не говорится о Ленге.,И здесь ничего не говорюсь о Ленге.,говорится,говорюсь,Syntax,Subject-Predicate Agreement,genitive_subj_predicate_agreement_person,genitive_subj_predicate_agreement_person,librusec,2
27788,Неужели у него совсем не останется работы?,Неужели у него совсем не останусь работы?,останется,останусь,Syntax,Subject-Predicate Agreement,genitive_subj_predicate_agreement_person,genitive_subj_predicate_agreement_person,librusec,3
13849,"Но ее, папки, фактически не существует.","Но ее, папки, фактически не существую.",существует,существую,Syntax,Subject-Predicate Agreement,genitive_subj_predicate_agreement_person,genitive_subj_predicate_agreement_person,librusec,3
23189,"Алва в Багерлее, второго чуда не случится.","Алва в Багерлее, второго чуда не случусь.",случится,случусь,Syntax,Subject-Predicate Agreement,genitive_subj_predicate_agreement_person,genitive_subj_predicate_agreement_person,librusec,3
32054,"На мой взгляд, не стоит даже моей.","На мой взгляд, не стою даже моей.",стоит,стою,Syntax,Subject-Predicate Agreement,genitive_subj_predicate_agreement_person,genitive_subj_predicate_agreement_person,librusec,3
18959,"Он убедился, что червя ничего не берет.","Он убедился, что червя ничего не беру.",берет,беру,Syntax,Subject-Predicate Agreement,genitive_subj_predicate_agreement_person,genitive_subj_predicate_agreement_person,librusec,2
18286,Вверх Артему ходу нет: не хватает скорости.,Вверх Артему ходу нет: не хватаю скорости.,хватает,хватаю,Syntax,Subject-Predicate Agreement,genitive_subj_predicate_agreement_person,genitive_subj_predicate_agreement_person,librusec,2
33054,Скоро на Ниаре не останется ни одного Мерлея.,Скоро на Ниаре не останусь ни одного Мерлея.,останется,останусь,Syntax,Subject-Predicate Agreement,genitive_subj_predicate_agreement_person,genitive_subj_predicate_agreement_person,librusec,4
14850,Только сегодня ничего у него не выйдет.,Только сегодня ничего у него не выйду.,выйдет,выйду,Syntax,Subject-Predicate Agreement,genitive_subj_predicate_agreement_person,genitive_subj_predicate_agreement_person,librusec,3
18595,И получил оплеуху – названного номера не существует...,И получил оплеуху – названного номера не существую...,существует,существую,Syntax,Subject-Predicate Agreement,genitive_subj_predicate_agreement_person,genitive_subj_predicate_agreement_person,librusec,3
12833,Нам сбежать и то сил не хватит.,Нам сбежать и то сил не хвачу.,хватит,хвачу,Syntax,Subject-Predicate Agreement,genitive_subj_predicate_agreement_person,genitive_subj_predicate_agreement_person,librusec,3
30101,"Вдруг там дома никого не окажется, а!","Вдруг там дома никого не окажусь, а!",окажется,окажусь,Syntax,Subject-Predicate Agreement,genitive_subj_predicate_agreement_person,genitive_subj_predicate_agreement_person,librusec,2
11480,У меня ведь никогда не бывает гостей.,У меня ведь никогда не бываю гостей.,бывает,бываю,Syntax,Subject-Predicate Agreement,genitive_subj_predicate_agreement_person,genitive_subj_predicate_agreement_person,librusec,3
35760,Точно бы меня уж для него не существует.,Точно бы меня уж для него не существуешь.,существует,существуешь,Syntax,Subject-Predicate Agreement,genitive_subj_predicate_agreement_person,genitive_subj_predicate_agreement_person,librusec,2
10976,Только Света и папашка ни черта не делают.,Только Света и папашка ни черта не делаете.,делают,делаете,Syntax,Subject-Predicate Agreement,genitive_subj_predicate_agreement_person,genitive_subj_predicate_agreement_person,librusec,4
27857,"Это что ему, так меня не хватает?","Это что ему, так меня не хватаешь?",хватает,хватаешь,Syntax,Subject-Predicate Agreement,genitive_subj_predicate_agreement_person,genitive_subj_predicate_agreement_person,librusec,2
17379,"Но нет желания, и необходимости не наблюдается.","Но нет желания, и необходимости не наблюдаюсь.",наблюдается,наблюдаюсь,Syntax,Subject-Predicate Agreement,genitive_subj_predicate_agreement_person,genitive_subj_predicate_agreement_person,librusec,2
21384,"Но только желающих не найдется, будь уверен.","Но только желающих не найдусь, будь уверен.",найдется,найдусь,Syntax,Subject-Predicate Agreement,genitive_subj_predicate_agreement_person,genitive_subj_predicate_agreement_person,librusec,3
16464,"Если чего не хватает, заявку пиши.","Если чего не хватаю, заявку пиши.",хватает,хватаю,Syntax,Subject-Predicate Agreement,genitive_subj_predicate_agreement_person,genitive_subj_predicate_agreement_person,librusec,2
14739,Да и в Эльфабаде ничего страшного не происходит.,Да и в Эльфабаде ничего страшного не происхожу.,происходит,происхожу,Syntax,Subject-Predicate Agreement,genitive_subj_predicate_agreement_person,genitive_subj_predicate_agreement_person,librusec,4
11183,"Просто не верится, хотя чего не бывает.","Просто не верится, хотя чего не бываю.",бывает,бываю,Syntax,Subject-Predicate Agreement,genitive_subj_predicate_agreement_person,genitive_subj_predicate_agreement_person,librusec,3
21957,"Мне, Марина, уже ничего не повредит.","Мне, Марина, уже ничего не поврежу.",повредит,поврежу,Syntax,Subject-Predicate Agreement,genitive_subj_predicate_agreement_person,genitive_subj_predicate_agreement_person,librusec,4
24539,И детишек не хочет бросать и зазнобу.,И детишек не хочу бросать и зазнобу.,хочет,хочу,Syntax,Subject-Predicate Agreement,genitive_subj_predicate_agreement_person,genitive_subj_predicate_agreement_person,librusec,3
18677,Но на других участках людей не хватает...,Но на других участках людей не хватаю...,хватает,хватаю,Syntax,Subject-Predicate Agreement,genitive_subj_predicate_agreement_person,genitive_subj_predicate_agreement_person,librusec,2
35546,революции не является теорией движущих сил революции?,революции не являюсь теорией движущих сил революции?,является,являюсь,Syntax,Subject-Predicate Agreement,genitive_subj_predicate_agreement_person,genitive_subj_predicate_agreement_person,librusec,3
9711,"Не хватает отца, здесь вы правы.","Не хватаю отца, здесь вы правы.",хватает,хватаю,Syntax,Subject-Predicate Agreement,genitive_subj_predicate_agreement_person,genitive_subj_predicate_agreement_person,librusec,2
30001,"Ох, как не хватает ей Ивана!","Ох, как не хватаю ей Ивана!",хватает,хватаю,Syntax,Subject-Predicate Agreement,genitive_subj_predicate_agreement_person,genitive_subj_predicate_agreement_person,librusec,2
32790,"И осторожности от него не потребуется, ага.","И осторожности от него не потребуюсь, ага.",потребуется,потребуюсь,Syntax,Subject-Predicate Agreement,genitive_subj_predicate_agreement_person,genitive_subj_predicate_agreement_person,librusec,3
35955,"Само собой, Мартина не останется у Тони.","Само собой, Мартина не останусь у Тони.",останется,останусь,Syntax,Subject-Predicate Agreement,genitive_subj_predicate_agreement_person,genitive_subj_predicate_agreement_person,librusec,3
27880,А вот с другими этого не получается.,А вот с другими этого не получаюсь.,получается,получаюсь,Syntax,Subject-Predicate Agreement,genitive_subj_predicate_agreement_person,genitive_subj_predicate_agreement_person,librusec,2
18261,"Не станет Бурлака, и проблема исчезнет.","Не стану Бурлака, и проблема исчезнет.",станет,стану,Syntax,Subject-Predicate Agreement,genitive_subj_predicate_agreement_person,genitive_subj_predicate_agreement_person,librusec,2
9767,"И ведь не падает ничего, стоит!","И ведь не падаю ничего, стоит!",падает,падаю,Syntax,Subject-Predicate Agreement,genitive_subj_predicate_agreement_person,genitive_subj_predicate_agreement_person,librusec,2
9706,"Им не хватает подготовки, офицеров, нового оружия.","Им не хватаю подготовки, офицеров, нового оружия.",хватает,хватаю,Syntax,Subject-Predicate Agreement,genitive_subj_predicate_agreement_person,genitive_subj_predicate_agreement_person,librusec,4
29158,И для них уже не останется времени после срока!,И для них уже не останусь времени после срока!,останется,останусь,Syntax,Subject-Predicate Agreement,genitive_subj_predicate_agreement_person,genitive_subj_predicate_agreement_person,librusec,3
11036,"Во мужики, ни слова в простоте не скажут!","Во мужики, ни слова в простоте не скажем!",скажут,скажем,Syntax,Subject-Predicate Agreement,genitive_subj_predicate_agreement_person,genitive_subj_predicate_agreement_person,librusec,4
18006,И не старайтесь изучить его: не стоит труда.,И не старайтесь изучить его: не стою труда.,стоит,стою,Syntax,Subject-Predicate Agreement,genitive_subj_predicate_agreement_person,genitive_subj_predicate_agreement_person,librusec,3
14248,"Скажи, говорит, с них нитки не потребуется.","Скажи, говорит, с них нитки не потребуюсь.",потребуется,потребуюсь,Syntax,Subject-Predicate Agreement,genitive_subj_predicate_agreement_person,genitive_subj_predicate_agreement_person,librusec,3
29579,"Слава богу, хоть не горит еще ничего пока!","Слава богу, хоть не горю еще ничего пока!",горит,горю,Syntax,Subject-Predicate Agreement,genitive_subj_predicate_agreement_person,genitive_subj_predicate_agreement_person,librusec,2
17552,"Итак, до возвращения Клаверинга не случится ничего особенного...","Итак, до возвращения Клаверинга не случусь ничего особенного...",случится,случусь,Syntax,Subject-Predicate Agreement,genitive_subj_predicate_agreement_person,genitive_subj_predicate_agreement_person,librusec,4
32998,"А если надену, а опять ничего не получится?","А если надену, а опять ничего не получусь?",получится,получусь,Syntax,Subject-Predicate Agreement,genitive_subj_predicate_agreement_person,genitive_subj_predicate_agreement_person,librusec,2
35549,отношений не хочет и дальше так существовать не будет.,отношений не хочу и дальше так существовать не будет.,хочет,хочу,Syntax,Subject-Predicate Agreement,genitive_subj_predicate_agreement_person,genitive_subj_predicate_agreement_person,librusec,2
21711,"По всему выходило, что голосов Доннаэлу не хватит.","По всему выходило, что голосов Доннаэлу не хвачу.",хватит,хвачу,Syntax,Subject-Predicate Agreement,genitive_subj_predicate_agreement_person,genitive_subj_predicate_agreement_person,librusec,3
24387,"Но боль будет, по-другому просто ничего не выйдет.","Но боль будет, по-другому просто ничего не выйду.",выйдет,выйду,Syntax,Subject-Predicate Agreement,genitive_subj_predicate_agreement_person,genitive_subj_predicate_agreement_person,librusec,3
22626,И только служебных романов мне сейчас и не хватает.,И только служебных романов мне сейчас и не хватаю.,хватает,хватаю,Syntax,Subject-Predicate Agreement,genitive_subj_predicate_agreement_person,genitive_subj_predicate_agreement_person,librusec,2
11533,"Она вот в розыске, а меня вообще не существует в этой системе.","Она вот в розыске, а меня вообще не существуешь в этой системе.",существует,существуешь,Syntax,Subject-Predicate Agreement,genitive_subj_predicate_agreement_person,genitive_subj_predicate_agreement_person,librusec,3
21639,"Он считал, что подобных дам в Советском комплексе просто-напросто не существует.","Он считал, что подобных дам в Советском комплексе просто-напросто не существую.",существует,существую,Syntax,Subject-Predicate Agreement,genitive_subj_predicate_agreement_person,genitive_subj_predicate_agreement_person,librusec,4
13743,"Вы еще мне заявили, что так ничего и никогда работать не станет.","Вы еще мне заявили, что так ничего и никогда работать не стану.",станет,стану,Syntax,Subject-Predicate Agreement,genitive_subj_predicate_agreement_person,genitive_subj_predicate_agreement_person,librusec,4
23353,"Ничего не дается просто так, – маг говорил серьезно.","Ничего не даюсь просто так, – маг говорил серьезно.",дается,даюсь,Syntax,Subject-Predicate Agreement,genitive_subj_predicate_agreement_person,genitive_subj_predicate_agreement_person,librusec,3
26079,"Может быть, больше их и не окажется нужным читать другое что.","Может быть, больше их и не окажусь нужным читать другое что.",окажется,окажусь,Syntax,Subject-Predicate Agreement,genitive_subj_predicate_agreement_person,genitive_subj_predicate_agreement_person,librusec,5
11263,"Таких не бывает, живые девушки – они такие, как Смеяна.","Таких не бываю, живые девушки – они такие, как Смеяна.",бывает,бываю,Syntax,Subject-Predicate Agreement,genitive_subj_predicate_agreement_person,genitive_subj_predicate_agreement_person,librusec,4
30011,"Те так вообще люди деликатные, даже порога не переступят.","Те так вообще люди деликатные, даже порога не переступим.",переступят,переступим,Syntax,Subject-Predicate Agreement,genitive_subj_predicate_agreement_person,genitive_subj_predicate_agreement_person,librusec,4
14699,"Совсем не думает, что мне тоже общения не хватает.","Совсем не думает, что мне тоже общения не хватаю.",хватает,хватаю,Syntax,Subject-Predicate Agreement,genitive_subj_predicate_agreement_person,genitive_subj_predicate_agreement_person,librusec,4
30287,Что бы закрыть все возможности в их отряде просто людей не хватит.,Что бы закрыть все возможности в их отряде просто людей не хвачу.,хватит,хвачу,Syntax,Subject-Predicate Agreement,genitive_subj_predicate_agreement_person,genitive_subj_predicate_agreement_person,librusec,5
25377,"Столь чисто синий, какого и не бывает в природе.","Столь чисто синий, какого и не бываю в природе.",бывает,бываю,Syntax,Subject-Predicate Agreement,genitive_subj_predicate_agreement_person,genitive_subj_predicate_agreement_person,librusec,4
16631,Светка – вот кого мне не хватает в этом сером городе!,Светка – вот кого мне не хватаю в этом сером городе!,хватает,хватаю,Syntax,Subject-Predicate Agreement,genitive_subj_predicate_agreement_person,genitive_subj_predicate_agreement_person,librusec,4
20914,"Если все, то не хватит ленты, крышка вся залапанная.","Если все, то не хвачу ленты, крышка вся залапанная.",хватит,хвачу,Syntax,Subject-Predicate Agreement,genitive_subj_predicate_agreement_person,genitive_subj_predicate_agreement_person,librusec,3
35635,"Пока мы соприкасаемся другими участками, у тебя же проблем не возникает?","Пока мы соприкасаемся другими участками, у тебя же проблем не возникаю?",возникает,возникаю,Syntax,Subject-Predicate Agreement,genitive_subj_predicate_agreement_person,genitive_subj_predicate_agreement_person,librusec,4
16164,А постоянно качать туда воду – никакой Силы не хватит.,А постоянно качать туда воду – никакой Силы не хвачу.,хватит,хвачу,Syntax,Subject-Predicate Agreement,genitive_subj_predicate_agreement_person,genitive_subj_predicate_agreement_person,librusec,3
10301,"Коли погибнут они, ведь наследников после тебя не останется.","Коли погибнут они, ведь наследников после тебя не останусь.",останется,останусь,Syntax,Subject-Predicate Agreement,genitive_subj_predicate_agreement_person,genitive_subj_predicate_agreement_person,librusec,4
16356,"Они знали, что плановых выключений в локальной ВР ВИН не бывает.","Они знали, что плановых выключений в локальной ВР ВИН не бываю.",бывает,бываю,Syntax,Subject-Predicate Agreement,genitive_subj_predicate_agreement_person,genitive_subj_predicate_agreement_person,librusec,4
