id,source_sentence,target_sentence,source_word,target_word,level,phenomenon,PID,subtype,domain,tree_depth
18838,И сейчас ничего не выйдет.,И сейчас ничего не выйду.,выйдет,выйду,Syntax,Subject-Predicate Agreement,genitive_subj_predicate_agreement_person,genitive_subj_predicate_agreement_person,librusec,1
18643,Только для меня времени не существует.,Только для меня времени не существую.,существует,существую,Syntax,Subject-Predicate Agreement,genitive_subj_predicate_agreement_person,genitive_subj_predicate_agreement_person,librusec,2
14458,Пока же ничего не выходит.,Пока же ничего не выхожу.,выходит,выхожу,Syntax,Subject-Predicate Agreement,genitive_subj_predicate_agreement_person,genitive_subj_predicate_agreement_person,librusec,2
14531,А молока не водится у нас.,А молока не вожусь у нас.,водится,вожусь,Syntax,Subject-Predicate Agreement,genitive_subj_predicate_agreement_person,genitive_subj_predicate_agreement_person,librusec,2
13205,Не может тут оказаться второго.,Не могу тут оказаться второго.,может,могу,Syntax,Subject-Predicate Agreement,genitive_subj_predicate_agreement_person,genitive_subj_predicate_agreement_person,librusec,2
10073,Мне ни хрена не полагается?,Мне ни хрена не полагаюсь?,полагается,полагаюсь,Syntax,Subject-Predicate Agreement,genitive_subj_predicate_agreement_person,genitive_subj_predicate_agreement_person,librusec,2
30657,У кино не бывает плохого конца.,У кино не бываю плохого конца.,бывает,бываю,Syntax,Subject-Predicate Agreement,genitive_subj_predicate_agreement_person,genitive_subj_predicate_agreement_person,librusec,3
29426,"Не станет тебя, назовет другого!","Не стану тебя, назовет другого!",станет,стану,Syntax,Subject-Predicate Agreement,genitive_subj_predicate_agreement_person,genitive_subj_predicate_agreement_person,librusec,2
17202,Да и простора здесь не хватает.,Да и простора здесь не хватаю.,хватает,хватаю,Syntax,Subject-Predicate Agreement,genitive_subj_predicate_agreement_person,genitive_subj_predicate_agreement_person,librusec,2
12552,"Не хватает одной, хоть убей!","Не хватаю одной, хоть убей!",хватает,хватаю,Syntax,Subject-Predicate Agreement,genitive_subj_predicate_agreement_person,genitive_subj_predicate_agreement_person,librusec,2
12286,Просто не хватает необходимой энергии.,Просто не хватаю необходимой энергии.,хватает,хватаю,Syntax,Subject-Predicate Agreement,genitive_subj_predicate_agreement_person,genitive_subj_predicate_agreement_person,librusec,2
9745,Встать без стакана сил не хватает.,Встать без стакана сил не хватаю.,хватает,хватаю,Syntax,Subject-Predicate Agreement,genitive_subj_predicate_agreement_person,genitive_subj_predicate_agreement_person,librusec,3
17729,От людей не остается вообще ничего.,От людей не остаюсь вообще ничего.,остается,остаюсь,Syntax,Subject-Predicate Agreement,genitive_subj_predicate_agreement_person,genitive_subj_predicate_agreement_person,librusec,3
22676,Нам и так рук не хватает.,Нам и так рук не хватаю.,хватает,хватаю,Syntax,Subject-Predicate Agreement,genitive_subj_predicate_agreement_person,genitive_subj_predicate_agreement_person,librusec,2
21867,А крыльев у Виго не имеется...,А крыльев у Виго не имеюсь...,имеется,имеюсь,Syntax,Subject-Predicate Agreement,genitive_subj_predicate_agreement_person,genitive_subj_predicate_agreement_person,librusec,2
13099,Один только Желтых не медлит.,Один только Желтых не медлю.,медлит,медлю,Syntax,Subject-Predicate Agreement,genitive_subj_predicate_agreement_person,genitive_subj_predicate_agreement_person,librusec,3
18662,Не хотят ноги слушаться его.,Не хотим ноги слушаться его.,хотят,хотим,Syntax,Subject-Predicate Agreement,genitive_subj_predicate_agreement_person,genitive_subj_predicate_agreement_person,librusec,2
12177,От печати смерти не существует противодействий.,От печати смерти не существую противодействий.,существует,существую,Syntax,Subject-Predicate Agreement,genitive_subj_predicate_agreement_person,genitive_subj_predicate_agreement_person,librusec,2
35527,чего у нас также не имеется.,чего у нас также не имеюсь.,имеется,имеюсь,Syntax,Subject-Predicate Agreement,genitive_subj_predicate_agreement_person,genitive_subj_predicate_agreement_person,librusec,2
22175,В такой ничего не случается.,В такой ничего не случаюсь.,случается,случаюсь,Syntax,Subject-Predicate Agreement,genitive_subj_predicate_agreement_person,genitive_subj_predicate_agreement_person,librusec,2
9252,Но стража долго не идет.,Но стража долго не иду.,идет,иду,Syntax,Subject-Predicate Agreement,genitive_subj_predicate_agreement_person,genitive_subj_predicate_agreement_person,librusec,1
29508,Не происходит и разрушения клетки.,Не происхожу и разрушения клетки.,происходит,происхожу,Syntax,Subject-Predicate Agreement,genitive_subj_predicate_agreement_person,genitive_subj_predicate_agreement_person,librusec,2
17244,Здесь его семье ничего не грозит.,Здесь его семье ничего не грожу.,грозит,грожу,Syntax,Subject-Predicate Agreement,genitive_subj_predicate_agreement_person,genitive_subj_predicate_agreement_person,librusec,2
34872,Проклятия семьи Браккер не существует!,Проклятия семьи Браккер не существую!,существует,существую,Syntax,Subject-Predicate Agreement,genitive_subj_predicate_agreement_person,genitive_subj_predicate_agreement_person,librusec,3
14005,У беременных не бывает этики.,У беременных не бываю этики.,бывает,бываю,Syntax,Subject-Predicate Agreement,genitive_subj_predicate_agreement_person,genitive_subj_predicate_agreement_person,librusec,2
17538,В Дэвидшеме никогда ничего не случается.,В Дэвидшеме никогда ничего не случаюсь.,случается,случаюсь,Syntax,Subject-Predicate Agreement,genitive_subj_predicate_agreement_person,genitive_subj_predicate_agreement_person,librusec,2
36172,Но чего не бывает в семье!,Но чего не бываю в семье!,бывает,бываю,Syntax,Subject-Predicate Agreement,genitive_subj_predicate_agreement_person,genitive_subj_predicate_agreement_person,librusec,2
11515,Ничего на вас не вырастет!,Ничего на вас не вырасту!,вырастет,вырасту,Syntax,Subject-Predicate Agreement,genitive_subj_predicate_agreement_person,genitive_subj_predicate_agreement_person,librusec,2
20653,Не может быть там истинного.,Не могу быть там истинного.,может,могу,Syntax,Subject-Predicate Agreement,genitive_subj_predicate_agreement_person,genitive_subj_predicate_agreement_person,librusec,2
22892,Не существует даже тайны вокруг этого.,Не существую даже тайны вокруг этого.,существует,существую,Syntax,Subject-Predicate Agreement,genitive_subj_predicate_agreement_person,genitive_subj_predicate_agreement_person,librusec,3
18439,Нас ведь днем не бывает.,Нас ведь днем не бываешь.,бывает,бываешь,Syntax,Subject-Predicate Agreement,genitive_subj_predicate_agreement_person,genitive_subj_predicate_agreement_person,librusec,1
12968,Другого такого больше не представится.,Другого такого больше не представлюсь.,представится,представлюсь,Syntax,Subject-Predicate Agreement,genitive_subj_predicate_agreement_person,genitive_subj_predicate_agreement_person,librusec,2
23014,Но некоторых предметов одежды не хватает.,Но некоторых предметов одежды не хватаю.,хватает,хватаю,Syntax,Subject-Predicate Agreement,genitive_subj_predicate_agreement_person,genitive_subj_predicate_agreement_person,librusec,2
13226,Тут нам ничего не отломится.,Тут нам ничего не отломлюсь.,отломится,отломлюсь,Syntax,Subject-Predicate Agreement,genitive_subj_predicate_agreement_person,genitive_subj_predicate_agreement_person,librusec,1
17380,И участкового там не бывает.,И участкового там не бываю.,бывает,бываю,Syntax,Subject-Predicate Agreement,genitive_subj_predicate_agreement_person,genitive_subj_predicate_agreement_person,librusec,1
30203,"Чего не хватает, там купит.","Чего не хватаю, там купит.",хватает,хватаю,Syntax,Subject-Predicate Agreement,genitive_subj_predicate_agreement_person,genitive_subj_predicate_agreement_person,librusec,2
15111,Словно здесь проблем не хватает!,Словно здесь проблем не хватаю!,хватает,хватаю,Syntax,Subject-Predicate Agreement,genitive_subj_predicate_agreement_person,genitive_subj_predicate_agreement_person,librusec,1
27393,Как мне не хватает Тоби.,Как мне не хватаю Тоби.,хватает,хватаю,Syntax,Subject-Predicate Agreement,genitive_subj_predicate_agreement_person,genitive_subj_predicate_agreement_person,librusec,1
22003,Вдруг нам не хватит понимания.,Вдруг нам не хвачу понимания.,хватит,хвачу,Syntax,Subject-Predicate Agreement,genitive_subj_predicate_agreement_person,genitive_subj_predicate_agreement_person,librusec,1
34910,В Гиркании не бывает худых лет.,В Гиркании не бываю худых лет.,бывает,бываю,Syntax,Subject-Predicate Agreement,genitive_subj_predicate_agreement_person,genitive_subj_predicate_agreement_person,librusec,3
16363,Только особого веселья не выйдет.,Только особого веселья не выйду.,выйдет,выйду,Syntax,Subject-Predicate Agreement,genitive_subj_predicate_agreement_person,genitive_subj_predicate_agreement_person,librusec,2
20549,Здесь не существует прямых дорог!,Здесь не существую прямых дорог!,существует,существую,Syntax,Subject-Predicate Agreement,genitive_subj_predicate_agreement_person,genitive_subj_predicate_agreement_person,librusec,2
22997,Однажды не останется и их.,Однажды не останусь и их.,останется,останусь,Syntax,Subject-Predicate Agreement,genitive_subj_predicate_agreement_person,genitive_subj_predicate_agreement_person,librusec,2
30049,Его от него не убежит.,Его от него не убегу.,убежит,убегу,Syntax,Subject-Predicate Agreement,genitive_subj_predicate_agreement_person,genitive_subj_predicate_agreement_person,librusec,2
33109,Без устройства ничего не дается.,Без устройства ничего не даюсь.,дается,даюсь,Syntax,Subject-Predicate Agreement,genitive_subj_predicate_agreement_person,genitive_subj_predicate_agreement_person,librusec,2
20949,За семь минут ничего не изменится.,За семь минут ничего не изменюсь.,изменится,изменюсь,Syntax,Subject-Predicate Agreement,genitive_subj_predicate_agreement_person,genitive_subj_predicate_agreement_person,librusec,2
24844,У нас даже людей не хватает!,У нас даже людей не хватаю!,хватает,хватаю,Syntax,Subject-Predicate Agreement,genitive_subj_predicate_agreement_person,genitive_subj_predicate_agreement_person,librusec,3
22714,"Этого не может быть, Сент!","Этого не могу быть, Сент!",может,могу,Syntax,Subject-Predicate Agreement,genitive_subj_predicate_agreement_person,genitive_subj_predicate_agreement_person,librusec,2
12720,"Но допустим, Бенедикта не придет?","Но допустим, Бенедикта не приду?",придет,приду,Syntax,Subject-Predicate Agreement,genitive_subj_predicate_agreement_person,genitive_subj_predicate_agreement_person,librusec,2
29547,Тогда отторжения ее не происходит.,Тогда отторжения ее не происхожу.,происходит,происхожу,Syntax,Subject-Predicate Agreement,genitive_subj_predicate_agreement_person,genitive_subj_predicate_agreement_person,librusec,2
21298,Нам даже не требуется глушилок.,Нам даже не требуюсь глушилок.,требуется,требуюсь,Syntax,Subject-Predicate Agreement,genitive_subj_predicate_agreement_person,genitive_subj_predicate_agreement_person,librusec,2
34779,Или даже этого не может?,Или даже этого не могу?,может,могу,Syntax,Subject-Predicate Agreement,genitive_subj_predicate_agreement_person,genitive_subj_predicate_agreement_person,librusec,2
15381,В метро других не бывает.,В метро других не бываю.,бывает,бываю,Syntax,Subject-Predicate Agreement,genitive_subj_predicate_agreement_person,genitive_subj_predicate_agreement_person,librusec,2
35058,Не останется следов твоего поиска?,Не останусь следов твоего поиска?,останется,останусь,Syntax,Subject-Predicate Agreement,genitive_subj_predicate_agreement_person,genitive_subj_predicate_agreement_person,librusec,3
33485,А Тарги действительно больше не существует.,А Тарги действительно больше не существую.,существует,существую,Syntax,Subject-Predicate Agreement,genitive_subj_predicate_agreement_person,genitive_subj_predicate_agreement_person,librusec,2
15685,Никакой жалелки на них не хватит.,Никакой жалелки на них не хвачу.,хватит,хвачу,Syntax,Subject-Predicate Agreement,genitive_subj_predicate_agreement_person,genitive_subj_predicate_agreement_person,librusec,3
18982,Но правильной идеи не существует.,Но правильной идеи не существую.,существует,существую,Syntax,Subject-Predicate Agreement,genitive_subj_predicate_agreement_person,genitive_subj_predicate_agreement_person,librusec,2
14676,Живности нормальной и то не водится.,Живности нормальной и то не вожусь.,водится,вожусь,Syntax,Subject-Predicate Agreement,genitive_subj_predicate_agreement_person,genitive_subj_predicate_agreement_person,librusec,3
20662,Прежнего Стинова больше не существует.,Прежнего Стинова больше не существую.,существует,существую,Syntax,Subject-Predicate Agreement,genitive_subj_predicate_agreement_person,genitive_subj_predicate_agreement_person,librusec,2
15841,Леденчика за то не найдется?,Леденчика за то не найдусь?,найдется,найдусь,Syntax,Subject-Predicate Agreement,genitive_subj_predicate_agreement_person,genitive_subj_predicate_agreement_person,librusec,2
30095,Что хорошего быть ничего не может.,Что хорошего быть ничего не могу.,может,могу,Syntax,Subject-Predicate Agreement,genitive_subj_predicate_agreement_person,genitive_subj_predicate_agreement_person,librusec,2
22463,А вообще – передышек не бывает.,А вообще – передышек не бываю.,бывает,бываю,Syntax,Subject-Predicate Agreement,genitive_subj_predicate_agreement_person,genitive_subj_predicate_agreement_person,librusec,2
19582,Да и данных не хватает.,Да и данных не хватаю.,хватает,хватаю,Syntax,Subject-Predicate Agreement,genitive_subj_predicate_agreement_person,genitive_subj_predicate_agreement_person,librusec,2
29926,Для Симорона не бывает безвыходных ситуаций.,Для Симорона не бываю безвыходных ситуаций.,бывает,бываю,Syntax,Subject-Predicate Agreement,genitive_subj_predicate_agreement_person,genitive_subj_predicate_agreement_person,librusec,3
27051,Вот черту места и не остается.,Вот черту места и не остаюсь.,остается,остаюсь,Syntax,Subject-Predicate Agreement,genitive_subj_predicate_agreement_person,genitive_subj_predicate_agreement_person,librusec,2
21023,И мне не хватает друга.,И мне не хватаю друга.,хватает,хватаю,Syntax,Subject-Predicate Agreement,genitive_subj_predicate_agreement_person,genitive_subj_predicate_agreement_person,librusec,1
28232,Из речи ничего не следует.,Из речи ничего не следую.,следует,следую,Syntax,Subject-Predicate Agreement,genitive_subj_predicate_agreement_person,genitive_subj_predicate_agreement_person,wikinews,2
34481,Его и не может быть.,Его и не могу быть.,может,могу,Syntax,Subject-Predicate Agreement,genitive_subj_predicate_agreement_person,genitive_subj_predicate_agreement_person,wikinews,2
38175,Пока этого не существует в РФ.,Пока этого не существую в РФ.,существует,существую,Syntax,Subject-Predicate Agreement,genitive_subj_predicate_agreement_person,genitive_subj_predicate_agreement_person,wikinews,2
44102,Без вас ничего не получится.,Без вас ничего не получусь.,получится,получусь,Syntax,Subject-Predicate Agreement,genitive_subj_predicate_agreement_person,genitive_subj_predicate_agreement_person,wikinews,2
3949,Или нынче школьных бригад не существует?,Или нынче школьных бригад не существую?,существует,существую,Syntax,Subject-Predicate Agreement,genitive_subj_predicate_agreement_person,genitive_subj_predicate_agreement_person,wikinews,2
41995,Без этого побед не бывает.,Без этого побед не бываю.,бывает,бываю,Syntax,Subject-Predicate Agreement,genitive_subj_predicate_agreement_person,genitive_subj_predicate_agreement_person,wikinews,2
4102,Но этого ничего не происходит.,Но этого ничего не происхожу.,происходит,происхожу,Syntax,Subject-Predicate Agreement,genitive_subj_predicate_agreement_person,genitive_subj_predicate_agreement_person,wikinews,2
669,Медального плана у тренеров не бывает.,Медального плана у тренеров не бываю.,бывает,бываю,Syntax,Subject-Predicate Agreement,genitive_subj_predicate_agreement_person,genitive_subj_predicate_agreement_person,wikinews,3
3140,Финских саун тоже не имеется.,Финских саун тоже не имеюсь.,имеется,имеюсь,Syntax,Subject-Predicate Agreement,genitive_subj_predicate_agreement_person,genitive_subj_predicate_agreement_person,wikinews,2
3101,Новости сегодня не может быть.,Новости сегодня не могу быть.,может,могу,Syntax,Subject-Predicate Agreement,genitive_subj_predicate_agreement_person,genitive_subj_predicate_agreement_person,wikinews,1
533,Других политических воль не существует.,Других политических воль не существую.,существует,существую,Syntax,Subject-Predicate Agreement,genitive_subj_predicate_agreement_person,genitive_subj_predicate_agreement_person,wikinews,2
43203,Мечетей не хватает - это очевидно.,Мечетей не хватаю - это очевидно.,хватает,хватаю,Syntax,Subject-Predicate Agreement,genitive_subj_predicate_agreement_person,genitive_subj_predicate_agreement_person,wikinews,2
38635,А Смолову не хватает движения.,А Смолову не хватаю движения.,хватает,хватаю,Syntax,Subject-Predicate Agreement,genitive_subj_predicate_agreement_person,genitive_subj_predicate_agreement_person,wikinews,1
4558,Не бывает порядка во время ремонта.,Не бываю порядка во время ремонта.,бывает,бываю,Syntax,Subject-Predicate Agreement,genitive_subj_predicate_agreement_person,genitive_subj_predicate_agreement_person,wikinews,3
42530,А этого не происходит совершенно.,А этого не происхожу совершенно.,происходит,происхожу,Syntax,Subject-Predicate Agreement,genitive_subj_predicate_agreement_person,genitive_subj_predicate_agreement_person,wikinews,1
24098,В целом мне не хватит фокуса.,В целом мне не хвачу фокуса.,хватит,хвачу,Syntax,Subject-Predicate Agreement,genitive_subj_predicate_agreement_person,genitive_subj_predicate_agreement_person,wikinews,2
45445,Очень не хватает именно теории.,Очень не хватаю именно теории.,хватает,хватаю,Syntax,Subject-Predicate Agreement,genitive_subj_predicate_agreement_person,genitive_subj_predicate_agreement_person,wikinews,2
44423,Но им этого не удастся.,Но им этого не удамся.,удастся,удамся,Syntax,Subject-Predicate Agreement,genitive_subj_predicate_agreement_person,genitive_subj_predicate_agreement_person,wikinews,1
5318,Жизни издоровью Тулеева ничего не угрожает.,Жизни издоровью Тулеева ничего не угрожаю.,угрожает,угрожаю,Syntax,Subject-Predicate Agreement,genitive_subj_predicate_agreement_person,genitive_subj_predicate_agreement_person,wikinews,3
44852,В кино не хватает материала.,В кино не хватаю материала.,хватает,хватаю,Syntax,Subject-Predicate Agreement,genitive_subj_predicate_agreement_person,genitive_subj_predicate_agreement_person,wikinews,2
42205,Больше ничего не потребуется пока.,Больше ничего не потребуюсь пока.,потребуется,потребуюсь,Syntax,Subject-Predicate Agreement,genitive_subj_predicate_agreement_person,genitive_subj_predicate_agreement_person,wikinews,2
5589,Немного не хватит ему опыта.,Немного не хвачу ему опыта.,хватит,хвачу,Syntax,Subject-Predicate Agreement,genitive_subj_predicate_agreement_person,genitive_subj_predicate_agreement_person,wikinews,2
2276,Ничего без трудов не дается.,Ничего без трудов не даюсь.,дается,даюсь,Syntax,Subject-Predicate Agreement,genitive_subj_predicate_agreement_person,genitive_subj_predicate_agreement_person,wikinews,2
3126,О потерях сторон данных не приводится.,О потерях сторон данных не привожусь.,приводится,привожусь,Syntax,Subject-Predicate Agreement,genitive_subj_predicate_agreement_person,genitive_subj_predicate_agreement_person,wikinews,3
45913,У меня практически не бывает травм.,У меня практически не бываю травм.,бывает,бываю,Syntax,Subject-Predicate Agreement,genitive_subj_predicate_agreement_person,genitive_subj_predicate_agreement_person,wikinews,3
28736,Но определенных сроков пока не называется.,Но определенных сроков пока не называюсь.,называется,называюсь,Syntax,Subject-Predicate Agreement,genitive_subj_predicate_agreement_person,genitive_subj_predicate_agreement_person,wikinews,2
