id,source_sentence,target_sentence,source_word,target_word,level,phenomenon,PID,subtype,domain,tree_depth
18169,"Да у вас у половины уже не стоит, особенно в такой ситуации, как здесь.","Да у вас у половины уже не стою, особенно в такой ситуации, как здесь.",стоит,стою,Syntax,Subject-Predicate Agreement,genitive_subj_predicate_agreement_person,genitive_subj_predicate_agreement_person,librusec,6
17992,"Легенде — потому, что исторических точных свидетельств о существовании Анаркали и ее любви к Принцу не существует.","Легенде — потому, что исторических точных свидетельств о существовании Анаркали и ее любви к Принцу не существую.",существует,существую,Syntax,Subject-Predicate Agreement,genitive_subj_predicate_agreement_person,genitive_subj_predicate_agreement_person,librusec,6
34758,"После чего, если ничего такого не произойдет, все покидаем дворец и быстро в порт.","После чего, если ничего такого не произойду, все покидаем дворец и быстро в порт.",произойдет,произойду,Syntax,Subject-Predicate Agreement,genitive_subj_predicate_agreement_person,genitive_subj_predicate_agreement_person,librusec,5
29396,"""А если ничего не случится, тем лучше, – подумал синх, – жаль будет, если Фэнтар приберет ийлура"".","""А если ничего не случусь, тем лучше, – подумал синх, – жаль будет, если Фэнтар приберет ийлура"".",случится,случусь,Syntax,Subject-Predicate Agreement,genitive_subj_predicate_agreement_person,genitive_subj_predicate_agreement_person,librusec,5
13086,"На первый не поедем – ничего, кроме воды и тьмы, там не ждет.","На первый не поедем – ничего, кроме воды и тьмы, там не жду.",ждет,жду,Syntax,Subject-Predicate Agreement,genitive_subj_predicate_agreement_person,genitive_subj_predicate_agreement_person,librusec,6
35849,"Так, а мне и думать нечего — Женек Бульканов наверняка уже несет вахту возле обменки на проспекте, где сейчас не хватает только детектива Тани Ивановой!","Так, а мне и думать нечего — Женек Бульканов наверняка уже несет вахту возле обменки на проспекте, где сейчас не хватаю только детектива Тани Ивановой!",хватает,хватаю,Syntax,Subject-Predicate Agreement,genitive_subj_predicate_agreement_person,genitive_subj_predicate_agreement_person,librusec,10
18590,"Нет, никак на это моего согласия не может быть, чтобы Пиратку продавать.","Нет, никак на это моего согласия не могу быть, чтобы Пиратку продавать.",может,могу,Syntax,Subject-Predicate Agreement,genitive_subj_predicate_agreement_person,genitive_subj_predicate_agreement_person,librusec,6
24414,"Ведь сил никакого мага не хватит отразить удар, коли мне вздумается атаковать вас.","Ведь сил никакого мага не хвачу отразить удар, коли мне вздумается атаковать вас.",хватит,хвачу,Syntax,Subject-Predicate Agreement,genitive_subj_predicate_agreement_person,genitive_subj_predicate_agreement_person,librusec,6
14022,"Может и намного больше пяти тысяч, только вот, если откровенно, не выходит пока ничего.","Может и намного больше пяти тысяч, только вот, если откровенно, не выхожу пока ничего.",выходит,выхожу,Syntax,Subject-Predicate Agreement,genitive_subj_predicate_agreement_person,genitive_subj_predicate_agreement_person,librusec,6
22791,"Машутка попыталась незаметно оглядеться – не слушают ли соседки, чего ей боярин предлагает?","Машутка попыталась незаметно оглядеться – не слушаете ли соседки, чего ей боярин предлагает?",слушают,слушаете,Syntax,Subject-Predicate Agreement,genitive_subj_predicate_agreement_person,genitive_subj_predicate_agreement_person,librusec,4
16524,"Я ведь тоже не бог, я другой схемой занимался, на все внимания не хватает.","Я ведь тоже не бог, я другой схемой занимался, на все внимания не хватаю.",хватает,хватаю,Syntax,Subject-Predicate Agreement,genitive_subj_predicate_agreement_person,genitive_subj_predicate_agreement_person,librusec,5
26062,"В последнем знательно ничего не прибавляется, но бывает строй сердца другой и другой вкус в знаемом.","В последнем знательно ничего не прибавляюсь, но бывает строй сердца другой и другой вкус в знаемом.",прибавляется,прибавляюсь,Syntax,Subject-Predicate Agreement,genitive_subj_predicate_agreement_person,genitive_subj_predicate_agreement_person,librusec,8
12610,"Если не проверять директоров магазинов лично, то все растащат и пожаров не понадобится.","Если не проверять директоров магазинов лично, то все растащат и пожаров не понадоблюсь.",понадобится,понадоблюсь,Syntax,Subject-Predicate Agreement,genitive_subj_predicate_agreement_person,genitive_subj_predicate_agreement_person,librusec,4
14123,"А что ничего не происходит – видите, вам уже от этого не по себе.","А что ничего не происхожу – видите, вам уже от этого не по себе.",происходит,происхожу,Syntax,Subject-Predicate Agreement,genitive_subj_predicate_agreement_person,genitive_subj_predicate_agreement_person,librusec,4
22099,"Тогда вы будете постоянно полагаться на внешние часы, потому что во внутреннем мире просто вечноетеперь, там ничего не движется.","Тогда вы будете постоянно полагаться на внешние часы, потому что во внутреннем мире просто вечноетеперь, там ничего не движусь.",движется,движусь,Syntax,Subject-Predicate Agreement,genitive_subj_predicate_agreement_person,genitive_subj_predicate_agreement_person,librusec,6
14894,"Поэтому их жизнь пресна, в ней не хватает щепотки соли и другой – едучего перца.","Поэтому их жизнь пресна, в ней не хватаю щепотки соли и другой – едучего перца.",хватает,хватаю,Syntax,Subject-Predicate Agreement,genitive_subj_predicate_agreement_person,genitive_subj_predicate_agreement_person,librusec,8
16436,Важно главное: пока не сделал это дело (любой сложности) – другого не возникнет.,Важно главное: пока не сделал это дело (любой сложности) – другого не возникну.,возникнет,возникну,Syntax,Subject-Predicate Agreement,genitive_subj_predicate_agreement_person,genitive_subj_predicate_agreement_person,librusec,6
12613,"Словно не бывает Светок, например, ткачих или там врачих и одновременно не встречается парикмахерш Лен и Наташ.","Словно не бывает Светок, например, ткачих или там врачих и одновременно не встречаюсь парикмахерш Лен и Наташ.",встречается,встречаюсь,Syntax,Subject-Predicate Agreement,genitive_subj_predicate_agreement_person,genitive_subj_predicate_agreement_person,librusec,9
16850,"И самая кошмарная драма слишком скоро забывается, и почти ничего от нее не остается.","И самая кошмарная драма слишком скоро забывается, и почти ничего от нее не остаюсь.",остается,остаюсь,Syntax,Subject-Predicate Agreement,genitive_subj_predicate_agreement_person,genitive_subj_predicate_agreement_person,librusec,7
11927,"Именно прозрачный, так что внутри проглядываются какие-то части, а колеса - белее не бывает.","Именно прозрачный, так что внутри проглядываются какие-то части, а колеса - белее не бываю.",бывает,бываю,Syntax,Subject-Predicate Agreement,genitive_subj_predicate_agreement_person,genitive_subj_predicate_agreement_person,librusec,6
35463,"Мне давно этого не хватает, если точно – с тех пор, как родился Трей.","Мне давно этого не хватаю, если точно – с тех пор, как родился Трей.",хватает,хватаю,Syntax,Subject-Predicate Agreement,genitive_subj_predicate_agreement_person,genitive_subj_predicate_agreement_person,librusec,4
18849,"Ну а если никакого Бервика там не окажется, стало быть – короткий бой и бегство на Пирр.","Ну а если никакого Бервика там не окажусь, стало быть – короткий бой и бегство на Пирр.",окажется,окажусь,Syntax,Subject-Predicate Agreement,genitive_subj_predicate_agreement_person,genitive_subj_predicate_agreement_person,librusec,7
12182,"Конечно, и я – не Эрт Благолепный, и не мне заниматься улучшением нравов, а если бы и решился вдруг, боюсь, не хватит времени.","Конечно, и я – не Эрт Благолепный, и не мне заниматься улучшением нравов, а если бы и решился вдруг, боюсь, не хвачу времени.",хватит,хвачу,Syntax,Subject-Predicate Agreement,genitive_subj_predicate_agreement_person,genitive_subj_predicate_agreement_person,librusec,8
27686,"Не погонит же Настя друзей, так называемых друзей, которые входят гурьбой и берут то и се.","Не погоним же Настя друзей, так называемых друзей, которые входят гурьбой и берут то и се.",погонит,погоним,Syntax,Subject-Predicate Agreement,genitive_subj_predicate_agreement_person,genitive_subj_predicate_agreement_person,librusec,8
29181,"Пусть Брикрен и Даохан мак Минид истребляют друг друга как можно больше, а нам потом не составит труда добить оставшегося победителем.","Пусть Брикрен и Даохан мак Минид истребляют друг друга как можно больше, а нам потом не составлю труда добить оставшегося победителем.",составит,составлю,Syntax,Subject-Predicate Agreement,genitive_subj_predicate_agreement_person,genitive_subj_predicate_agreement_person,librusec,9
30807,"Вдруг им для ровного счета двух бандитов не хватает, — ответила я с досадой и обидой.","Вдруг им для ровного счета двух бандитов не хватаю, — ответила я с досадой и обидой.",хватает,хватаю,Syntax,Subject-Predicate Agreement,genitive_subj_predicate_agreement_person,genitive_subj_predicate_agreement_person,librusec,6
29394,"Больше Храм не желает идти на такие жертвы, а потому нам ничего не остается, как направить тебя.","Больше Храм не желает идти на такие жертвы, а потому нам ничего не остаюсь, как направить тебя.",остается,остаюсь,Syntax,Subject-Predicate Agreement,genitive_subj_predicate_agreement_person,genitive_subj_predicate_agreement_person,librusec,6
14559,"И кажется, когда не станет его, он уйдет за край того неба.","И кажется, когда не стану его, он уйдет за край того неба.",станет,стану,Syntax,Subject-Predicate Agreement,genitive_subj_predicate_agreement_person,genitive_subj_predicate_agreement_person,librusec,5
10904,"Никаких кулевок и мантышника в природе не существует, я специально произнесла первые пришедшие на ум слова и поймала вас.","Никаких кулевок и мантышника в природе не существую, я специально произнесла первые пришедшие на ум слова и поймала вас.",существует,существую,Syntax,Subject-Predicate Agreement,genitive_subj_predicate_agreement_person,genitive_subj_predicate_agreement_person,librusec,9
19799,"Зато на береговом припае наст схватился так, что не останется никаких следов моих эволюций.","Зато на береговом припае наст схватился так, что не останусь никаких следов моих эволюций.",останется,останусь,Syntax,Subject-Predicate Agreement,genitive_subj_predicate_agreement_person,genitive_subj_predicate_agreement_person,librusec,6
28915,"Казалось, что в его достохвальном отделе не скрывается больше никаких тайн для меня.","Казалось, что в его достохвальном отделе не скрываюсь больше никаких тайн для меня.",скрывается,скрываюсь,Syntax,Subject-Predicate Agreement,genitive_subj_predicate_agreement_person,genitive_subj_predicate_agreement_person,librusec,5
27811,"И передайте Энсону Бергу, что скоро никаких нор к востоку от гор не останется.","И передайте Энсону Бергу, что скоро никаких нор к востоку от гор не останусь.",останется,останусь,Syntax,Subject-Predicate Agreement,genitive_subj_predicate_agreement_person,genitive_subj_predicate_agreement_person,librusec,6
11199,"И по глазам Огнеяра Светел понял, что для Дивия его тайны больше не существует.","И по глазам Огнеяра Светел понял, что для Дивия его тайны больше не существую.",существует,существую,Syntax,Subject-Predicate Agreement,genitive_subj_predicate_agreement_person,genitive_subj_predicate_agreement_person,librusec,5
21622,"Собралась я домой, да думаю, вот только часы продам, тут ошибки не выйдет, подходящих магазинов – сколько хочешь.","Собралась я домой, да думаю, вот только часы продам, тут ошибки не выйду, подходящих магазинов – сколько хочешь.",выйдет,выйду,Syntax,Subject-Predicate Agreement,genitive_subj_predicate_agreement_person,genitive_subj_predicate_agreement_person,librusec,8
10826,"Никогда нет причин для горя, от воды ни денег, ни счастья не прибудет!","Никогда нет причин для горя, от воды ни денег, ни счастья не прибуду!",прибудет,прибуду,Syntax,Subject-Predicate Agreement,genitive_subj_predicate_agreement_person,genitive_subj_predicate_agreement_person,librusec,7
18434,"При моей болезни ничего не болит у человека, все у него замечательно и все анализы – на большой.","При моей болезни ничего не болею у человека, все у него замечательно и все анализы – на большой.",болит,болею,Syntax,Subject-Predicate Agreement,genitive_subj_predicate_agreement_person,genitive_subj_predicate_agreement_person,librusec,7
9492,"Прохода на юг ему не дает новой заморочкой — не проделками мертвяков, а собственной удавкой.","Прохода на юг ему не даю новой заморочкой — не проделками мертвяков, а собственной удавкой.",дает,даю,Syntax,Subject-Predicate Agreement,genitive_subj_predicate_agreement_person,genitive_subj_predicate_agreement_person,librusec,6
17081,"И даже той страны более не существует, она стала автономной областью с иным названием, – перевел подругам господин Лесенков ответ Фаруха.","И даже той страны более не существую, она стала автономной областью с иным названием, – перевел подругам господин Лесенков ответ Фаруха.",существует,существую,Syntax,Subject-Predicate Agreement,genitive_subj_predicate_agreement_person,genitive_subj_predicate_agreement_person,librusec,9
32467,Для этого отмеренного вами себе заграницей еще только годичного срока уж никак не хватит.,Для этого отмеренного вами себе заграницей еще только годичного срока уж никак не хвачу.,хватит,хвачу,Syntax,Subject-Predicate Agreement,genitive_subj_predicate_agreement_person,genitive_subj_predicate_agreement_person,librusec,7
25643,"И, наивным ребенком посмотрев на Илью, он смело поинтересовался, а не найдется ли у него для коллекции самородочка с небольшой кулак (ничего себе потребности!).","И, наивным ребенком посмотрев на Илью, он смело поинтересовался, а не найдусь ли у него для коллекции самородочка с небольшой кулак (ничего себе потребности!).",найдется,найдусь,Syntax,Subject-Predicate Agreement,genitive_subj_predicate_agreement_person,genitive_subj_predicate_agreement_person,librusec,12
11230,"Тинг Квиттингского Востока примет такое решение, потому что другого и быть не может!","Тинг Квиттингского Востока примет такое решение, потому что другого и быть не могу!",может,могу,Syntax,Subject-Predicate Agreement,genitive_subj_predicate_agreement_person,genitive_subj_predicate_agreement_person,librusec,7
20469,"Чтобы решать с Гриней, не хватает нам информации от наших друзей из ФСБ.","Чтобы решать с Гриней, не хватаю нам информации от наших друзей из ФСБ.",хватает,хватаю,Syntax,Subject-Predicate Agreement,genitive_subj_predicate_agreement_person,genitive_subj_predicate_agreement_person,librusec,6
10009,"Правда, после четвертого вспомнили, что на Лохудринске такой должности не существует, и вообще, нет никакой власти.","Правда, после четвертого вспомнили, что на Лохудринске такой должности не существую, и вообще, нет никакой власти.",существует,существую,Syntax,Subject-Predicate Agreement,genitive_subj_predicate_agreement_person,genitive_subj_predicate_agreement_person,librusec,8
16803,"Полгода он объяснял Корве, что у него ничего не получится, Юхра всегда так начинает.","Полгода он объяснял Корве, что у него ничего не получусь, Юхра всегда так начинает.",получится,получусь,Syntax,Subject-Predicate Agreement,genitive_subj_predicate_agreement_person,genitive_subj_predicate_agreement_person,librusec,4
12416,"Если тренировать силу по многим мышцам, а они нужны практически все, – не хватит жизни.","Если тренировать силу по многим мышцам, а они нужны практически все, – не хвачу жизни.",хватит,хвачу,Syntax,Subject-Predicate Agreement,genitive_subj_predicate_agreement_person,genitive_subj_predicate_agreement_person,librusec,5
14064,"По остаточной активности М-поля не выйдет, а вот по кинематографической внешности – пожалуй.","По остаточной активности М-поля не выйду, а вот по кинематографической внешности – пожалуй.",выйдет,выйду,Syntax,Subject-Predicate Agreement,genitive_subj_predicate_agreement_person,genitive_subj_predicate_agreement_person,librusec,4
31680,"Поэтому мне этой визы не хватит, и нужно все вопросы решить именно сейчас.","Поэтому мне этой визы не хвачу, и нужно все вопросы решить именно сейчас.",хватит,хвачу,Syntax,Subject-Predicate Agreement,genitive_subj_predicate_agreement_person,genitive_subj_predicate_agreement_person,wikinews,6
44194,"Но такой категории в головах этой группы вообще не присутствует, о чем буквально кричит заявление Золотова о том, какие надо куда передвинуть сроки.","Но такой категории в головах этой группы вообще не присутствую, о чем буквально кричит заявление Золотова о том, какие надо куда передвинуть сроки.",присутствует,присутствую,Syntax,Subject-Predicate Agreement,genitive_subj_predicate_agreement_person,genitive_subj_predicate_agreement_person,wikinews,12
36972,"Даже, никакого Рэя Куни — потому что переводных пьес здесь тоже не бывает.","Даже, никакого Рэя Куни — потому что переводных пьес здесь тоже не бываю.",бывает,бываю,Syntax,Subject-Predicate Agreement,genitive_subj_predicate_agreement_person,genitive_subj_predicate_agreement_person,wikinews,5
39419,"Теперь остатки Сельдяного канала взяли в трубу, и полноценного моста больше не понадобится.","Теперь остатки Сельдяного канала взяли в трубу, и полноценного моста больше не понадоблюсь.",понадобится,понадоблюсь,Syntax,Subject-Predicate Agreement,genitive_subj_predicate_agreement_person,genitive_subj_predicate_agreement_person,wikinews,6
