id,source_sentence,target_sentence,source_word,target_word,level,phenomenon,PID,subtype,domain,tree_depth
292201,Этим ХБ можешь драить гальюн...,Этим ХБ могу драить гальюн...,можешь,могу,Syntax,Subject-Predicate Agreement,noun_subj_predicate_agreement_person,noun_subj_predicate_agreement_person,librusec,2
338584,Некоторые государства держат открыто корабли смерти.,Некоторые государства держим открыто корабли смерти.,держат,держим,Syntax,Subject-Predicate Agreement,noun_subj_predicate_agreement_person,noun_subj_predicate_agreement_person,librusec,3
307510,А чем газета отличается от науки?,А чем газета отличаюсь от науки?,отличается,отличаюсь,Syntax,Subject-Predicate Agreement,noun_subj_predicate_agreement_person,noun_subj_predicate_agreement_person,librusec,2
324744,Это Оно ведет его на восток.,Это Оно веду его на восток.,ведет,веду,Syntax,Subject-Predicate Agreement,noun_subj_predicate_agreement_person,noun_subj_predicate_agreement_person,librusec,3
258360,А первый второго скоро съест.,А первый второго скоро съем.,съест,съем,Syntax,Subject-Predicate Agreement,noun_subj_predicate_agreement_person,noun_subj_predicate_agreement_person,librusec,1
326375,Много ли сыра человеку требуется?,Много ли сыра человеку требуюсь?,требуется,требуюсь,Syntax,Subject-Predicate Agreement,noun_subj_predicate_agreement_person,noun_subj_predicate_agreement_person,librusec,2
248351,Большой парень из горы царапается!,Большой парень из горы царапаюсь!,царапается,царапаюсь,Syntax,Subject-Predicate Agreement,noun_subj_predicate_agreement_person,noun_subj_predicate_agreement_person,librusec,3
282706,Даже я пробраться не могу.,Даже я пробраться не можешь.,могу,можешь,Syntax,Subject-Predicate Agreement,noun_subj_predicate_agreement_person,noun_subj_predicate_agreement_person,librusec,2
316462,Мы песен и то не поем.,Мы песен и то не поете.,поем,поете,Syntax,Subject-Predicate Agreement,noun_subj_predicate_agreement_person,noun_subj_predicate_agreement_person,librusec,2
245764,Берут из нее люди по малости.,Берем из нее люди по малости.,Берут,Берем,Syntax,Subject-Predicate Agreement,noun_subj_predicate_agreement_person,noun_subj_predicate_agreement_person,librusec,3
356347,Не примут ведь меня люди!,Не примем ведь меня люди!,примут,примем,Syntax,Subject-Predicate Agreement,noun_subj_predicate_agreement_person,noun_subj_predicate_agreement_person,librusec,1
245143,Никуда потом человек не пристроится.,Никуда потом человек не пристроюсь.,пристроится,пристроюсь,Syntax,Subject-Predicate Agreement,noun_subj_predicate_agreement_person,noun_subj_predicate_agreement_person,librusec,1
326489,Ведь команда и без меня победит.,Ведь команда и без меня побежу.,победит,побежу,Syntax,Subject-Predicate Agreement,noun_subj_predicate_agreement_person,noun_subj_predicate_agreement_person,librusec,2
299244,Там старухи таперича ладят лад.,Там старухи таперича ладите лад.,ладят,ладите,Syntax,Subject-Predicate Agreement,noun_subj_predicate_agreement_person,noun_subj_predicate_agreement_person,librusec,2
291849,Куда мы тогда малого денем?,Куда мы тогда малого денете?,денем,денете,Syntax,Subject-Predicate Agreement,noun_subj_predicate_agreement_person,noun_subj_predicate_agreement_person,librusec,1
254731,Когда без клопа хозяйство бывает?,Когда без клопа хозяйство бываю?,бывает,бываю,Syntax,Subject-Predicate Agreement,noun_subj_predicate_agreement_person,noun_subj_predicate_agreement_person,librusec,2
272563,Это только Даг Кремневый может быть.,Это только Даг Кремневый могу быть.,может,могу,Syntax,Subject-Predicate Agreement,noun_subj_predicate_agreement_person,noun_subj_predicate_agreement_person,librusec,2
325353,Но валы Белгорода стоят и сегодня!,Но валы Белгорода стоим и сегодня!,стоят,стоим,Syntax,Subject-Predicate Agreement,noun_subj_predicate_agreement_person,noun_subj_predicate_agreement_person,librusec,3
331099,Сочи в гримерке пишет плей-лист.,Сочи в гримерке пишу плей-лист.,пишет,пишу,Syntax,Subject-Predicate Agreement,noun_subj_predicate_agreement_person,noun_subj_predicate_agreement_person,librusec,3
328139,Лично я предпочитаю упреки мертвые.,Лично я предпочитаешь упреки мертвые.,предпочитаю,предпочитаешь,Syntax,Subject-Predicate Agreement,noun_subj_predicate_agreement_person,noun_subj_predicate_agreement_person,librusec,3
274052,"Может быть, одновременно умирает Африка?","Может быть, одновременно умираю Африка?",умирает,умираю,Syntax,Subject-Predicate Agreement,noun_subj_predicate_agreement_person,noun_subj_predicate_agreement_person,librusec,2
272480,Но папы отправляются в Рай.,Но папы отправляемся в Рай.,отправляются,отправляемся,Syntax,Subject-Predicate Agreement,noun_subj_predicate_agreement_person,noun_subj_predicate_agreement_person,librusec,2
288558,Они ждут там доктора Бано.,Они ждем там доктора Бано.,ждут,ждем,Syntax,Subject-Predicate Agreement,noun_subj_predicate_agreement_person,noun_subj_predicate_agreement_person,librusec,2
345387,"Как буря, смерть уносит жениха...","Как буря, смерть уношу жениха...",уносит,уношу,Syntax,Subject-Predicate Agreement,noun_subj_predicate_agreement_person,noun_subj_predicate_agreement_person,librusec,2
263306,Уж до чего ладно складывается игра!,Уж до чего ладно складываюсь игра!,складывается,складываюсь,Syntax,Subject-Predicate Agreement,noun_subj_predicate_agreement_person,noun_subj_predicate_agreement_person,librusec,3
312997,Я вам болезнь вашу – назову!,Я вам болезнь вашу – назовешь!,назову,назовешь,Syntax,Subject-Predicate Agreement,noun_subj_predicate_agreement_person,noun_subj_predicate_agreement_person,librusec,2
263462,Вера аранов мало о чем свидетельствует.,Вера аранов мало о чем свидетельствую.,свидетельствует,свидетельствую,Syntax,Subject-Predicate Agreement,noun_subj_predicate_agreement_person,noun_subj_predicate_agreement_person,librusec,3
352751,Я плохо знаю Фею Тризелну.,Я плохо знаешь Фею Тризелну.,знаю,знаешь,Syntax,Subject-Predicate Agreement,noun_subj_predicate_agreement_person,noun_subj_predicate_agreement_person,librusec,2
282034,Но война ограничится порханием бумаг.,Но война ограничусь порханием бумаг.,ограничится,ограничусь,Syntax,Subject-Predicate Agreement,noun_subj_predicate_agreement_person,noun_subj_predicate_agreement_person,librusec,2
354344,Разве та забава имеет значение смысла?..,Разве та забава имею значение смысла?..,имеет,имею,Syntax,Subject-Predicate Agreement,noun_subj_predicate_agreement_person,noun_subj_predicate_agreement_person,librusec,4
299491,Она давит на разные чувства.,Она давлю на разные чувства.,давит,давлю,Syntax,Subject-Predicate Agreement,noun_subj_predicate_agreement_person,noun_subj_predicate_agreement_person,librusec,2
291670,Зап. часть находится на тер.,Зап. часть нахожусь на тер.,находится,нахожусь,Syntax,Subject-Predicate Agreement,noun_subj_predicate_agreement_person,noun_subj_predicate_agreement_person,librusec,4
296213,Она в лес пойдет да потеряет!,Она в лес пойду да потеряет!,пойдет,пойду,Syntax,Subject-Predicate Agreement,noun_subj_predicate_agreement_person,noun_subj_predicate_agreement_person,librusec,3
271848,Я на деревне вроде всех знаю!,Я на деревне вроде всех знаешь!,знаю,знаешь,Syntax,Subject-Predicate Agreement,noun_subj_predicate_agreement_person,noun_subj_predicate_agreement_person,librusec,3
357294,Когда язык мой говорить не смеет!,Когда язык мой говорить не смею!,смеет,смею,Syntax,Subject-Predicate Agreement,noun_subj_predicate_agreement_person,noun_subj_predicate_agreement_person,librusec,2
330958,И эти методы у женщин существуют!,И эти методы у женщин существуем!,существуют,существуем,Syntax,Subject-Predicate Agreement,noun_subj_predicate_agreement_person,noun_subj_predicate_agreement_person,librusec,3
343791,В этом канале ходят кадки.,В этом канале ходим кадки.,ходят,ходим,Syntax,Subject-Predicate Agreement,noun_subj_predicate_agreement_person,noun_subj_predicate_agreement_person,librusec,2
292816,Молоко тоже не принимает это государство.,Молоко тоже не принимаю это государство.,принимает,принимаю,Syntax,Subject-Predicate Agreement,noun_subj_predicate_agreement_person,noun_subj_predicate_agreement_person,librusec,2
298987,Это тебя очень просто выдает!,Это тебя очень просто выдаю!,выдает,выдаю,Syntax,Subject-Predicate Agreement,noun_subj_predicate_agreement_person,noun_subj_predicate_agreement_person,librusec,2
302998,"Что вы думаете, мистер Педгифт?","Что вы думаем, мистер Педгифт?",думаете,думаем,Syntax,Subject-Predicate Agreement,noun_subj_predicate_agreement_person,noun_subj_predicate_agreement_person,librusec,2
326649,Однако интерес к бас. остается.,Однако интерес к бас. остаюсь.,остается,остаюсь,Syntax,Subject-Predicate Agreement,noun_subj_predicate_agreement_person,noun_subj_predicate_agreement_person,librusec,3
357405,Каинрон никогда не признает его.,Каинрон никогда не признаю его.,признает,признаю,Syntax,Subject-Predicate Agreement,noun_subj_predicate_agreement_person,noun_subj_predicate_agreement_person,librusec,1
259669,А базарить его Крюгер заставит!,А базарить его Крюгер заставлю!,заставит,заставлю,Syntax,Subject-Predicate Agreement,noun_subj_predicate_agreement_person,noun_subj_predicate_agreement_person,librusec,2
242408,Лодар Рилг наверняка проиграет этот бой.,Лодар Рилг наверняка проиграю этот бой.,проиграет,проиграю,Syntax,Subject-Predicate Agreement,noun_subj_predicate_agreement_person,noun_subj_predicate_agreement_person,librusec,3
303710,За которые мы найдем выход?,За которые мы найдете выход?,найдем,найдете,Syntax,Subject-Predicate Agreement,noun_subj_predicate_agreement_person,noun_subj_predicate_agreement_person,librusec,2
334841,А то другие для себя захватят.,А то другие для себя захватим.,захватят,захватим,Syntax,Subject-Predicate Agreement,noun_subj_predicate_agreement_person,noun_subj_predicate_agreement_person,librusec,2
279456,Все уже и уже становится ход.,Все уже и уже становлюсь ход.,становится,становлюсь,Syntax,Subject-Predicate Agreement,noun_subj_predicate_agreement_person,noun_subj_predicate_agreement_person,librusec,3
319759,Она те живо на путь наставит.,Она те живо на путь наставлю.,наставит,наставлю,Syntax,Subject-Predicate Agreement,noun_subj_predicate_agreement_person,noun_subj_predicate_agreement_person,librusec,3
248794,Такое серьезные программеры не забывают.,Такое серьезные программеры не забываете.,забывают,забываете,Syntax,Subject-Predicate Agreement,noun_subj_predicate_agreement_person,noun_subj_predicate_agreement_person,librusec,3
325287,Вон Лариска из травмы пялится!,Вон Лариска из травмы пялюсь!,пялится,пялюсь,Syntax,Subject-Predicate Agreement,noun_subj_predicate_agreement_person,noun_subj_predicate_agreement_person,librusec,2
262693,На вид самое глубокое место получается.,На вид самое глубокое место получаюсь.,получается,получаюсь,Syntax,Subject-Predicate Agreement,noun_subj_predicate_agreement_person,noun_subj_predicate_agreement_person,librusec,4
299064,Всем новичкам Бен сам дает работу.,Всем новичкам Бен сам даю работу.,дает,даю,Syntax,Subject-Predicate Agreement,noun_subj_predicate_agreement_person,noun_subj_predicate_agreement_person,librusec,3
326779,Вы думаете перенести сюда раненых?,Вы думаем перенести сюда раненых?,думаете,думаем,Syntax,Subject-Predicate Agreement,noun_subj_predicate_agreement_person,noun_subj_predicate_agreement_person,librusec,2
332441,За пределом пустынь находятся земли Горенна.,За пределом пустынь находимся земли Горенна.,находятся,находимся,Syntax,Subject-Predicate Agreement,noun_subj_predicate_agreement_person,noun_subj_predicate_agreement_person,librusec,3
332144,И Абделя подобные действия обеспокоят.,И Абделя подобные действия обеспокоим.,обеспокоят,обеспокоим,Syntax,Subject-Predicate Agreement,noun_subj_predicate_agreement_person,noun_subj_predicate_agreement_person,librusec,2
258858,Шаид пусть находится при тебе.,Шаид пусть нахожусь при тебе.,находится,нахожусь,Syntax,Subject-Predicate Agreement,noun_subj_predicate_agreement_person,noun_subj_predicate_agreement_person,librusec,2
252162,"Один стоит на столе, видите?","Один стою на столе, видите?",стоит,стою,Syntax,Subject-Predicate Agreement,noun_subj_predicate_agreement_person,noun_subj_predicate_agreement_person,librusec,3
286646,Где тебя боится легендарный Континус Инвинц!,Где тебя боюсь легендарный Континус Инвинц!,боится,боюсь,Syntax,Subject-Predicate Agreement,noun_subj_predicate_agreement_person,noun_subj_predicate_agreement_person,librusec,2
265156,Вещая Вила больше ему не помогает.,Вещая Вила больше ему не помогаю.,помогает,помогаю,Syntax,Subject-Predicate Agreement,noun_subj_predicate_agreement_person,noun_subj_predicate_agreement_person,librusec,2
318217,"Кто входит, так и падает.","Кто вхожу, так и падает.",входит,вхожу,Syntax,Subject-Predicate Agreement,noun_subj_predicate_agreement_person,noun_subj_predicate_agreement_person,librusec,3
254967,Он и примет начальника секретной части.,Он и приму начальника секретной части.,примет,приму,Syntax,Subject-Predicate Agreement,noun_subj_predicate_agreement_person,noun_subj_predicate_agreement_person,librusec,3
281813,Будет ладно служить — чины пойдут.,Будет ладно служить — чины пойдем.,пойдут,пойдем,Syntax,Subject-Predicate Agreement,noun_subj_predicate_agreement_person,noun_subj_predicate_agreement_person,librusec,2
291230,И кресло президента банка станет ее.,И кресло президента банка стану ее.,станет,стану,Syntax,Subject-Predicate Agreement,noun_subj_predicate_agreement_person,noun_subj_predicate_agreement_person,librusec,3
343760,Что значит это твое Увы?,Что значу это твое Увы?,значит,значу,Syntax,Subject-Predicate Agreement,noun_subj_predicate_agreement_person,noun_subj_predicate_agreement_person,librusec,1
312769,Но Кока-то откуда знает ее?,Но Кока-то откуда знаю ее?,знает,знаю,Syntax,Subject-Predicate Agreement,noun_subj_predicate_agreement_person,noun_subj_predicate_agreement_person,librusec,1
314034,Тот мигом заберет себе все.,Тот мигом заберу себе все.,заберет,заберу,Syntax,Subject-Predicate Agreement,noun_subj_predicate_agreement_person,noun_subj_predicate_agreement_person,librusec,1
325217,"Хотя, где шляется сам капитан?","Хотя, где шляюсь сам капитан?",шляется,шляюсь,Syntax,Subject-Predicate Agreement,noun_subj_predicate_agreement_person,noun_subj_predicate_agreement_person,librusec,3
305209,А люди и бог все видят.,А люди и бог все видите.,видят,видите,Syntax,Subject-Predicate Agreement,noun_subj_predicate_agreement_person,noun_subj_predicate_agreement_person,librusec,3
320776,Я знаю ее брата Перси.,Я знаешь ее брата Перси.,знаю,знаешь,Syntax,Subject-Predicate Agreement,noun_subj_predicate_agreement_person,noun_subj_predicate_agreement_person,librusec,2
250159,Твой сон приходится к добру.,Твой сон прихожусь к добру.,приходится,прихожусь,Syntax,Subject-Predicate Agreement,noun_subj_predicate_agreement_person,noun_subj_predicate_agreement_person,librusec,3
258586,Пашка из маркетинга едет в Екат.,Пашка из маркетинга еду в Екат.,едет,еду,Syntax,Subject-Predicate Agreement,noun_subj_predicate_agreement_person,noun_subj_predicate_agreement_person,librusec,4
324903,Все знают капитана Мориса Фрера!,Все знаете капитана Мориса Фрера!,знают,знаете,Syntax,Subject-Predicate Agreement,noun_subj_predicate_agreement_person,noun_subj_predicate_agreement_person,librusec,3
332941,Фирновая линия проходит на выс.,Фирновая линия прохожу на выс.,проходит,прохожу,Syntax,Subject-Predicate Agreement,noun_subj_predicate_agreement_person,noun_subj_predicate_agreement_person,librusec,3
309159,Куда Бано сможет уехать на поезде.,Куда Бано смогу уехать на поезде.,сможет,смогу,Syntax,Subject-Predicate Agreement,noun_subj_predicate_agreement_person,noun_subj_predicate_agreement_person,librusec,3
322870,Павел стоит к нам лицом.,Павел стою к нам лицом.,стоит,стою,Syntax,Subject-Predicate Agreement,noun_subj_predicate_agreement_person,noun_subj_predicate_agreement_person,librusec,2
290089,Это Запад меня называет игроком.,Это Запад меня называю игроком.,называет,называю,Syntax,Subject-Predicate Agreement,noun_subj_predicate_agreement_person,noun_subj_predicate_agreement_person,librusec,1
318965,Более всего вызывают беспокойство установки населения.,Более всего вызываете беспокойство установки населения.,вызывают,вызываете,Syntax,Subject-Predicate Agreement,noun_subj_predicate_agreement_person,noun_subj_predicate_agreement_person,librusec,3
266848,Ты едешь прежде домой со мной.,Ты еду прежде домой со мной.,едешь,еду,Syntax,Subject-Predicate Agreement,noun_subj_predicate_agreement_person,noun_subj_predicate_agreement_person,librusec,2
306188,Их звук я всегда узнаю.,Их звук я всегда узнаешь.,узнаю,узнаешь,Syntax,Subject-Predicate Agreement,noun_subj_predicate_agreement_person,noun_subj_predicate_agreement_person,librusec,2
328161,"Неблизкий свет, и телефон отсутствует.","Неблизкий свет, и телефон отсутствую.",отсутствует,отсутствую,Syntax,Subject-Predicate Agreement,noun_subj_predicate_agreement_person,noun_subj_predicate_agreement_person,librusec,2
338735,Сакрапант уточнит все детали договора.,Сакрапант уточню все детали договора.,уточнит,уточню,Syntax,Subject-Predicate Agreement,noun_subj_predicate_agreement_person,noun_subj_predicate_agreement_person,librusec,2
266976,Он не вызовет Ваджмоса или Аменмоса.,Он не вызову Ваджмоса или Аменмоса.,вызовет,вызову,Syntax,Subject-Predicate Agreement,noun_subj_predicate_agreement_person,noun_subj_predicate_agreement_person,librusec,3
340555,Волки же по следу враз найдут!,Волки же по следу враз найдем!,найдут,найдем,Syntax,Subject-Predicate Agreement,noun_subj_predicate_agreement_person,noun_subj_predicate_agreement_person,librusec,3
33913,В ней примет участие сам футболист.,В ней приму участие сам футболист.,примет,приму,Syntax,Subject-Predicate Agreement,noun_subj_predicate_agreement_person,noun_subj_predicate_agreement_person,wikinews,4
36847,Также легко получают разрешения дипломаты.,Также легко получаете разрешения дипломаты.,получают,получаете,Syntax,Subject-Predicate Agreement,noun_subj_predicate_agreement_person,noun_subj_predicate_agreement_person,wikinews,2
107133,Провидит Асад некоторые вещи и грустит.,Провижу Асад некоторые вещи и грустит.,Провидит,Провижу,Syntax,Subject-Predicate Agreement,noun_subj_predicate_agreement_person,noun_subj_predicate_agreement_person,wikinews,3
73922,Сегодня дом продает Сандра Гэлутен.,Сегодня дом продаю Сандра Гэлутен.,продает,продаю,Syntax,Subject-Predicate Agreement,noun_subj_predicate_agreement_person,noun_subj_predicate_agreement_person,wikinews,2
40452,Гайчу действительно очень нравится ЦСКА.,Гайчу действительно очень нравлюсь ЦСКА.,нравится,нравлюсь,Syntax,Subject-Predicate Agreement,noun_subj_predicate_agreement_person,noun_subj_predicate_agreement_person,wikinews,1
73982,Это и называется общественный комитет.,Это и называюсь общественный комитет.,называется,называюсь,Syntax,Subject-Predicate Agreement,noun_subj_predicate_agreement_person,noun_subj_predicate_agreement_person,wikinews,2
77355,Я заранее и честно вам этоговорю...,Я заранее и честно вам этоговоришь...,этоговорю,этоговоришь,Syntax,Subject-Predicate Agreement,noun_subj_predicate_agreement_person,noun_subj_predicate_agreement_person,wikinews,3
8256,Этот диагноз сейчас за всеми стоит.,Этот диагноз сейчас за всеми стою.,стоит,стою,Syntax,Subject-Predicate Agreement,noun_subj_predicate_agreement_person,noun_subj_predicate_agreement_person,wikinews,3
89810,В нашем случае музыку создает команда.,В нашем случае музыку создаю команда.,создает,создаю,Syntax,Subject-Predicate Agreement,noun_subj_predicate_agreement_person,noun_subj_predicate_agreement_person,wikinews,2
95385,Самые большие горят до трех минут.,Самые большие горим до трех минут.,горят,горим,Syntax,Subject-Predicate Agreement,noun_subj_predicate_agreement_person,noun_subj_predicate_agreement_person,wikinews,3
