id,source_sentence,target_sentence,source_word,target_word,level,phenomenon,PID,subtype,domain,tree_depth
314614,Придут все корабли Дома Алер.,Придем все корабли Дома Алер.,Придут,Придем,Syntax,Subject-Predicate Agreement,noun_subj_predicate_agreement_person,noun_subj_predicate_agreement_person,librusec,3
317303,С ротным тоже я улажу.,С ротным тоже я уладишь.,улажу,уладишь,Syntax,Subject-Predicate Agreement,noun_subj_predicate_agreement_person,noun_subj_predicate_agreement_person,librusec,2
306656,Если тетя Би не возражает.,Если тетя Би не возражаю.,возражает,возражаю,Syntax,Subject-Predicate Agreement,noun_subj_predicate_agreement_person,noun_subj_predicate_agreement_person,librusec,2
296026,Так же называется и дворец.,Так же называюсь и дворец.,называется,называюсь,Syntax,Subject-Predicate Agreement,noun_subj_predicate_agreement_person,noun_subj_predicate_agreement_person,librusec,3
328996,Все мне сегодня дают ценные указания!,Все мне сегодня даем ценные указания!,дают,даем,Syntax,Subject-Predicate Agreement,noun_subj_predicate_agreement_person,noun_subj_predicate_agreement_person,librusec,2
266876,Другие и тут происки видят глобализма.,Другие и тут происки видите глобализма.,видят,видите,Syntax,Subject-Predicate Agreement,noun_subj_predicate_agreement_person,noun_subj_predicate_agreement_person,librusec,2
345054,Сорас сама полетит за нами.,Сорас сама полечу за нами.,полетит,полечу,Syntax,Subject-Predicate Agreement,noun_subj_predicate_agreement_person,noun_subj_predicate_agreement_person,librusec,2
280344,Джек уже сидит три года.,Джек уже сижу три года.,сидит,сижу,Syntax,Subject-Predicate Agreement,noun_subj_predicate_agreement_person,noun_subj_predicate_agreement_person,librusec,2
254864,Принимает ли миледи этот способ?,Принимаю ли миледи этот способ?,Принимает,Принимаю,Syntax,Subject-Predicate Agreement,noun_subj_predicate_agreement_person,noun_subj_predicate_agreement_person,librusec,2
354891,Вас дочка кличет не докличется.,Вас дочка кличу не докличется.,кличет,кличу,Syntax,Subject-Predicate Agreement,noun_subj_predicate_agreement_person,noun_subj_predicate_agreement_person,librusec,2
244676,Инда мурашки по спине побегут!,Инда мурашки по спине побежим!,побегут,побежим,Syntax,Subject-Predicate Agreement,noun_subj_predicate_agreement_person,noun_subj_predicate_agreement_person,librusec,3
287918,А во вкус народишко войдет?,А во вкус народишко войду?,войдет,войду,Syntax,Subject-Predicate Agreement,noun_subj_predicate_agreement_person,noun_subj_predicate_agreement_person,librusec,2
252987,Только теперь я скажу это сам.,Только теперь я скажешь это сам.,скажу,скажешь,Syntax,Subject-Predicate Agreement,noun_subj_predicate_agreement_person,noun_subj_predicate_agreement_person,librusec,2
298578,Я сейчас вылетаю в разведбат.,Я сейчас вылетаешь в разведбат.,вылетаю,вылетаешь,Syntax,Subject-Predicate Agreement,noun_subj_predicate_agreement_person,noun_subj_predicate_agreement_person,librusec,2
301483,Вот потому там часто гибнут путники.,Вот потому там часто гибнем путники.,гибнут,гибнем,Syntax,Subject-Predicate Agreement,noun_subj_predicate_agreement_person,noun_subj_predicate_agreement_person,librusec,2
258326,Через большой спорт действует идеология.,Через большой спорт действую идеология.,действует,действую,Syntax,Subject-Predicate Agreement,noun_subj_predicate_agreement_person,noun_subj_predicate_agreement_person,librusec,2
321939,А организовать вылет Листошин может.,А организовать вылет Листошин могу.,может,могу,Syntax,Subject-Predicate Agreement,noun_subj_predicate_agreement_person,noun_subj_predicate_agreement_person,librusec,2
292915,"Мы сюжет едем снимать, опаздываем.","Мы сюжет едете снимать, опаздываем.",едем,едете,Syntax,Subject-Predicate Agreement,noun_subj_predicate_agreement_person,noun_subj_predicate_agreement_person,librusec,3
349036,За год Эндерсон нагребает новую силу.,За год Эндерсон нагребаю новую силу.,нагребает,нагребаю,Syntax,Subject-Predicate Agreement,noun_subj_predicate_agreement_person,noun_subj_predicate_agreement_person,librusec,3
295638,Но ведь пули нас не берут.,Но ведь пули нас не берем.,берут,берем,Syntax,Subject-Predicate Agreement,noun_subj_predicate_agreement_person,noun_subj_predicate_agreement_person,librusec,2
271960,Иначе с чего люди погибают!,Иначе с чего люди погибаем!,погибают,погибаем,Syntax,Subject-Predicate Agreement,noun_subj_predicate_agreement_person,noun_subj_predicate_agreement_person,librusec,2
272874,"Итак, Олега Древлянского былина знает.","Итак, Олега Древлянского былина знаю.",знает,знаю,Syntax,Subject-Predicate Agreement,noun_subj_predicate_agreement_person,noun_subj_predicate_agreement_person,librusec,3
326366,Там ли еще служит мой сын!,Там ли еще служу мой сын!,служит,служу,Syntax,Subject-Predicate Agreement,noun_subj_predicate_agreement_person,noun_subj_predicate_agreement_person,librusec,3
299371,Кто ж их вечером отпустит?,Кто ж их вечером отпущу?,отпустит,отпущу,Syntax,Subject-Predicate Agreement,noun_subj_predicate_agreement_person,noun_subj_predicate_agreement_person,librusec,2
261939,Я посылаю людей вниз зачистить разработки.,Я посылаешь людей вниз зачистить разработки.,посылаю,посылаешь,Syntax,Subject-Predicate Agreement,noun_subj_predicate_agreement_person,noun_subj_predicate_agreement_person,librusec,2
290063,Хотя и один не появится.,Хотя и один не появлюсь.,появится,появлюсь,Syntax,Subject-Predicate Agreement,noun_subj_predicate_agreement_person,noun_subj_predicate_agreement_person,librusec,2
294121,Только видят – не понимает парень.,Только видят – не понимаю парень.,понимает,понимаю,Syntax,Subject-Predicate Agreement,noun_subj_predicate_agreement_person,noun_subj_predicate_agreement_person,librusec,2
245114,Это живым она кажется таковой.,Это живым она кажусь таковой.,кажется,кажусь,Syntax,Subject-Predicate Agreement,noun_subj_predicate_agreement_person,noun_subj_predicate_agreement_person,librusec,1
329026,Но мысль живая скачет лихо.,Но мысль живая скачу лихо.,скачет,скачу,Syntax,Subject-Predicate Agreement,noun_subj_predicate_agreement_person,noun_subj_predicate_agreement_person,librusec,2
304809,Только исповедники мои всегда молчат.,Только исповедники мои всегда молчим.,молчат,молчим,Syntax,Subject-Predicate Agreement,noun_subj_predicate_agreement_person,noun_subj_predicate_agreement_person,librusec,2
308308,Вроде бы ваши сюда не бродят.,Вроде бы ваши сюда не бродим.,бродят,бродим,Syntax,Subject-Predicate Agreement,noun_subj_predicate_agreement_person,noun_subj_predicate_agreement_person,librusec,2
276961,Тогда и повышение скорее выйдет.,Тогда и повышение скорее выйду.,выйдет,выйду,Syntax,Subject-Predicate Agreement,noun_subj_predicate_agreement_person,noun_subj_predicate_agreement_person,librusec,2
307057,найдешь ты ключ для нового рывка.,найду ты ключ для нового рывка.,найдешь,найду,Syntax,Subject-Predicate Agreement,noun_subj_predicate_agreement_person,noun_subj_predicate_agreement_person,librusec,3
293718,Мы заносим станины в сторону.,Мы заносите станины в сторону.,заносим,заносите,Syntax,Subject-Predicate Agreement,noun_subj_predicate_agreement_person,noun_subj_predicate_agreement_person,librusec,2
246516,Затем женщина выходит из такси.,Затем женщина выхожу из такси.,выходит,выхожу,Syntax,Subject-Predicate Agreement,noun_subj_predicate_agreement_person,noun_subj_predicate_agreement_person,librusec,2
351217,А какие деньги Олька получает!,А какие деньги Олька получаю!,получает,получаю,Syntax,Subject-Predicate Agreement,noun_subj_predicate_agreement_person,noun_subj_predicate_agreement_person,librusec,2
345615,Райсшлингеру это очень не нравится.,Райсшлингеру это очень не нравлюсь.,нравится,нравлюсь,Syntax,Subject-Predicate Agreement,noun_subj_predicate_agreement_person,noun_subj_predicate_agreement_person,librusec,1
306632,Он оттесняет мужчин от Лоу.,Он оттесняю мужчин от Лоу.,оттесняет,оттесняю,Syntax,Subject-Predicate Agreement,noun_subj_predicate_agreement_person,noun_subj_predicate_agreement_person,librusec,2
324765,К морю выходят многие страны Центр.,К морю выходим многие страны Центр.,выходят,выходим,Syntax,Subject-Predicate Agreement,noun_subj_predicate_agreement_person,noun_subj_predicate_agreement_person,librusec,3
328055,Как может теперь ломаться лед?,Как могу теперь ломаться лед?,может,могу,Syntax,Subject-Predicate Agreement,noun_subj_predicate_agreement_person,noun_subj_predicate_agreement_person,librusec,1
273645,Это заявляю я – пророк Андрей!,Это заявляешь я – пророк Андрей!,заявляю,заявляешь,Syntax,Subject-Predicate Agreement,noun_subj_predicate_agreement_person,noun_subj_predicate_agreement_person,librusec,3
327227,Ну она меня плохо знает!,Ну она меня плохо знаешь!,знает,знаешь,Syntax,Subject-Predicate Agreement,noun_subj_predicate_agreement_person,noun_subj_predicate_agreement_person,librusec,1
269108,Поздно вечером вызывает меня генерал.,Поздно вечером вызываю меня генерал.,вызывает,вызываю,Syntax,Subject-Predicate Agreement,noun_subj_predicate_agreement_person,noun_subj_predicate_agreement_person,librusec,2
248114,Затем от нашей команды пробивает Зано.,Затем от нашей команды пробиваю Зано.,пробивает,пробиваю,Syntax,Subject-Predicate Agreement,noun_subj_predicate_agreement_person,noun_subj_predicate_agreement_person,librusec,2
336978,Фибби встречается не каждый день.,Фибби встречаюсь не каждый день.,встречается,встречаюсь,Syntax,Subject-Predicate Agreement,noun_subj_predicate_agreement_person,noun_subj_predicate_agreement_person,librusec,3
349591,Это они работают на общество.,Это они работаем на общество.,работают,работаем,Syntax,Subject-Predicate Agreement,noun_subj_predicate_agreement_person,noun_subj_predicate_agreement_person,librusec,2
337559,"Может, у нее подвал течет!","Может, у нее подвал теку!",течет,теку,Syntax,Subject-Predicate Agreement,noun_subj_predicate_agreement_person,noun_subj_predicate_agreement_person,librusec,3
321376,Он больше не экранирует мысли Эллчагра.,Он больше не экранирую мысли Эллчагра.,экранирует,экранирую,Syntax,Subject-Predicate Agreement,noun_subj_predicate_agreement_person,noun_subj_predicate_agreement_person,librusec,2
345972,Сейчас давно никто не носит такие.,Сейчас давно никто не ношу такие.,носит,ношу,Syntax,Subject-Predicate Agreement,noun_subj_predicate_agreement_person,noun_subj_predicate_agreement_person,librusec,1
310427,Они работают жителями старого Мирного.,Они работаем жителями старого Мирного.,работают,работаем,Syntax,Subject-Predicate Agreement,noun_subj_predicate_agreement_person,noun_subj_predicate_agreement_person,librusec,3
315881,"Неужели существует инфекция, вирус злобы?","Неужели существую инфекция, вирус злобы?",существует,существую,Syntax,Subject-Predicate Agreement,noun_subj_predicate_agreement_person,noun_subj_predicate_agreement_person,librusec,3
269490,Особенно пострадает тело самого Детруна.,Особенно пострадаю тело самого Детруна.,пострадает,пострадаю,Syntax,Subject-Predicate Agreement,noun_subj_predicate_agreement_person,noun_subj_predicate_agreement_person,librusec,3
288776,А луга идут по другой статье.,А луга идем по другой статье.,идут,идем,Syntax,Subject-Predicate Agreement,noun_subj_predicate_agreement_person,noun_subj_predicate_agreement_person,librusec,2
301448,Он выходит за рамки цели.,Он выхожу за рамки цели.,выходит,выхожу,Syntax,Subject-Predicate Agreement,noun_subj_predicate_agreement_person,noun_subj_predicate_agreement_person,librusec,2
268487,Он превратится в дитя улицы.,Он превращусь в дитя улицы.,превратится,превращусь,Syntax,Subject-Predicate Agreement,noun_subj_predicate_agreement_person,noun_subj_predicate_agreement_person,librusec,2
315340,Не ты ведь таскаешь – машина!,Не ты ведь таскаю – машина!,таскаешь,таскаю,Syntax,Subject-Predicate Agreement,noun_subj_predicate_agreement_person,noun_subj_predicate_agreement_person,librusec,3
357106,Я вижу герб нашего кампаку!,Я видишь герб нашего кампаку!,вижу,видишь,Syntax,Subject-Predicate Agreement,noun_subj_predicate_agreement_person,noun_subj_predicate_agreement_person,librusec,3
290280,Все дела сейчас ведет Лева.,Все дела сейчас веду Лева.,ведет,веду,Syntax,Subject-Predicate Agreement,noun_subj_predicate_agreement_person,noun_subj_predicate_agreement_person,librusec,2
310712,И супруга устроит Витьке бенц.,И супруга устрою Витьке бенц.,устроит,устрою,Syntax,Subject-Predicate Agreement,noun_subj_predicate_agreement_person,noun_subj_predicate_agreement_person,librusec,1
242463,Только мы ищем не оружие.,Только мы ищете не оружие.,ищем,ищете,Syntax,Subject-Predicate Agreement,noun_subj_predicate_agreement_person,noun_subj_predicate_agreement_person,librusec,2
298803,А как работают ваши ноги!,А как работаем ваши ноги!,работают,работаем,Syntax,Subject-Predicate Agreement,noun_subj_predicate_agreement_person,noun_subj_predicate_agreement_person,librusec,2
330172,Это я признаю за ним.,Это я признаешь за ним.,признаю,признаешь,Syntax,Subject-Predicate Agreement,noun_subj_predicate_agreement_person,noun_subj_predicate_agreement_person,librusec,2
179564,Его призрак является Ясону и Алкимеде.,Его призрак являюсь Ясону и Алкимеде.,является,являюсь,Syntax,Subject-Predicate Agreement,noun_subj_predicate_agreement_person,noun_subj_predicate_agreement_person,wikipedia,4
218741,Эта дорога проходит прямо через Бенетице.,Эта дорога прохожу прямо через Бенетице.,проходит,прохожу,Syntax,Subject-Predicate Agreement,noun_subj_predicate_agreement_person,noun_subj_predicate_agreement_person,wikipedia,3
126915,Маллоросо находится на территории Тляратинского района.,Маллоросо нахожусь на территории Тляратинского района.,находится,нахожусь,Syntax,Subject-Predicate Agreement,noun_subj_predicate_agreement_person,noun_subj_predicate_agreement_person,wikipedia,3
206554,На реке находится поселок Видзас.,На реке нахожусь поселок Видзас.,находится,нахожусь,Syntax,Subject-Predicate Agreement,noun_subj_predicate_agreement_person,noun_subj_predicate_agreement_person,wikipedia,3
214147,Глава святителя Виро находится в Утрехте.,Глава святителя Виро нахожусь в Утрехте.,находится,нахожусь,Syntax,Subject-Predicate Agreement,noun_subj_predicate_agreement_person,noun_subj_predicate_agreement_person,wikipedia,4
134340,Самый говор народный отзывается Новгородским акцентом...,Самый говор народный отзываюсь Новгородским акцентом...,отзывается,отзываюсь,Syntax,Subject-Predicate Agreement,noun_subj_predicate_agreement_person,noun_subj_predicate_agreement_person,wikipedia,3
232648,Многие из его музыкантов представляют США.,Многие из его музыкантов представляете США.,представляют,представляете,Syntax,Subject-Predicate Agreement,noun_subj_predicate_agreement_person,noun_subj_predicate_agreement_person,wikipedia,3
225501,Они решают оставить Лу у Клетуса.,Они решаете оставить Лу у Клетуса.,решают,решаете,Syntax,Subject-Predicate Agreement,noun_subj_predicate_agreement_person,noun_subj_predicate_agreement_person,wikipedia,3
353450,"Там человек любит мужчину, и все.","Там человек люблю мужчину, и все.",любит,люблю,Syntax,Subject-Predicate Agreement,noun_subj_predicate_agreement_person,noun_subj_predicate_agreement_person,librusec,3
307759,В каком – и Двоеум не знает.,В каком – и Двоеум не знаю.,знает,знаю,Syntax,Subject-Predicate Agreement,noun_subj_predicate_agreement_person,noun_subj_predicate_agreement_person,librusec,3
345021,Вдруг Киллатолис сможет возродиться в новом теле?,Вдруг Киллатолис смогу возродиться в новом теле?,сможет,смогу,Syntax,Subject-Predicate Agreement,noun_subj_predicate_agreement_person,noun_subj_predicate_agreement_person,librusec,3
278217,Кнут и плаху не все принимают несчастьем.,Кнут и плаху не все принимаете несчастьем.,принимают,принимаете,Syntax,Subject-Predicate Agreement,noun_subj_predicate_agreement_person,noun_subj_predicate_agreement_person,librusec,4
241531,"А как поживает мой храм, Сенмут?","А как поживаю мой храм, Сенмут?",поживает,поживаю,Syntax,Subject-Predicate Agreement,noun_subj_predicate_agreement_person,noun_subj_predicate_agreement_person,librusec,3
348915,"Завтра другого поставишь, и он сварит.","Завтра другого поставишь, и он сварю.",сварит,сварю,Syntax,Subject-Predicate Agreement,noun_subj_predicate_agreement_person,noun_subj_predicate_agreement_person,librusec,2
278875,Яковлев стоит – голова под крышу блиндажа.,Яковлев стою – голова под крышу блиндажа.,стоит,стою,Syntax,Subject-Predicate Agreement,noun_subj_predicate_agreement_person,noun_subj_predicate_agreement_person,librusec,3
247442,С красивыми жизни все одно не получится.,С красивыми жизни все одно не получусь.,получится,получусь,Syntax,Subject-Predicate Agreement,noun_subj_predicate_agreement_person,noun_subj_predicate_agreement_person,librusec,3
290902,Если яд не пойдет дальше по ноге...,Если яд не пойду дальше по ноге...,пойдет,пойду,Syntax,Subject-Predicate Agreement,noun_subj_predicate_agreement_person,noun_subj_predicate_agreement_person,librusec,2
283583,"Ранят слова людей, музыка, смех.","Раните слова людей, музыка, смех.",Ранят,Раните,Syntax,Subject-Predicate Agreement,noun_subj_predicate_agreement_person,noun_subj_predicate_agreement_person,librusec,4
297247,"Мет, с этим не мирится совесть!","Мет, с этим не мирюсь совесть!",мирится,мирюсь,Syntax,Subject-Predicate Agreement,noun_subj_predicate_agreement_person,noun_subj_predicate_agreement_person,librusec,3
328660,Кэрри сидит между Ра и его агентшей.,Кэрри сижу между Ра и его агентшей.,сидит,сижу,Syntax,Subject-Predicate Agreement,noun_subj_predicate_agreement_person,noun_subj_predicate_agreement_person,librusec,3
296308,"Только что это даст, кроме ничего?","Только что это дам, кроме ничего?",даст,дам,Syntax,Subject-Predicate Agreement,noun_subj_predicate_agreement_person,noun_subj_predicate_agreement_person,librusec,3
311876,Или вы хотите через это хорошо получить?,Или вы хотим через это хорошо получить?,хотите,хотим,Syntax,Subject-Predicate Agreement,noun_subj_predicate_agreement_person,noun_subj_predicate_agreement_person,librusec,3
317096,А выверток уже сидит напротив на четвереньках.,А выверток уже сижу напротив на четвереньках.,сидит,сижу,Syntax,Subject-Predicate Agreement,noun_subj_predicate_agreement_person,noun_subj_predicate_agreement_person,librusec,2
295077,Ему ж фортуна посвечивает – в офицеры!,Ему ж фортуна посвечиваю – в офицеры!,посвечивает,посвечиваю,Syntax,Subject-Predicate Agreement,noun_subj_predicate_agreement_person,noun_subj_predicate_agreement_person,librusec,3
287864,"Папа говорит, им нравится твоя платформа.","Папа говорю, им нравится твоя платформа.",говорит,говорю,Syntax,Subject-Predicate Agreement,noun_subj_predicate_agreement_person,noun_subj_predicate_agreement_person,librusec,3
334933,А никто не хочет – боятся наказания.,А никто не хочу – боятся наказания.,хочет,хочу,Syntax,Subject-Predicate Agreement,noun_subj_predicate_agreement_person,noun_subj_predicate_agreement_person,librusec,2
313709,Гри-муар Гонория содержит множество таких смертоносных заклинаний.,Гри-муар Гонория содержу множество таких смертоносных заклинаний.,содержит,содержу,Syntax,Subject-Predicate Agreement,noun_subj_predicate_agreement_person,noun_subj_predicate_agreement_person,librusec,5
307607,И зрение было – я тебе дам!,И зрение было – я тебе даст!,дам,даст,Syntax,Subject-Predicate Agreement,noun_subj_predicate_agreement_person,noun_subj_predicate_agreement_person,librusec,2
341240,Тогда меня Храм точно по головке не погладит.,Тогда меня Храм точно по головке не поглажу.,погладит,поглажу,Syntax,Subject-Predicate Agreement,noun_subj_predicate_agreement_person,noun_subj_predicate_agreement_person,librusec,2
291469,"Макошь тебе велела и дочери ее, ты сумеешь!","Макошь тебе велела и дочери ее, ты сумею!",сумеешь,сумею,Syntax,Subject-Predicate Agreement,noun_subj_predicate_agreement_person,noun_subj_predicate_agreement_person,librusec,3
