id,source_sentence,target_sentence,source_word,target_word,level,phenomenon,PID,subtype,domain,tree_depth
287324,Поэтому тебе может помочь королева Аудельская Фрайдис.,Поэтому тебе могу помочь королева Аудельская Фрайдис.,может,могу,Syntax,Subject-Predicate Agreement,noun_subj_predicate_agreement_person,noun_subj_predicate_agreement_person,librusec,3
241041,Но между вас я вижу новы лица.,Но между вас я видишь новы лица.,вижу,видишь,Syntax,Subject-Predicate Agreement,noun_subj_predicate_agreement_person,noun_subj_predicate_agreement_person,librusec,3
272292,"Даже те, кто бывает в текии.","Даже те, кто бываю в текии.",бывает,бываю,Syntax,Subject-Predicate Agreement,noun_subj_predicate_agreement_person,noun_subj_predicate_agreement_person,librusec,3
243562,Я не стану уже больше считать ударов.,Я не станешь уже больше считать ударов.,стану,станешь,Syntax,Subject-Predicate Agreement,noun_subj_predicate_agreement_person,noun_subj_predicate_agreement_person,librusec,3
246192,Он уже в счет будущего года работает.,Он уже в счет будущего года работаю.,работает,работаю,Syntax,Subject-Predicate Agreement,noun_subj_predicate_agreement_person,noun_subj_predicate_agreement_person,librusec,3
308061,Джейм может забрать ее – так легко.,Джейм могу забрать ее – так легко.,может,могу,Syntax,Subject-Predicate Agreement,noun_subj_predicate_agreement_person,noun_subj_predicate_agreement_person,librusec,3
252760,"Франсуаз это знает, знал и бармен.","Франсуаз это знаю, знал и бармен.",знает,знаю,Syntax,Subject-Predicate Agreement,noun_subj_predicate_agreement_person,noun_subj_predicate_agreement_person,librusec,3
326880,"Поэтому ждала здесь, когда вы пройдете.","Поэтому ждала здесь, когда вы пройдем.",пройдете,пройдем,Syntax,Subject-Predicate Agreement,noun_subj_predicate_agreement_person,noun_subj_predicate_agreement_person,librusec,2
331345,"Глупого случай правит, один он учитель.","Глупого случай правлю, один он учитель.",правит,правлю,Syntax,Subject-Predicate Agreement,noun_subj_predicate_agreement_person,noun_subj_predicate_agreement_person,librusec,3
293180,Тот сидит на табурете – охраняет штаб.,Тот сижу на табурете – охраняет штаб.,сидит,сижу,Syntax,Subject-Predicate Agreement,noun_subj_predicate_agreement_person,noun_subj_predicate_agreement_person,librusec,3
329658,Да я и без бойников такое умею!,Да я и без бойников такое умеешь!,умею,умеешь,Syntax,Subject-Predicate Agreement,noun_subj_predicate_agreement_person,noun_subj_predicate_agreement_person,librusec,2
307325,"Друль, Лешка, вы справитесь вдвоем?","Друль, Лешка, вы справимся вдвоем?",справитесь,справимся,Syntax,Subject-Predicate Agreement,noun_subj_predicate_agreement_person,noun_subj_predicate_agreement_person,librusec,3
260223,Вечно он становится у меня ну пути.,Вечно он становлюсь у меня ну пути.,становится,становлюсь,Syntax,Subject-Predicate Agreement,noun_subj_predicate_agreement_person,noun_subj_predicate_agreement_person,librusec,3
281600,Граф Форвользе обычно приезжает один на такси.,Граф Форвользе обычно приезжаю один на такси.,приезжает,приезжаю,Syntax,Subject-Predicate Agreement,noun_subj_predicate_agreement_person,noun_subj_predicate_agreement_person,librusec,3
350459,"Но вы помните письмо рабочего, каменщика?","Но вы помнят письмо рабочего, каменщика?",помните,помнят,Syntax,Subject-Predicate Agreement,noun_subj_predicate_agreement_person,noun_subj_predicate_agreement_person,librusec,4
344531,Как Элька входит в него – снимем.,Как Элька вхожу в него – снимем.,входит,вхожу,Syntax,Subject-Predicate Agreement,noun_subj_predicate_agreement_person,noun_subj_predicate_agreement_person,librusec,3
255049,Джо Чайнамен напорется на чертовски мощную засаду.,Джо Чайнамен напорюсь на чертовски мощную засаду.,напорется,напорюсь,Syntax,Subject-Predicate Agreement,noun_subj_predicate_agreement_person,noun_subj_predicate_agreement_person,librusec,4
315531,"Я останусь, только дай пару гранат?","Я останешься, только дай пару гранат?",останусь,останешься,Syntax,Subject-Predicate Agreement,noun_subj_predicate_agreement_person,noun_subj_predicate_agreement_person,librusec,3
277672,"Вдруг входит тот, с работы вернулся.","Вдруг вхожу тот, с работы вернулся.",входит,вхожу,Syntax,Subject-Predicate Agreement,noun_subj_predicate_agreement_person,noun_subj_predicate_agreement_person,librusec,4
309870,Теперь верхний карниз приходится на уровне плеч...,Теперь верхний карниз прихожусь на уровне плеч...,приходится,прихожусь,Syntax,Subject-Predicate Agreement,noun_subj_predicate_agreement_person,noun_subj_predicate_agreement_person,librusec,3
287610,Потом Франя с вами запасной одеждой поделится.,Потом Франя с вами запасной одеждой поделюсь.,поделится,поделюсь,Syntax,Subject-Predicate Agreement,noun_subj_predicate_agreement_person,noun_subj_predicate_agreement_person,librusec,4
344192,А вдруг Богдан начнет тосковать о Наде?,А вдруг Богдан начну тосковать о Наде?,начнет,начну,Syntax,Subject-Predicate Agreement,noun_subj_predicate_agreement_person,noun_subj_predicate_agreement_person,librusec,3
263477,Вы не знаете – они поймали Рега?,Вы не знают – они поймали Рега?,знаете,знают,Syntax,Subject-Predicate Agreement,noun_subj_predicate_agreement_person,noun_subj_predicate_agreement_person,librusec,2
310088,А вы никогда не слушаете – подарили!,А вы никогда не слушают – подарили!,слушаете,слушают,Syntax,Subject-Predicate Agreement,noun_subj_predicate_agreement_person,noun_subj_predicate_agreement_person,librusec,2
294468,"Двор меняется — быстрее, чем город.","Двор меняюсь — быстрее, чем город.",меняется,меняюсь,Syntax,Subject-Predicate Agreement,noun_subj_predicate_agreement_person,noun_subj_predicate_agreement_person,librusec,3
354394,Джаль оглянулась – никто ли не слышит.,Джаль оглянулась – никто ли не слышу.,слышит,слышу,Syntax,Subject-Predicate Agreement,noun_subj_predicate_agreement_person,noun_subj_predicate_agreement_person,librusec,3
268399,"Там живет Джошия Нрубу, знаменитый знахарь.","Там живу Джошия Нрубу, знаменитый знахарь.",живет,живу,Syntax,Subject-Predicate Agreement,noun_subj_predicate_agreement_person,noun_subj_predicate_agreement_person,librusec,3
328028,В приемной министра появляется австрийский посол Сапари.,В приемной министра появляюсь австрийский посол Сапари.,появляется,появляюсь,Syntax,Subject-Predicate Agreement,noun_subj_predicate_agreement_person,noun_subj_predicate_agreement_person,librusec,3
273674,Кто хочешь по ней эту сталь сварит.,Кто хочу по ней эту сталь сварит.,хочешь,хочу,Syntax,Subject-Predicate Agreement,noun_subj_predicate_agreement_person,noun_subj_predicate_agreement_person,librusec,4
290507,"К несчастью, к бару является Вероничка.","К несчастью, к бару являюсь Вероничка.",является,являюсь,Syntax,Subject-Predicate Agreement,noun_subj_predicate_agreement_person,noun_subj_predicate_agreement_person,librusec,3
249528,Ты будешь первым - Яхья отметил тебя.,Ты буду первым - Яхья отметил тебя.,будешь,буду,Syntax,Subject-Predicate Agreement,noun_subj_predicate_agreement_person,noun_subj_predicate_agreement_person,librusec,2
307733,"Другой подарок дам, – говорит старушонка.","Другой подарок дам, – говорю старушонка.",говорит,говорю,Syntax,Subject-Predicate Agreement,noun_subj_predicate_agreement_person,noun_subj_predicate_agreement_person,librusec,3
358928,Я опять вспомнила — это начинается вопросом.,Я опять вспомнила — это начинаюсь вопросом.,начинается,начинаюсь,Syntax,Subject-Predicate Agreement,noun_subj_predicate_agreement_person,noun_subj_predicate_agreement_person,librusec,2
307750,Катинка сидит спиной к Баю и гостям.,Катинка сижу спиной к Баю и гостям.,сидит,сижу,Syntax,Subject-Predicate Agreement,noun_subj_predicate_agreement_person,noun_subj_predicate_agreement_person,librusec,3
342016,"Кто смотрит картины, спрошу я вас?","Кто смотрю картины, спрошу я вас?",смотрит,смотрю,Syntax,Subject-Predicate Agreement,noun_subj_predicate_agreement_person,noun_subj_predicate_agreement_person,librusec,2
335350,Гректон тоже имеет о них поверхностные знания?,Гректон тоже имею о них поверхностные знания?,имеет,имею,Syntax,Subject-Predicate Agreement,noun_subj_predicate_agreement_person,noun_subj_predicate_agreement_person,librusec,3
241670,Они не могут не поверить командору Несу!,Они не можем не поверить командору Несу!,могут,можем,Syntax,Subject-Predicate Agreement,noun_subj_predicate_agreement_person,noun_subj_predicate_agreement_person,librusec,3
245567,Хоть двадцать грузовиков напиши – все примут.,Хоть двадцать грузовиков напиши – все примем.,примут,примем,Syntax,Subject-Predicate Agreement,noun_subj_predicate_agreement_person,noun_subj_predicate_agreement_person,librusec,4
331784,Принц Кинтэлл поэтому там сейчас и находится.,Принц Кинтэлл поэтому там сейчас и нахожусь.,находится,нахожусь,Syntax,Subject-Predicate Agreement,noun_subj_predicate_agreement_person,noun_subj_predicate_agreement_person,librusec,2
318742,Луи де Тири преподаст им его снова!,Луи де Тири преподам им его снова!,преподаст,преподам,Syntax,Subject-Predicate Agreement,noun_subj_predicate_agreement_person,noun_subj_predicate_agreement_person,librusec,3
329299,"И государь нас привечает, лично навещали.","И государь нас привечаю, лично навещали.",привечает,привечаю,Syntax,Subject-Predicate Agreement,noun_subj_predicate_agreement_person,noun_subj_predicate_agreement_person,librusec,2
244936,"Ой еее... интересно, сложность увеличивается.","Ой еее... интересно, сложность увеличиваюсь.",увеличивается,увеличиваюсь,Syntax,Subject-Predicate Agreement,noun_subj_predicate_agreement_person,noun_subj_predicate_agreement_person,librusec,2
92002,У нас же игра создается на стадионах.,У нас же игра создаюсь на стадионах.,создается,создаюсь,Syntax,Subject-Predicate Agreement,noun_subj_predicate_agreement_person,noun_subj_predicate_agreement_person,wikinews,3
72040,НАУЭТ приводит две оценки этого объема сегмента.,НАУЭТ привожу две оценки этого объема сегмента.,приводит,привожу,Syntax,Subject-Predicate Agreement,noun_subj_predicate_agreement_person,noun_subj_predicate_agreement_person,wikinews,3
41067,"И главное, ведь остальное все соответствует!","И главное, ведь остальное все соответствую!",соответствует,соответствую,Syntax,Subject-Predicate Agreement,noun_subj_predicate_agreement_person,noun_subj_predicate_agreement_person,wikinews,3
107227,"Пулев заселится 5 декабря, в субботу.","Пулев заселюсь 5 декабря, в субботу.",заселится,заселюсь,Syntax,Subject-Predicate Agreement,noun_subj_predicate_agreement_person,noun_subj_predicate_agreement_person,wikinews,3
54513,Мама Оно так и называется — зоологическое.,Мама Оно так и называюсь — зоологическое.,называется,называюсь,Syntax,Subject-Predicate Agreement,noun_subj_predicate_agreement_person,noun_subj_predicate_agreement_person,wikinews,2
76554,"Человек умеет все, но до штрафной.","Человек умею все, но до штрафной.",умеет,умею,Syntax,Subject-Predicate Agreement,noun_subj_predicate_agreement_person,noun_subj_predicate_agreement_person,wikinews,2
69411,Я специально еду всреду на этот кабмин.,Я специально едешь всреду на этот кабмин.,еду,едешь,Syntax,Subject-Predicate Agreement,noun_subj_predicate_agreement_person,noun_subj_predicate_agreement_person,wikinews,2
75759,Оно занимается вопросом вместе с агентом Миранчука.,Оно занимаюсь вопросом вместе с агентом Миранчука.,занимается,занимаюсь,Syntax,Subject-Predicate Agreement,noun_subj_predicate_agreement_person,noun_subj_predicate_agreement_person,wikinews,3
113985,При этом решение Трампа отдельно не упоминается.,При этом решение Трампа отдельно не упоминаюсь.,упоминается,упоминаюсь,Syntax,Subject-Predicate Agreement,noun_subj_predicate_agreement_person,noun_subj_predicate_agreement_person,wikinews,3
114800,"Жвания был убит, считает представитель оппозиции.","Жвания был убит, считаю представитель оппозиции.",считает,считаю,Syntax,Subject-Predicate Agreement,noun_subj_predicate_agreement_person,noun_subj_predicate_agreement_person,wikinews,3
102277,Жирайр Бабазян играет роль Ботрома и Деметриуса.,Жирайр Бабазян играю роль Ботрома и Деметриуса.,играет,играю,Syntax,Subject-Predicate Agreement,noun_subj_predicate_agreement_person,noun_subj_predicate_agreement_person,wikinews,5
96588,"Это ясно менее всего, отмечает издание.","Это ясно менее всего, отмечаю издание.",отмечает,отмечаю,Syntax,Subject-Predicate Agreement,noun_subj_predicate_agreement_person,noun_subj_predicate_agreement_person,wikinews,3
106991,"Просто делают деньги, - говорит офицер.","Просто делают деньги, - говорю офицер.",говорит,говорю,Syntax,Subject-Predicate Agreement,noun_subj_predicate_agreement_person,noun_subj_predicate_agreement_person,wikinews,2
220664,Царевич Ву и Ту отправляется за помощью.,Царевич Ву и Ту отправляюсь за помощью.,отправляется,отправляюсь,Syntax,Subject-Predicate Agreement,noun_subj_predicate_agreement_person,noun_subj_predicate_agreement_person,wikipedia,5
149878,"Очевидно — это значит, докажите сами.","Очевидно — это значу, докажите сами.",значит,значу,Syntax,Subject-Predicate Agreement,noun_subj_predicate_agreement_person,noun_subj_predicate_agreement_person,wikipedia,3
165257,В Океании на разогреве выступит Джаи Ваетфорд.,В Океании на разогреве выступлю Джаи Ваетфорд.,выступит,выступлю,Syntax,Subject-Predicate Agreement,noun_subj_predicate_agreement_person,noun_subj_predicate_agreement_person,wikipedia,4
152477,Водяной предлагает Алевипоэгу самому назначить любую плату.,Водяной предлагаю Алевипоэгу самому назначить любую плату.,предлагает,предлагаю,Syntax,Subject-Predicate Agreement,noun_subj_predicate_agreement_person,noun_subj_predicate_agreement_person,wikipedia,4
187100,Район Микагэ находится в устье реки Исия.,Район Микагэ нахожусь в устье реки Исия.,находится,нахожусь,Syntax,Subject-Predicate Agreement,noun_subj_predicate_agreement_person,noun_subj_predicate_agreement_person,wikipedia,4
192158,Все имущество пунан может унести с собой.,Все имущество пунан могу унести с собой.,может,могу,Syntax,Subject-Predicate Agreement,noun_subj_predicate_agreement_person,noun_subj_predicate_agreement_person,wikipedia,4
237477,Особенные министры здоровья могут стать епископами Дженезис.,Особенные министры здоровья можем стать епископами Дженезис.,могут,можем,Syntax,Subject-Predicate Agreement,noun_subj_predicate_agreement_person,noun_subj_predicate_agreement_person,wikipedia,4
210776,Вирно развивает реактулизированный Антонио Негри концепт множества.,Вирно развиваю реактулизированный Антонио Негри концепт множества.,развивает,развиваю,Syntax,Subject-Predicate Agreement,noun_subj_predicate_agreement_person,noun_subj_predicate_agreement_person,wikipedia,4
143312,Камагурка придумывает шутки и Герр Зеле рисует.,Камагурка придумываю шутки и Герр Зеле рисует.,придумывает,придумываю,Syntax,Subject-Predicate Agreement,noun_subj_predicate_agreement_person,noun_subj_predicate_agreement_person,wikipedia,3
129626,Рядом находится другое село - добрый Сот.,Рядом нахожусь другое село - добрый Сот.,находится,нахожусь,Syntax,Subject-Predicate Agreement,noun_subj_predicate_agreement_person,noun_subj_predicate_agreement_person,wikipedia,3
158507,Это означает конец для древней Кавалаанской культуры.,Это означаю конец для древней Кавалаанской культуры.,означает,означаю,Syntax,Subject-Predicate Agreement,noun_subj_predicate_agreement_person,noun_subj_predicate_agreement_person,wikipedia,3
203806,Протока Семдолген соединяет губу с заливом Западным.,Протока Семдолген соединяю губу с заливом Западным.,соединяет,соединяю,Syntax,Subject-Predicate Agreement,noun_subj_predicate_agreement_person,noun_subj_predicate_agreement_person,wikipedia,3
230250,Бхатта является секретарем КПН (ОМЛ).,Бхатта являюсь секретарем КПН (ОМЛ).,является,являюсь,Syntax,Subject-Predicate Agreement,noun_subj_predicate_agreement_person,noun_subj_predicate_agreement_person,wikipedia,4
197561,На Илеше располагается довольно крупный поселок Красная.,На Илеше располагаюсь довольно крупный поселок Красная.,располагается,располагаюсь,Syntax,Subject-Predicate Agreement,noun_subj_predicate_agreement_person,noun_subj_predicate_agreement_person,wikipedia,4
139637,Тогда Джей все же решает убить Трана.,Тогда Джей все же решаю убить Трана.,решает,решаю,Syntax,Subject-Predicate Agreement,noun_subj_predicate_agreement_person,noun_subj_predicate_agreement_person,wikipedia,3
201236,"Но начинается война, жизнь Леа меняется.","Но начинаюсь война, жизнь Леа меняется.",начинается,начинаюсь,Syntax,Subject-Predicate Agreement,noun_subj_predicate_agreement_person,noun_subj_predicate_agreement_person,wikipedia,3
140701,Центр Ловины находится в бывшей деревне Калибукбук.,Центр Ловины нахожусь в бывшей деревне Калибукбук.,находится,нахожусь,Syntax,Subject-Predicate Agreement,noun_subj_predicate_agreement_person,noun_subj_predicate_agreement_person,wikipedia,3
185234,"Позднее, Кэрри говорит Броуди его варианты.","Позднее, Кэрри говорю Броуди его варианты.",говорит,говорю,Syntax,Subject-Predicate Agreement,noun_subj_predicate_agreement_person,noun_subj_predicate_agreement_person,wikipedia,3
193801,Город Барда становится основным центром арабской администрации.,Город Барда становлюсь основным центром арабской администрации.,становится,становлюсь,Syntax,Subject-Predicate Agreement,noun_subj_predicate_agreement_person,noun_subj_predicate_agreement_person,wikipedia,4
184636,В основном отдается предпочтение над ними истихсану.,В основном отдаюсь предпочтение над ними истихсану.,отдается,отдаюсь,Syntax,Subject-Predicate Agreement,noun_subj_predicate_agreement_person,noun_subj_predicate_agreement_person,wikipedia,4
161089,Джулс сначала соглашается принять на работу кандидата.,Джулс сначала соглашаюсь принять на работу кандидата.,соглашается,соглашаюсь,Syntax,Subject-Predicate Agreement,noun_subj_predicate_agreement_person,noun_subj_predicate_agreement_person,wikipedia,3
212104,"Игрок впервые найдет аполигон, новый ППЕС.","Игрок впервые найду аполигон, новый ППЕС.",найдет,найду,Syntax,Subject-Predicate Agreement,noun_subj_predicate_agreement_person,noun_subj_predicate_agreement_person,wikipedia,3
191605,В комплект входит как правило один упор.,В комплект вхожу как правило один упор.,входит,вхожу,Syntax,Subject-Predicate Agreement,noun_subj_predicate_agreement_person,noun_subj_predicate_agreement_person,wikipedia,4
187771,"Она соглашается, но их замечает Като.","Она соглашаюсь, но их замечает Като.",соглашается,соглашаюсь,Syntax,Subject-Predicate Agreement,noun_subj_predicate_agreement_person,noun_subj_predicate_agreement_person,wikipedia,2
202037,Конти устраивает Марко очную ставку с Ваней.,Конти устраиваю Марко очную ставку с Ваней.,устраивает,устраиваю,Syntax,Subject-Predicate Agreement,noun_subj_predicate_agreement_person,noun_subj_predicate_agreement_person,wikipedia,3
138881,Послекораническое исламское предание единодушно идентифицирует Узайра Эзрой.,Послекораническое исламское предание единодушно идентифицирую Узайра Эзрой.,идентифицирует,идентифицирую,Syntax,Subject-Predicate Agreement,noun_subj_predicate_agreement_person,noun_subj_predicate_agreement_person,wikipedia,3
