id,source_sentence,target_sentence,source_word,target_word,level,phenomenon,PID,subtype,domain,tree_depth
172000,Охотничий пард Дорманожа с легкостью поспевал за собаками.,Охотничий пард Дорманожа с легкостью поспевала за собаками.,поспевал,поспевала,Syntax,Subject-Predicate Agreement,subj_predicate_agreement_gender_attractor,subj_predicate_agreement_gender_attractor,librusec,4
216341,"Дом все равно защищен магически, – прошипел Олет.","Дом все равно защищено магически, – прошипел Олет.",защищен,защищено,Syntax,Subject-Predicate Agreement,subj_predicate_agreement_gender_attractor,subj_predicate_agreement_gender_attractor,librusec,3
224441,Клюшка Хоу была на целых три дюйма короче макниловой.,Клюшка Хоу был на целых три дюйма короче макниловой.,была,был,Syntax,Subject-Predicate Agreement,subj_predicate_agreement_gender_attractor,subj_predicate_agreement_gender_attractor,librusec,3
196713,"Но, Алеша, отец тебе не все сказал.","Но, Алеша, отец тебе не все сказало.",сказал,сказало,Syntax,Subject-Predicate Agreement,subj_predicate_agreement_gender_attractor,subj_predicate_agreement_gender_attractor,librusec,3
153514,"А большой спорт ей, я думаю, закрыт.","А большой спорт ей, я думаю, закрыта.",закрыт,закрыта,Syntax,Subject-Predicate Agreement,subj_predicate_agreement_gender_attractor,subj_predicate_agreement_gender_attractor,librusec,4
201388,А шардевкатран и в самом деле был уже здесь.,А шардевкатран и в самом деле было уже здесь.,был,было,Syntax,Subject-Predicate Agreement,subj_predicate_agreement_gender_attractor,subj_predicate_agreement_gender_attractor,librusec,2
220139,Но вскоре йомфру Ингирид наскучило сидеть среди женщин.,Но вскоре йомфру Ингирид наскучил сидеть среди женщин.,наскучило,наскучил,Syntax,Subject-Predicate Agreement,subj_predicate_agreement_gender_attractor,subj_predicate_agreement_gender_attractor,librusec,4
192391,"Матушку Пань пригласила, а она гонор выказала.","Матушку Пань пригласила, а она гонор выказал.",выказала,выказал,Syntax,Subject-Predicate Agreement,subj_predicate_agreement_gender_attractor,subj_predicate_agreement_gender_attractor,librusec,3
180061,Мед Поэзии дарил телу Хозяина Гамелинов восхитительное тепло отваги.,Мед Поэзии дарила телу Хозяина Гамелинов восхитительное тепло отваги.,дарил,дарила,Syntax,Subject-Predicate Agreement,subj_predicate_agreement_gender_attractor,subj_predicate_agreement_gender_attractor,librusec,5
194026,"Да, этот докторишка ей совершенно не понравился.","Да, этот докторишка ей совершенно не понравилась.",понравился,понравилась,Syntax,Subject-Predicate Agreement,subj_predicate_agreement_gender_attractor,subj_predicate_agreement_gender_attractor,librusec,3
165062,Сбилась на бок немного волос ее черная туча.,Сбился на бок немного волос ее черная туча.,Сбилась,Сбился,Syntax,Subject-Predicate Agreement,subj_predicate_agreement_gender_attractor,subj_predicate_agreement_gender_attractor,librusec,4
194117,Вот и стоял на поместье целый порядок изб.,Вот и стояло на поместье целый порядок изб.,стоял,стояло,Syntax,Subject-Predicate Agreement,subj_predicate_agreement_gender_attractor,subj_predicate_agreement_gender_attractor,librusec,3
222970,"Одна булавка, спасибо, у супруги моей нашлась.","Одна булавка, спасибо, у супруги моей нашлось.",нашлась,нашлось,Syntax,Subject-Predicate Agreement,subj_predicate_agreement_gender_attractor,subj_predicate_agreement_gender_attractor,librusec,4
171602,"Даже копье, говорят, и то утопил!","Даже копье, говорят, и то утопило!",утопил,утопило,Syntax,Subject-Predicate Agreement,subj_predicate_agreement_gender_attractor,subj_predicate_agreement_gender_attractor,librusec,4
216155,"Еще чудо, что Нонна у самого окна лежала.","Еще чудо, что Нонна у самого окна лежало.",лежала,лежало,Syntax,Subject-Predicate Agreement,subj_predicate_agreement_gender_attractor,subj_predicate_agreement_gender_attractor,librusec,3
162275,В их беседах имя Муре еще никогда не произносилось.,В их беседах имя Муре еще никогда не произносился.,произносилось,произносился,Syntax,Subject-Predicate Agreement,subj_predicate_agreement_gender_attractor,subj_predicate_agreement_gender_attractor,librusec,4
187377,Но голос в этой части спора всегда умолкал.,Но голос в этой части спора всегда умолкала.,умолкал,умолкала,Syntax,Subject-Predicate Agreement,subj_predicate_agreement_gender_attractor,subj_predicate_agreement_gender_attractor,librusec,3
187645,"Не шли, знать нужда в том была.","Не шли, знать нужда в том было.",была,было,Syntax,Subject-Predicate Agreement,subj_predicate_agreement_gender_attractor,subj_predicate_agreement_gender_attractor,librusec,4
167066,Запасной космодром Бастурманбастманчской столицы Отстоево дал добро на посадку...,Запасной космодром Бастурманбастманчской столицы Отстоево дала добро на посадку...,дал,дала,Syntax,Subject-Predicate Agreement,subj_predicate_agreement_gender_attractor,subj_predicate_agreement_gender_attractor,librusec,5
199648,На пару с Холерой он до всего допер.,На пару с Холерой он до всего доперло.,допер,доперло,Syntax,Subject-Predicate Agreement,subj_predicate_agreement_gender_attractor,subj_predicate_agreement_gender_attractor,librusec,4
208209,"А ухо, которое держит, что ему полюбилось.","А ухо, которое держит, что ему полюбился.",полюбилось,полюбился,Syntax,Subject-Predicate Agreement,subj_predicate_agreement_gender_attractor,subj_predicate_agreement_gender_attractor,librusec,3
166439,"Голос Фаун Догерти дрожал, пробившись через шорох помех.","Голос Фаун Догерти дрожала, пробившись через шорох помех.",дрожал,дрожала,Syntax,Subject-Predicate Agreement,subj_predicate_agreement_gender_attractor,subj_predicate_agreement_gender_attractor,librusec,5
156205,Время для выхода на поиск позиции самое подходящее.,Время для выхода на поиск позиции самое подходящая.,подходящее,подходящая,Syntax,Subject-Predicate Agreement,subj_predicate_agreement_gender_attractor,subj_predicate_agreement_gender_attractor,librusec,4
184526,Толстый паж Бэтлы ободряюще улыбнулся Ирке и исчез.,Толстый паж Бэтлы ободряюще улыбнулась Ирке и исчез.,улыбнулся,улыбнулась,Syntax,Subject-Predicate Agreement,subj_predicate_agreement_gender_attractor,subj_predicate_agreement_gender_attractor,librusec,3
191216,Морт Омм и ее разделял теперь долгий-долгий путь.,Морт Омм и ее разделяла теперь долгий-долгий путь.,разделял,разделяла,Syntax,Subject-Predicate Agreement,subj_predicate_agreement_gender_attractor,subj_predicate_agreement_gender_attractor,librusec,4
182390,Тогда тоже рота танков в момент все придавила.,Тогда тоже рота танков в момент все придавил.,придавила,придавил,Syntax,Subject-Predicate Agreement,subj_predicate_agreement_gender_attractor,subj_predicate_agreement_gender_attractor,librusec,3
150165,"На деле, Берри Лиар лишь чудом сохранил себя.","На деле, Берри Лиар лишь чудом сохранило себя.",сохранил,сохранило,Syntax,Subject-Predicate Agreement,subj_predicate_agreement_gender_attractor,subj_predicate_agreement_gender_attractor,librusec,4
160279,Так вот Качан конкретно на его движение наехал.,Так вот Качан конкретно на его движение наехало.,наехал,наехало,Syntax,Subject-Predicate Agreement,subj_predicate_agreement_gender_attractor,subj_predicate_agreement_gender_attractor,librusec,3
216597,Велютта в ее представлении сделался ответствен за всю демонстрацию.,Велютта в ее представлении сделалось ответствен за всю демонстрацию.,сделался,сделалось,Syntax,Subject-Predicate Agreement,subj_predicate_agreement_gender_attractor,subj_predicate_agreement_gender_attractor,librusec,4
220618,"Это Наташе не понравилось – фи, полиэтиленовый пакет.","Это Наташе не понравилась – фи, полиэтиленовый пакет.",понравилось,понравилась,Syntax,Subject-Predicate Agreement,subj_predicate_agreement_gender_attractor,subj_predicate_agreement_gender_attractor,librusec,4
198123,А супруг ее Стас заговорил словно по писаному.,А супруг ее Стас заговорила словно по писаному.,заговорил,заговорила,Syntax,Subject-Predicate Agreement,subj_predicate_agreement_gender_attractor,subj_predicate_agreement_gender_attractor,librusec,3
197285,Как вода первый этаж покрыла и ко второму прется.,Как вода первый этаж покрыл и ко второму прется.,покрыла,покрыл,Syntax,Subject-Predicate Agreement,subj_predicate_agreement_gender_attractor,subj_predicate_agreement_gender_attractor,librusec,5
205676,"Хорошенькая Жанна Успенская, жена Андре, сияла.","Хорошенькая Жанна Успенская, жена Андре, сиял.",сияла,сиял,Syntax,Subject-Predicate Agreement,subj_predicate_agreement_gender_attractor,subj_predicate_agreement_gender_attractor,librusec,3
191430,Мырзакельды при имени Садыра плюнул и тронул коня.,Мырзакельды при имени Садыра плюнуло и тронул коня.,плюнул,плюнуло,Syntax,Subject-Predicate Agreement,subj_predicate_agreement_gender_attractor,subj_predicate_agreement_gender_attractor,librusec,3
186818,"Ну, девушка тоже одна на уме была.","Ну, девушка тоже одна на уме был.",была,был,Syntax,Subject-Predicate Agreement,subj_predicate_agreement_gender_attractor,subj_predicate_agreement_gender_attractor,librusec,3
166268,Ведь он тогда у господина Ся с ней договорился.,Ведь он тогда у господина Ся с ней договорилась.,договорился,договорилась,Syntax,Subject-Predicate Agreement,subj_predicate_agreement_gender_attractor,subj_predicate_agreement_gender_attractor,librusec,3
203128,"Герман и Герман, имя по вкусу пришлось!","Герман и Герман, имя по вкусу пришелся!",пришлось,пришелся,Syntax,Subject-Predicate Agreement,subj_predicate_agreement_gender_attractor,subj_predicate_agreement_gender_attractor,librusec,4
189063,У меня вон вся ванная белым клавишем отделана.,У меня вон вся ванная белым клавишем отделан.,отделана,отделан,Syntax,Subject-Predicate Agreement,subj_predicate_agreement_gender_attractor,subj_predicate_agreement_gender_attractor,librusec,4
217312,И ключ от победы сейчас хранился в Шалоне.,И ключ от победы сейчас хранилась в Шалоне.,хранился,хранилась,Syntax,Subject-Predicate Agreement,subj_predicate_agreement_gender_attractor,subj_predicate_agreement_gender_attractor,librusec,4
165082,Лицо царицы Лострис было прописано с великой любовью.,Лицо царицы Лострис была прописано с великой любовью.,было,была,Syntax,Subject-Predicate Agreement,subj_predicate_agreement_gender_attractor,subj_predicate_agreement_gender_attractor,librusec,4
165186,Рука Натро все так же крепко сжимала руку конгая.,Рука Натро все так же крепко сжимал руку конгая.,сжимала,сжимал,Syntax,Subject-Predicate Agreement,subj_predicate_agreement_gender_attractor,subj_predicate_agreement_gender_attractor,librusec,5
198390,"Юлька ответила, но фамилия Кураев полковнику ничего не сказала.","Юлька ответила, но фамилия Кураев полковнику ничего не сказал.",сказала,сказал,Syntax,Subject-Predicate Agreement,subj_predicate_agreement_gender_attractor,subj_predicate_agreement_gender_attractor,librusec,3
192313,Ведь вчера он впервые в жизни принял сааму по настоянию Хотоя.,Ведь вчера он впервые в жизни приняла сааму по настоянию Хотоя.,принял,приняла,Syntax,Subject-Predicate Agreement,subj_predicate_agreement_gender_attractor,subj_predicate_agreement_gender_attractor,librusec,4
183823,"Тимур тебе что сказал, половина в общак, остальное тебе...","Тимур тебе что сказало, половина в общак, остальное тебе...",сказал,сказало,Syntax,Subject-Predicate Agreement,subj_predicate_agreement_gender_attractor,subj_predicate_agreement_gender_attractor,librusec,4
183754,Здесь ведь никому не являлся на помощь заморский ярл с сотенной дружиной.,Здесь ведь никому не являлась на помощь заморский ярл с сотенной дружиной.,являлся,являлась,Syntax,Subject-Predicate Agreement,subj_predicate_agreement_gender_attractor,subj_predicate_agreement_gender_attractor,librusec,4
153609,"Это на майндере не записано, но если хочешь, сделаю...","Это на майндере не записан, но если хочешь, сделаю...",записано,записан,Syntax,Subject-Predicate Agreement,subj_predicate_agreement_gender_attractor,subj_predicate_agreement_gender_attractor,librusec,4
177634,"Рендл всегда все делал иначе, чем прочие, вспомнил Прадо.","Рендл всегда все делало иначе, чем прочие, вспомнил Прадо.",делал,делало,Syntax,Subject-Predicate Agreement,subj_predicate_agreement_gender_attractor,subj_predicate_agreement_gender_attractor,librusec,4
216252,А Хань Айцзе тем временем оставалась вместе с Гэ Цуйпин.,А Хань Айцзе тем временем оставалось вместе с Гэ Цуйпин.,оставалась,оставалось,Syntax,Subject-Predicate Agreement,subj_predicate_agreement_gender_attractor,subj_predicate_agreement_gender_attractor,librusec,6
179047,Подул тогда с неба ветер холодный и снова камни застудил.,Подуло тогда с неба ветер холодный и снова камни застудил.,Подул,Подуло,Syntax,Subject-Predicate Agreement,subj_predicate_agreement_gender_attractor,subj_predicate_agreement_gender_attractor,librusec,4
201356,"А тот книгу взял, а сам убить себя позволил.","А тот книгу взяла, а сам убить себя позволил.",взял,взяла,Syntax,Subject-Predicate Agreement,subj_predicate_agreement_gender_attractor,subj_predicate_agreement_gender_attractor,librusec,3
159125,"Антонида, многое взявши у матери, с каменным лицом перевела.","Антонида, многое взявши у матери, с каменным лицом перевело.",перевела,перевело,Syntax,Subject-Predicate Agreement,subj_predicate_agreement_gender_attractor,subj_predicate_agreement_gender_attractor,librusec,5
157854,Часть денег Церкви и Ордена крови Бриана оседала на руках Его Святейшества.,Часть денег Церкви и Ордена крови Бриана оседал на руках Его Святейшества.,оседала,оседал,Syntax,Subject-Predicate Agreement,subj_predicate_agreement_gender_attractor,subj_predicate_agreement_gender_attractor,librusec,7
174601,Он не из пустой вежливости задал этот вопрос – Неизмир выглядел плохо.,Он не из пустой вежливости задала этот вопрос – Неизмир выглядел плохо.,задал,задала,Syntax,Subject-Predicate Agreement,subj_predicate_agreement_gender_attractor,subj_predicate_agreement_gender_attractor,librusec,4
208034,Но другое – запрещение инцеста имело также сильное практическое основание.,Но другое – запрещение инцеста имел также сильное практическое основание.,имело,имел,Syntax,Subject-Predicate Agreement,subj_predicate_agreement_gender_attractor,subj_predicate_agreement_gender_attractor,librusec,4
160057,"Дорманож заметил: кармашек оказался коротковат, треть клинка осталась снаружи.","Дорманож заметил: кармашек оказался коротковат, треть клинка остался снаружи.",осталась,остался,Syntax,Subject-Predicate Agreement,subj_predicate_agreement_gender_attractor,subj_predicate_agreement_gender_attractor,librusec,4
219499,"И Вадим второй, не скрывая радости, сделал значительное лицо.","И Вадим второй, не скрывая радости, сделала значительное лицо.",сделал,сделала,Syntax,Subject-Predicate Agreement,subj_predicate_agreement_gender_attractor,subj_predicate_agreement_gender_attractor,librusec,4
156964,"Сейчас Карл явственно это помнил, тогда же едва обратил внимание.","Сейчас Карл явственно это помнило, тогда же едва обратил внимание.",помнил,помнило,Syntax,Subject-Predicate Agreement,subj_predicate_agreement_gender_attractor,subj_predicate_agreement_gender_attractor,librusec,3
180142,"Вопрос ""чего-нибудь с базы"" в тауне вообще стоял крепко.","Вопрос ""чего-нибудь с базы"" в тауне вообще стояла крепко.",стоял,стояла,Syntax,Subject-Predicate Agreement,subj_predicate_agreement_gender_attractor,subj_predicate_agreement_gender_attractor,librusec,5
170766,"Потому что на ""пятак"" она предмет никогда не знала.","Потому что на ""пятак"" она предмет никогда не знал.",знала,знал,Syntax,Subject-Predicate Agreement,subj_predicate_agreement_gender_attractor,subj_predicate_agreement_gender_attractor,librusec,3
152302,Но Нэнси все стерла и закрыла Зоранне доступ к системе.,Но Нэнси все стерло и закрыла Зоранне доступ к системе.,стерла,стерло,Syntax,Subject-Predicate Agreement,subj_predicate_agreement_gender_attractor,subj_predicate_agreement_gender_attractor,librusec,4
200861,"И, как обычно, интуиция Ло полностью его подвела.","И, как обычно, интуиция Ло полностью его подвел.",подвела,подвел,Syntax,Subject-Predicate Agreement,subj_predicate_agreement_gender_attractor,subj_predicate_agreement_gender_attractor,librusec,3
223323,"Не принесла Оксютка мне такого правнучка, чтоб сразу крылышки знатко было.","Не принес Оксютка мне такого правнучка, чтоб сразу крылышки знатко было.",принесла,принес,Syntax,Subject-Predicate Agreement,subj_predicate_agreement_gender_attractor,subj_predicate_agreement_gender_attractor,librusec,4
204290,И уже через десять минут станция Дарка выдала сигнал вызова.,И уже через десять минут станция Дарка выдал сигнал вызова.,выдала,выдал,Syntax,Subject-Predicate Agreement,subj_predicate_agreement_gender_attractor,subj_predicate_agreement_gender_attractor,librusec,4
208942,"Он хоть кричал, а вовсе народ на пожарну не гонял.","Он хоть кричал, а вовсе народ на пожарну не гоняла.",гонял,гоняла,Syntax,Subject-Predicate Agreement,subj_predicate_agreement_gender_attractor,subj_predicate_agreement_gender_attractor,librusec,3
213204,"Он многое повидал и понял, почему Син Коуртни все еще сержант.","Он многое повидало и понял, почему Син Коуртни все еще сержант.",повидал,повидало,Syntax,Subject-Predicate Agreement,subj_predicate_agreement_gender_attractor,subj_predicate_agreement_gender_attractor,librusec,5
194392,"Ох, и пилила же тогда Гая его верная Клавдия.","Ох, и пилил же тогда Гая его верная Клавдия.",пилила,пилил,Syntax,Subject-Predicate Agreement,subj_predicate_agreement_gender_attractor,subj_predicate_agreement_gender_attractor,librusec,3
217124,"Вернее, Вадим этот нарочно при ней про Севу сказал.","Вернее, Вадим этот нарочно при ней про Севу сказала.",сказал,сказала,Syntax,Subject-Predicate Agreement,subj_predicate_agreement_gender_attractor,subj_predicate_agreement_gender_attractor,librusec,5
221939,"Хотя Рама только играла в напугалку, Скелет-то этого не знал!","Хотя Рама только играла в напугалку, Скелет-то этого не знало!",знал,знало,Syntax,Subject-Predicate Agreement,subj_predicate_agreement_gender_attractor,subj_predicate_agreement_gender_attractor,librusec,3
186456,Зато Марлена после концертной поездки на фронт была капризнее обычного.,Зато Марлена после концертной поездки на фронт был капризнее обычного.,была,был,Syntax,Subject-Predicate Agreement,subj_predicate_agreement_gender_attractor,subj_predicate_agreement_gender_attractor,librusec,3
170862,Брат больше ее самой о ней тревожился и сам же выдал.,Брат больше ее самой о ней тревожилась и сам же выдал.,тревожился,тревожилась,Syntax,Subject-Predicate Agreement,subj_predicate_agreement_gender_attractor,subj_predicate_agreement_gender_attractor,librusec,5
198115,Один из соложников моей Ангнани попал в ее дом именно так!,Один из соложников моей Ангнани попала в ее дом именно так!,попал,попала,Syntax,Subject-Predicate Agreement,subj_predicate_agreement_gender_attractor,subj_predicate_agreement_gender_attractor,librusec,6
