id,source_sentence,target_sentence,source_word,target_word,level,phenomenon,PID,subtype,domain,tree_depth
214885,Симэнь со скромно опущенной головой сел с ними за компанию.,Симэнь со скромно опущенной головой села с ними за компанию.,сел,села,Syntax,Subject-Predicate Agreement,subj_predicate_agreement_gender_attractor,subj_predicate_agreement_gender_attractor,librusec,6
174871,Для меня выбор США и Херша местом будущего чемпионата показался не случайным.,Для меня выбор США и Херша местом будущего чемпионата показалось не случайным.,показался,показалось,Syntax,Subject-Predicate Agreement,subj_predicate_agreement_gender_attractor,subj_predicate_agreement_gender_attractor,librusec,8
187738,"Косарь вроде бы отстал, хотя Брофи сильно в этом сомневался.","Косарь вроде бы отстал, хотя Брофи сильно в этом сомневалось.",сомневался,сомневалось,Syntax,Subject-Predicate Agreement,subj_predicate_agreement_gender_attractor,subj_predicate_agreement_gender_attractor,librusec,4
169832,Между тем запретная дата злополучного события была составителям проваряжской версии известна.,Между тем запретная дата злополучного события было составителям проваряжской версии известна.,была,было,Syntax,Subject-Predicate Agreement,subj_predicate_agreement_gender_attractor,subj_predicate_agreement_gender_attractor,librusec,6
198411,"Потом первая часть отвалилась, и он у нас просто Питохой стал.","Потом первая часть отвалилась, и он у нас просто Питохой стала.",стал,стала,Syntax,Subject-Predicate Agreement,subj_predicate_agreement_gender_attractor,subj_predicate_agreement_gender_attractor,librusec,5
203050,Кого между нами Не подчинила себе Вакха и Пафии власть?,Кого между нами Не подчинил себе Вакха и Пафии власть?,подчинила,подчинил,Syntax,Subject-Predicate Agreement,subj_predicate_agreement_gender_attractor,subj_predicate_agreement_gender_attractor,librusec,4
151156,"А Федор друг отца, теперь он на маме женился.","А Федор друг отца, теперь он на маме женилась.",женился,женилась,Syntax,Subject-Predicate Agreement,subj_predicate_agreement_gender_attractor,subj_predicate_agreement_gender_attractor,librusec,3
186421,"Женщина Гнона поехала за ним, а следом – остальные воины-урнгриа.","Женщина Гнона поехал за ним, а следом – остальные воины-урнгриа.",поехала,поехал,Syntax,Subject-Predicate Agreement,subj_predicate_agreement_gender_attractor,subj_predicate_agreement_gender_attractor,librusec,5
213113,"То, что нам давно говорил товарищ Думпис, свершилось!","То, что нам давно говорил товарищ Думпис, свершился!",свершилось,свершился,Syntax,Subject-Predicate Agreement,subj_predicate_agreement_gender_attractor,subj_predicate_agreement_gender_attractor,librusec,4
197439,Старший поста наблюдения должен спустить Бекасу рацию для связи с Абдулой?,Старший поста наблюдения должно спустить Бекасу рацию для связи с Абдулой?,должен,должно,Syntax,Subject-Predicate Agreement,subj_predicate_agreement_gender_attractor,subj_predicate_agreement_gender_attractor,librusec,7
206891,Зато народ в офисе серым понедельничным утром просто с копыт попадал.,Зато народ в офисе серым понедельничным утром просто с копыт попадало.,попадал,попадало,Syntax,Subject-Predicate Agreement,subj_predicate_agreement_gender_attractor,subj_predicate_agreement_gender_attractor,librusec,4
178680,"Резиновое покрытие на металлическом лице работа, казалось, обтекло вниз.","Резиновое покрытие на металлическом лице работа, казалось, обтекла вниз.",обтекло,обтекла,Syntax,Subject-Predicate Agreement,subj_predicate_agreement_gender_attractor,subj_predicate_agreement_gender_attractor,librusec,4
202265,"А сознание подгоняет под ответ то, что в результате произошло!","А сознание подгоняет под ответ то, что в результате произошел!",произошло,произошел,Syntax,Subject-Predicate Agreement,subj_predicate_agreement_gender_attractor,subj_predicate_agreement_gender_attractor,librusec,5
187850,Но коготь птицы Гру позволил мне разглядеть вашу двойную тень.,Но коготь птицы Гру позволила мне разглядеть вашу двойную тень.,позволил,позволила,Syntax,Subject-Predicate Agreement,subj_predicate_agreement_gender_attractor,subj_predicate_agreement_gender_attractor,librusec,5
217683,В Магфорде она в тот раз провела не больше получаса.,В Магфорде она в тот раз провел не больше получаса.,провела,провел,Syntax,Subject-Predicate Agreement,subj_predicate_agreement_gender_attractor,subj_predicate_agreement_gender_attractor,librusec,5
223352,Голова ударса без всякого предупреждения обрушилась на ближайшего к нему рвуна.,Голова ударса без всякого предупреждения обрушилось на ближайшего к нему рвуна.,обрушилась,обрушилось,Syntax,Subject-Predicate Agreement,subj_predicate_agreement_gender_attractor,subj_predicate_agreement_gender_attractor,librusec,6
210249,"Тот сообщение принял, связал Шалдаева с начальником районного отдела.","Тот сообщение приняло, связал Шалдаева с начальником районного отдела.",принял,приняло,Syntax,Subject-Predicate Agreement,subj_predicate_agreement_gender_attractor,subj_predicate_agreement_gender_attractor,librusec,4
221511,В животе у Бага и так уж плескался без малого чайник.,В животе у Бага и так уж плескалось без малого чайник.,плескался,плескалось,Syntax,Subject-Predicate Agreement,subj_predicate_agreement_gender_attractor,subj_predicate_agreement_gender_attractor,librusec,5
182602,Который в синем картузе — на площадку пытался выйти от греха.,Который в синем картузе — на площадку пыталась выйти от греха.,пытался,пыталась,Syntax,Subject-Predicate Agreement,subj_predicate_agreement_gender_attractor,subj_predicate_agreement_gender_attractor,librusec,5
155241,Страстная вера Ольды в направление родов была для меня весьма необычна.,Страстная вера Ольды в направление родов был для меня весьма необычна.,была,был,Syntax,Subject-Predicate Agreement,subj_predicate_agreement_gender_attractor,subj_predicate_agreement_gender_attractor,librusec,4
159422,"Он утром и вспомнить-то ничего конкретно не мог, а ему предъяву.","Он утром и вспомнить-то ничего конкретно не могло, а ему предъяву.",мог,могло,Syntax,Subject-Predicate Agreement,subj_predicate_agreement_gender_attractor,subj_predicate_agreement_gender_attractor,librusec,4
223049,Что самое неожиданное — Чармен Демисович необычайно этому событию обрадовался.,Что самое неожиданное — Чармен Демисович необычайно этому событию обрадовалось.,обрадовался,обрадовалось,Syntax,Subject-Predicate Agreement,subj_predicate_agreement_gender_attractor,subj_predicate_agreement_gender_attractor,librusec,4
160797,Но Герфегест не слушал – ибо неподвижное прежде отражение воина зашевелилось.,Но Герфегест не слушал – ибо неподвижное прежде отражение воина зашевелился.,зашевелилось,зашевелился,Syntax,Subject-Predicate Agreement,subj_predicate_agreement_gender_attractor,subj_predicate_agreement_gender_attractor,librusec,4
161340,"Только когда близкий гром ударил снова, посол все понял и перекрестился.","Только когда близкий гром ударил снова, посол все поняло и перекрестился.",понял,поняло,Syntax,Subject-Predicate Agreement,subj_predicate_agreement_gender_attractor,subj_predicate_agreement_gender_attractor,librusec,4
192363,Изданный Траки Несом возглас изумления совпал с появлением в кабинете Нахаки.,Изданный Траки Несом возглас изумления совпало с появлением в кабинете Нахаки.,совпал,совпало,Syntax,Subject-Predicate Agreement,subj_predicate_agreement_gender_attractor,subj_predicate_agreement_gender_attractor,librusec,6
168596,Потом она Мартина таки разглядела и ну с ним беседовать.,Потом она Мартина таки разглядел и ну с ним беседовать.,разглядела,разглядел,Syntax,Subject-Predicate Agreement,subj_predicate_agreement_gender_attractor,subj_predicate_agreement_gender_attractor,librusec,4
179931,Особенно зимой разозлило Розу желание Романа Степнова двинуть в политику.,Особенно зимой разозлила Розу желание Романа Степнова двинуть в политику.,разозлило,разозлила,Syntax,Subject-Predicate Agreement,subj_predicate_agreement_gender_attractor,subj_predicate_agreement_gender_attractor,librusec,5
179217,"Мать Беатрис Мари Иисуса, испанская современница Катрин Текаквиты, подолгу постилась.","Мать Беатрис Мари Иисуса, испанская современница Катрин Текаквиты, подолгу постился.",постилась,постился,Syntax,Subject-Predicate Agreement,subj_predicate_agreement_gender_attractor,subj_predicate_agreement_gender_attractor,librusec,5
184235,У тебя фикфция фофая! – сделал ему замечание Цыкающий Зуб.,У тебя фикфция фофая! – сделало ему замечание Цыкающий Зуб.,сделал,сделало,Syntax,Subject-Predicate Agreement,subj_predicate_agreement_gender_attractor,subj_predicate_agreement_gender_attractor,librusec,4
181209,Только сила мага Кэлорина Олфорвана позволяла держать корабль под контролем.,Только сила мага Кэлорина Олфорвана позволял держать корабль под контролем.,позволяла,позволял,Syntax,Subject-Predicate Agreement,subj_predicate_agreement_gender_attractor,subj_predicate_agreement_gender_attractor,librusec,6
218957,"Может, сравнение с цууцем было явно в нашу пользу.","Может, сравнение с цууцем был явно в нашу пользу.",было,был,Syntax,Subject-Predicate Agreement,subj_predicate_agreement_gender_attractor,subj_predicate_agreement_gender_attractor,librusec,4
152582,"Это наверняка была работа шаров-переводчиков, поскольку облако Иммы тоже исчезло.","Это наверняка была работа шаров-переводчиков, поскольку облако Иммы тоже исчез.",исчезло,исчез,Syntax,Subject-Predicate Agreement,subj_predicate_agreement_gender_attractor,subj_predicate_agreement_gender_attractor,librusec,3
210032,"Раз, два, и полный подол рубахи яблок молодильных набрал.","Раз, два, и полный подол рубахи яблок молодильных набрала.",набрал,набрала,Syntax,Subject-Predicate Agreement,subj_predicate_agreement_gender_attractor,subj_predicate_agreement_gender_attractor,librusec,6
210144,"Муж Лены тогда осел дома, и мой сделает то же самое.","Муж Лены тогда осела дома, и мой сделает то же самое.",осел,осела,Syntax,Subject-Predicate Agreement,subj_predicate_agreement_gender_attractor,subj_predicate_agreement_gender_attractor,librusec,4
207821,"Плавник лег вправо, а сам господин Имирова моря прошел мимо дракена.","Плавник лег вправо, а сам господин Имирова моря прошло мимо дракена.",прошел,прошло,Syntax,Subject-Predicate Agreement,subj_predicate_agreement_gender_attractor,subj_predicate_agreement_gender_attractor,librusec,5
172509,"В горле у нее застрял, казалось, целый Магфорд.","В горле у нее застряло, казалось, целый Магфорд.",застрял,застряло,Syntax,Subject-Predicate Agreement,subj_predicate_agreement_gender_attractor,subj_predicate_agreement_gender_attractor,librusec,5
182771,"Он понимал, что этот человек тогда в машине проиграл случайно.","Он понимал, что этот человек тогда в машине проиграла случайно.",проиграл,проиграла,Syntax,Subject-Predicate Agreement,subj_predicate_agreement_gender_attractor,subj_predicate_agreement_gender_attractor,librusec,4
214180,"Мужчина уж так от природы создан, что ему одной бывает мало.","Мужчина уж так от природы создана, что ему одной бывает мало.",создан,создана,Syntax,Subject-Predicate Agreement,subj_predicate_agreement_gender_attractor,subj_predicate_agreement_gender_attractor,librusec,5
219964,Поразил силой самый легкий из чемпионов в тяжелом весе – Норб Шемански.,Поразила силой самый легкий из чемпионов в тяжелом весе – Норб Шемански.,Поразил,Поразила,Syntax,Subject-Predicate Agreement,subj_predicate_agreement_gender_attractor,subj_predicate_agreement_gender_attractor,librusec,5
165662,А Бергвид из одного упрямства не хотел отдать меня ей!,А Бергвид из одного упрямства не хотело отдать меня ей!,хотел,хотело,Syntax,Subject-Predicate Agreement,subj_predicate_agreement_gender_attractor,subj_predicate_agreement_gender_attractor,librusec,3
163201,"Народ, хоть с похмелья, сразу побежал на горушку.","Народ, хоть с похмелья, сразу побежало на горушку.",побежал,побежало,Syntax,Subject-Predicate Agreement,subj_predicate_agreement_gender_attractor,subj_predicate_agreement_gender_attractor,librusec,4
206640,"Оно, показалось игрецу, будто льдом, было сковано ненавистью.","Оно, показалось игрецу, будто льдом, был сковано ненавистью.",было,был,Syntax,Subject-Predicate Agreement,subj_predicate_agreement_gender_attractor,subj_predicate_agreement_gender_attractor,librusec,4
157216,Герфегест от груди и до пят был залит кровью Гло-рамта.,Герфегест от груди и до пят была залит кровью Гло-рамта.,был,была,Syntax,Subject-Predicate Agreement,subj_predicate_agreement_gender_attractor,subj_predicate_agreement_gender_attractor,librusec,4
191865,"Думали, баба Катя совсем из ума выжила, не найдеть?","Думали, баба Катя совсем из ума выжил, не найдеть?",выжила,выжил,Syntax,Subject-Predicate Agreement,subj_predicate_agreement_gender_attractor,subj_predicate_agreement_gender_attractor,librusec,5
162796,"Верещание доведется услышать точно такое, какое моему крупу на поляне досталось.","Верещание доведется услышать точно такое, какое моему крупу на поляне достался.",досталось,достался,Syntax,Subject-Predicate Agreement,subj_predicate_agreement_gender_attractor,subj_predicate_agreement_gender_attractor,librusec,6
206709,"Гибель Ортрана опечалила всех, но Эрда она просто ошеломила.","Гибель Ортрана опечалил всех, но Эрда она просто ошеломила.",опечалила,опечалил,Syntax,Subject-Predicate Agreement,subj_predicate_agreement_gender_attractor,subj_predicate_agreement_gender_attractor,librusec,3
218963,Только ли помощника с рабом ждал в ущелье этот дух?,Только ли помощника с рабом ждало в ущелье этот дух?,ждал,ждало,Syntax,Subject-Predicate Agreement,subj_predicate_agreement_gender_attractor,subj_predicate_agreement_gender_attractor,librusec,6
193879,"Мофэст ничего не ответила, и Эйджер начал чувствовать себя неуютно.","Мофэст ничего не ответило, и Эйджер начал чувствовать себя неуютно.",ответила,ответило,Syntax,Subject-Predicate Agreement,subj_predicate_agreement_gender_attractor,subj_predicate_agreement_gender_attractor,librusec,3
201955,"Увы, красная почва миомбо оказалась для девочки истинной трясиной.","Увы, красная почва миомбо оказалось для девочки истинной трясиной.",оказалась,оказалось,Syntax,Subject-Predicate Agreement,subj_predicate_agreement_gender_attractor,subj_predicate_agreement_gender_attractor,librusec,5
211524,"И представляете, Варяг с края овсяного поля поднял крупную тетерку!","И представляете, Варяг с края овсяного поля подняло крупную тетерку!",поднял,подняло,Syntax,Subject-Predicate Agreement,subj_predicate_agreement_gender_attractor,subj_predicate_agreement_gender_attractor,librusec,5
204320,Так что смирение перед невозможностью не являлось частью кредо Райанов.,Так что смирение перед невозможностью не являлась частью кредо Райанов.,являлось,являлась,Syntax,Subject-Predicate Agreement,subj_predicate_agreement_gender_attractor,subj_predicate_agreement_gender_attractor,librusec,6
187246,Раз у одной девицы в Туманности мокриц лежал на дне пять недель.,Раз у одной девицы в Туманности мокриц лежала на дне пять недель.,лежал,лежала,Syntax,Subject-Predicate Agreement,subj_predicate_agreement_gender_attractor,subj_predicate_agreement_gender_attractor,librusec,6
165273,"И эта бездомная Шынар, жена голодранца, надела такие же.","И эта бездомная Шынар, жена голодранца, надел такие же.",надела,надел,Syntax,Subject-Predicate Agreement,subj_predicate_agreement_gender_attractor,subj_predicate_agreement_gender_attractor,librusec,4
139939,Личного тренера Валерия Попенченко Григория Кусикьянца руководство в Токио не командировало.,Личного тренера Валерия Попенченко Григория Кусикьянца руководство в Токио не командировал.,командировало,командировал,Syntax,Subject-Predicate Agreement,subj_predicate_agreement_gender_attractor,subj_predicate_agreement_gender_attractor,wikinews,5
126355,Ну и сотрудничество клуба с Рангником широко обсуждалось в Германии.,Ну и сотрудничество клуба с Рангником широко обсуждался в Германии.,обсуждалось,обсуждался,Syntax,Subject-Predicate Agreement,subj_predicate_agreement_gender_attractor,subj_predicate_agreement_gender_attractor,wikinews,4
140905,В среду первая жена Карра Квинтана Рей дала интервью на радио.,В среду первая жена Карра Квинтана Рей дал интервью на радио.,дала,дал,Syntax,Subject-Predicate Agreement,subj_predicate_agreement_gender_attractor,subj_predicate_agreement_gender_attractor,wikinews,5
121186,Вторым пытался извлечь телефон из выгребной ямы его приятель Кевина Вамбуа.,Вторым пыталась извлечь телефон из выгребной ямы его приятель Кевина Вамбуа.,пытался,пыталась,Syntax,Subject-Predicate Agreement,subj_predicate_agreement_gender_attractor,subj_predicate_agreement_gender_attractor,wikinews,5
128313,"Но, видно, броскость лозунга очень уж понравилась членам общинам.","Но, видно, броскость лозунга очень уж понравился членам общинам.",понравилась,понравился,Syntax,Subject-Predicate Agreement,subj_predicate_agreement_gender_attractor,subj_predicate_agreement_gender_attractor,wikinews,5
87591,И футбол в жизни Арица появился только после попадания в Антигуоко.,И футбол в жизни Арица появилась только после попадания в Антигуоко.,появился,появилась,Syntax,Subject-Predicate Agreement,subj_predicate_agreement_gender_attractor,subj_predicate_agreement_gender_attractor,wikinews,4
86493,Приветствовал решение Медведева и глава президентского Совета поправам человека Михаил Федотов.,Приветствовало решение Медведева и глава президентского Совета поправам человека Михаил Федотов.,Приветствовал,Приветствовало,Syntax,Subject-Predicate Agreement,subj_predicate_agreement_gender_attractor,subj_predicate_agreement_gender_attractor,wikinews,6
145481,Около пяти вечера заехал к одной из фей ее несистемный клиент.,Около пяти вечера заехала к одной из фей ее несистемный клиент.,заехал,заехала,Syntax,Subject-Predicate Agreement,subj_predicate_agreement_gender_attractor,subj_predicate_agreement_gender_attractor,wikinews,5
105810,"Поэтому даже план правительства, изложенный Снэ, вызвал протесты.","Поэтому даже план правительства, изложенный Снэ, вызвало протесты.",вызвал,вызвало,Syntax,Subject-Predicate Agreement,subj_predicate_agreement_gender_attractor,subj_predicate_agreement_gender_attractor,wikinews,3
