id,source_sentence,target_sentence,source_word,target_word,level,phenomenon,PID,subtype,domain,tree_depth
63458,В нее вошли Старший инспектор Роза Казаку считался одним из лучших сотрудников ПИДЕ.,В нее вошли Старший инспектор Роза Казаку считалась одним из лучших сотрудников ПИДЕ.,считался,считалась,Syntax,Subject-Predicate Agreement,subj_predicate_agreement_gender_attractor,subj_predicate_agreement_gender_attractor,wikipedia,7
41002,"Член семьи Колесар - Федор, обозначил такой подарок тем, что именно так город начнет напоминать ""золотой Киев"".","Член семьи Колесар - Федор, обозначила такой подарок тем, что именно так город начнет напоминать ""золотой Киев"".",обозначил,обозначила,Syntax,Subject-Predicate Agreement,subj_predicate_agreement_gender_attractor,subj_predicate_agreement_gender_attractor,wikipedia,10
1635,"Водре ожидал его во главе солдат, которым он только что раздал деньги.","Водре ожидала его во главе солдат, которым он только что раздал деньги.",ожидал,ожидала,Syntax,Subject-Predicate Agreement,subj_predicate_agreement_gender_attractor,subj_predicate_agreement_gender_attractor,wikipedia,5
57083,"Хорег, предоставивший средства для лучшего представления года, получал приз от городских властей.","Хорег, предоставивший средства для лучшего представления года, получало приз от городских властей.",получал,получало,Syntax,Subject-Predicate Agreement,subj_predicate_agreement_gender_attractor,subj_predicate_agreement_gender_attractor,wikipedia,6
33520,Модель существования формата была абсолютно аналогична американской — от самих роликов до структуры продаж всего магазина.,Модель существования формата был абсолютно аналогична американской — от самих роликов до структуры продаж всего магазина.,была,был,Syntax,Subject-Predicate Agreement,subj_predicate_agreement_gender_attractor,subj_predicate_agreement_gender_attractor,wikipedia,8
41821,"Хотя адвокат Мистер Донован Ночной Тени упомянул, что принял меры, чтобы Хемистро был выпущен с Острова Райкера.","Хотя адвокат Мистер Донован Ночной Тени упомянула, что принял меры, чтобы Хемистро был выпущен с Острова Райкера.",упомянул,упомянула,Syntax,Subject-Predicate Agreement,subj_predicate_agreement_gender_attractor,subj_predicate_agreement_gender_attractor,wikipedia,7
58532,"Огненной бурей прокатилась по Кругу Земель Война Третьего Вздоха Хуммера, в которой участвовали Октанг Урайн, Элиен Ласарский и Шет окс Лагин.","Огненной бурей прокатился по Кругу Земель Война Третьего Вздоха Хуммера, в которой участвовали Октанг Урайн, Элиен Ласарский и Шет окс Лагин.",прокатилась,прокатился,Syntax,Subject-Predicate Agreement,subj_predicate_agreement_gender_attractor,subj_predicate_agreement_gender_attractor,wikipedia,11
11526,"После войны-продолжения население Уусикиркко было размещено в следующих волостях региона Сало: Ангелниеми, Халикко, Каруна, Коски, Марттила, Пернио, Сауво и Сомеро.","После войны-продолжения население Уусикиркко был размещено в следующих волостях региона Сало: Ангелниеми, Халикко, Каруна, Коски, Марттила, Пернио, Сауво и Сомеро.",было,был,Syntax,Subject-Predicate Agreement,subj_predicate_agreement_gender_attractor,subj_predicate_agreement_gender_attractor,wikipedia,13
5113,"Степные комплексы Сайгын Давным давно гора Сайгын называлась Бургутей, что (в пер. с монгольского Эзир- тей – скала Орел).","Степные комплексы Сайгын Давным давно гора Сайгын назывался Бургутей, что (в пер. с монгольского Эзир- тей – скала Орел).",называлась,назывался,Syntax,Subject-Predicate Agreement,subj_predicate_agreement_gender_attractor,subj_predicate_agreement_gender_attractor,wikipedia,10
43696,"Первая часть пути проходила из Триклина Экскувитов через зал Лихны, названный так из-за висевших там ламп, и Трибунал.","Первая часть пути проходил из Триклина Экскувитов через зал Лихны, названный так из-за висевших там ламп, и Трибунал.",проходила,проходил,Syntax,Subject-Predicate Agreement,subj_predicate_agreement_gender_attractor,subj_predicate_agreement_gender_attractor,wikipedia,8
48451,"Радиус оживала составлял 9 калибров или, скорость вращения у дульного среза составляла.","Радиус оживала составлял 9 калибров или, скорость вращения у дульного среза составлял.",составляла,составлял,Syntax,Subject-Predicate Agreement,subj_predicate_agreement_gender_attractor,subj_predicate_agreement_gender_attractor,wikipedia,6
73959,"После второго прохождения Мюр де Юи, вершину которой второй раз первым проехал Пребен ван Хекке, преимущество группы отрыва сократилось до 1 минуты.","После второго прохождения Мюр де Юи, вершину которой второй раз первым проехал Пребен ван Хекке, преимущество группы отрыва сократился до 1 минуты.",сократилось,сократился,Syntax,Subject-Predicate Agreement,subj_predicate_agreement_gender_attractor,subj_predicate_agreement_gender_attractor,wikipedia,12
33339,"Другой член группы набидов, Поль Серюзье также пытался отыскать ""комплекс правил"", вносящих порядок в божественную природу творчества.","Другой член группы набидов, Поль Серюзье также пыталась отыскать ""комплекс правил"", вносящих порядок в божественную природу творчества.",пытался,пыталась,Syntax,Subject-Predicate Agreement,subj_predicate_agreement_gender_attractor,subj_predicate_agreement_gender_attractor,wikipedia,9
71344,"Мадампу долгое время был секретарем Юва Кала Сахити, культурного крыла коммунистической партии Индии.","Мадампу долгое время было секретарем Юва Кала Сахити, культурного крыла коммунистической партии Индии.",был,было,Syntax,Subject-Predicate Agreement,subj_predicate_agreement_gender_attractor,subj_predicate_agreement_gender_attractor,wikipedia,5
10258,"Тетя Ласаирфхионы, Бинмхидхе, дочь Тойрделбаха Уа Конхобайра, была женой шотландского лорда Маола Мхуира Ан Спараина, сына Суйбне Мак Дуинншлейбхе, чье родство станет очень важным для карьеры Домналла Ога.","Тетя Ласаирфхионы, Бинмхидхе, дочь Тойрделбаха Уа Конхобайра, был женой шотландского лорда Маола Мхуира Ан Спараина, сына Суйбне Мак Дуинншлейбхе, чье родство станет очень важным для карьеры Домналла Ога.",была,был,Syntax,Subject-Predicate Agreement,subj_predicate_agreement_gender_attractor,subj_predicate_agreement_gender_attractor,wikipedia,14
30125,Поэтому оставшийся лидер гэльской защиты Сорли Бой Макдонелл был вынужден остаться на материке.,Поэтому оставшийся лидер гэльской защиты Сорли Бой Макдонелл была вынужден остаться на материке.,был,была,Syntax,Subject-Predicate Agreement,subj_predicate_agreement_gender_attractor,subj_predicate_agreement_gender_attractor,wikipedia,6
47268,Вондел также написал текст в архитраве входа в театр: Этот вход от первоначального здания все еще сохранился.,Вондел также написал текст в архитраве входа в театр: Этот вход от первоначального здания все еще сохранилось.,сохранился,сохранилось,Syntax,Subject-Predicate Agreement,subj_predicate_agreement_gender_attractor,subj_predicate_agreement_gender_attractor,wikipedia,8
170435,Племянница Гарста приподнялась и села.,Племянница Гарста приподнялся и села.,приподнялась,приподнялся,Syntax,Subject-Predicate Agreement,subj_predicate_agreement_gender_attractor,subj_predicate_agreement_gender_attractor,librusec,3
183282,А Забубенный историю читать любил.,А Забубенный историю читать любила.,любил,любила,Syntax,Subject-Predicate Agreement,subj_predicate_agreement_gender_attractor,subj_predicate_agreement_gender_attractor,librusec,2
206539,Резюме: страта один активирована полностью.,Резюме: страта один активирован полностью.,активирована,активирован,Syntax,Subject-Predicate Agreement,subj_predicate_agreement_gender_attractor,subj_predicate_agreement_gender_attractor,librusec,3
180567,Путь к ней оказался околист.,Путь к ней оказалась околист.,оказался,оказалась,Syntax,Subject-Predicate Agreement,subj_predicate_agreement_gender_attractor,subj_predicate_agreement_gender_attractor,librusec,3
201845,Эфор некоторое время разглядывал его.,Эфор некоторое время разглядывало его.,разглядывал,разглядывало,Syntax,Subject-Predicate Agreement,subj_predicate_agreement_gender_attractor,subj_predicate_agreement_gender_attractor,librusec,2
197675,Сорен много о чем спрашивал отца.,Сорен много о чем спрашивало отца.,спрашивал,спрашивало,Syntax,Subject-Predicate Agreement,subj_predicate_agreement_gender_attractor,subj_predicate_agreement_gender_attractor,librusec,2
167429,Бог Юргеновой бабушки поднял седые брови.,Бог Юргеновой бабушки подняла седые брови.,поднял,подняла,Syntax,Subject-Predicate Agreement,subj_predicate_agreement_gender_attractor,subj_predicate_agreement_gender_attractor,librusec,4
218775,Это еще днем было решено.,Это еще днем был решено.,было,был,Syntax,Subject-Predicate Agreement,subj_predicate_agreement_gender_attractor,subj_predicate_agreement_gender_attractor,librusec,2
182175,Взгляд у Зализиной стал пустым.,Взгляд у Зализиной стала пустым.,стал,стала,Syntax,Subject-Predicate Agreement,subj_predicate_agreement_gender_attractor,subj_predicate_agreement_gender_attractor,librusec,3
210291,Папаня мне вечером такое устроил!,Папаня мне вечером такое устроило!,устроил,устроило,Syntax,Subject-Predicate Agreement,subj_predicate_agreement_gender_attractor,subj_predicate_agreement_gender_attractor,librusec,1
163747,Часть утра тоже прошла в дороге.,Часть утра тоже прошло в дороге.,прошла,прошло,Syntax,Subject-Predicate Agreement,subj_predicate_agreement_gender_attractor,subj_predicate_agreement_gender_attractor,librusec,3
199277,Его один гад крылом задел.,Его один гад крылом задело.,задел,задело,Syntax,Subject-Predicate Agreement,subj_predicate_agreement_gender_attractor,subj_predicate_agreement_gender_attractor,librusec,2
215714,Дело всех последних лет жизни рушилось.,Дело всех последних лет жизни рушилась.,рушилось,рушилась,Syntax,Subject-Predicate Agreement,subj_predicate_agreement_gender_attractor,subj_predicate_agreement_gender_attractor,librusec,3
219679,Товарищ полковник мистической литературы захотел.,Товарищ полковник мистической литературы захотела.,захотел,захотела,Syntax,Subject-Predicate Agreement,subj_predicate_agreement_gender_attractor,subj_predicate_agreement_gender_attractor,librusec,4
199863,Наш брат в цене ходил.,Наш брат в цене ходила.,ходил,ходила,Syntax,Subject-Predicate Agreement,subj_predicate_agreement_gender_attractor,subj_predicate_agreement_gender_attractor,librusec,3
208128,Радио по вечерам компанию не составляло.,Радио по вечерам компанию не составляла.,составляло,составляла,Syntax,Subject-Predicate Agreement,subj_predicate_agreement_gender_attractor,subj_predicate_agreement_gender_attractor,librusec,2
152381,Удивление Бодейкера было достаточным ответом.,Удивление Бодейкера был достаточным ответом.,было,был,Syntax,Subject-Predicate Agreement,subj_predicate_agreement_gender_attractor,subj_predicate_agreement_gender_attractor,librusec,2
190912,Варя на остановках свидание не назначала.,Варя на остановках свидание не назначало.,назначала,назначало,Syntax,Subject-Predicate Agreement,subj_predicate_agreement_gender_attractor,subj_predicate_agreement_gender_attractor,librusec,2
185332,Основное тело Роя было почти здесь.,Основное тело Роя был почти здесь.,было,был,Syntax,Subject-Predicate Agreement,subj_predicate_agreement_gender_attractor,subj_predicate_agreement_gender_attractor,librusec,2
186567,Сердце Санти билось ровно и редко.,Сердце Санти бился ровно и редко.,билось,бился,Syntax,Subject-Predicate Agreement,subj_predicate_agreement_gender_attractor,subj_predicate_agreement_gender_attractor,librusec,4
190350,Знал это и сам Огнеяр.,Знало это и сам Огнеяр.,Знал,Знало,Syntax,Subject-Predicate Agreement,subj_predicate_agreement_gender_attractor,subj_predicate_agreement_gender_attractor,librusec,3
161901,Сунь Вторая ей место уступила.,Сунь Вторая ей место уступило.,уступила,уступило,Syntax,Subject-Predicate Agreement,subj_predicate_agreement_gender_attractor,subj_predicate_agreement_gender_attractor,librusec,2
196048,Повышение Хэнниш отражено в приказе.,Повышение Хэнниш отражена в приказе.,отражено,отражена,Syntax,Subject-Predicate Agreement,subj_predicate_agreement_gender_attractor,subj_predicate_agreement_gender_attractor,librusec,3
168841,И сделал это братец этой бешеной.,И сделало это братец этой бешеной.,сделал,сделало,Syntax,Subject-Predicate Agreement,subj_predicate_agreement_gender_attractor,subj_predicate_agreement_gender_attractor,librusec,2
189518,"Да, начало вечера явно удалось.","Да, начало вечера явно удался.",удалось,удался,Syntax,Subject-Predicate Agreement,subj_predicate_agreement_gender_attractor,subj_predicate_agreement_gender_attractor,librusec,3
205081,Марк даже этого не делал.,Марк даже этого не делало.,делал,делало,Syntax,Subject-Predicate Agreement,subj_predicate_agreement_gender_attractor,subj_predicate_agreement_gender_attractor,librusec,1
180876,Утро вторницы наставало для Бага постепенно.,Утро вторницы наставала для Бага постепенно.,наставало,наставала,Syntax,Subject-Predicate Agreement,subj_predicate_agreement_gender_attractor,subj_predicate_agreement_gender_attractor,librusec,3
219054,Лицо Аривы отчасти утратило печаль.,Лицо Аривы отчасти утратил печаль.,утратило,утратил,Syntax,Subject-Predicate Agreement,subj_predicate_agreement_gender_attractor,subj_predicate_agreement_gender_attractor,librusec,2
193670,Что вам пес плохого сделал?,Что вам пес плохого сделало?,сделал,сделало,Syntax,Subject-Predicate Agreement,subj_predicate_agreement_gender_attractor,subj_predicate_agreement_gender_attractor,librusec,2
164353,Материализовавшаяся Алена мигом заменила прибор.,Материализовавшаяся Алена мигом заменил прибор.,заменила,заменил,Syntax,Subject-Predicate Agreement,subj_predicate_agreement_gender_attractor,subj_predicate_agreement_gender_attractor,librusec,2
171416,Вой в ушах Мин стал громче.,Вой в ушах Мин стало громче.,стал,стало,Syntax,Subject-Predicate Agreement,subj_predicate_agreement_gender_attractor,subj_predicate_agreement_gender_attractor,librusec,3
220733,Он оружия так и не вынул.,Он оружия так и не вынуло.,вынул,вынуло,Syntax,Subject-Predicate Agreement,subj_predicate_agreement_gender_attractor,subj_predicate_agreement_gender_attractor,librusec,2
222459,Состояние судетца было немногим лучше.,Состояние судетца был немногим лучше.,было,был,Syntax,Subject-Predicate Agreement,subj_predicate_agreement_gender_attractor,subj_predicate_agreement_gender_attractor,librusec,2
151434,Так сказал ей принц Эмторо.,Так сказала ей принц Эмторо.,сказал,сказала,Syntax,Subject-Predicate Agreement,subj_predicate_agreement_gender_attractor,subj_predicate_agreement_gender_attractor,librusec,2
165552,Главарь группы бросал взгляд на часы.,Главарь группы бросала взгляд на часы.,бросал,бросала,Syntax,Subject-Predicate Agreement,subj_predicate_agreement_gender_attractor,subj_predicate_agreement_gender_attractor,librusec,4
151889,И Киря тоже это сознавал.,И Киря тоже это сознавало.,сознавал,сознавало,Syntax,Subject-Predicate Agreement,subj_predicate_agreement_gender_attractor,subj_predicate_agreement_gender_attractor,librusec,1
192293,А кендар тем временем окончил поиски.,А кендар тем временем окончило поиски.,окончил,окончило,Syntax,Subject-Predicate Agreement,subj_predicate_agreement_gender_attractor,subj_predicate_agreement_gender_attractor,librusec,2
218878,тое брюшко Пашерова выглядело невоинственно.,тое брюшко Пашерова выглядел невоинственно.,выглядело,выглядел,Syntax,Subject-Predicate Agreement,subj_predicate_agreement_gender_attractor,subj_predicate_agreement_gender_attractor,librusec,2
208280,Алетея одно время была ужасно толстой.,Алетея одно время было ужасно толстой.,была,было,Syntax,Subject-Predicate Agreement,subj_predicate_agreement_gender_attractor,subj_predicate_agreement_gender_attractor,librusec,2
194139,Улочка перед домом Стежня вмиг заполнилась.,Улочка перед домом Стежня вмиг заполнился.,заполнилась,заполнился,Syntax,Subject-Predicate Agreement,subj_predicate_agreement_gender_attractor,subj_predicate_agreement_gender_attractor,librusec,3
213497,Морда Гоярына нависла над ней.,Морда Гоярына навис над ней.,нависла,навис,Syntax,Subject-Predicate Agreement,subj_predicate_agreement_gender_attractor,subj_predicate_agreement_gender_attractor,librusec,3
154868,Ург со значением взглянул на Таню.,Ург со значением взглянуло на Таню.,взглянул,взглянуло,Syntax,Subject-Predicate Agreement,subj_predicate_agreement_gender_attractor,subj_predicate_agreement_gender_attractor,librusec,3
169859,Рука Акико вновь сдержала мою руку.,Рука Акико вновь сдержал мою руку.,сдержала,сдержал,Syntax,Subject-Predicate Agreement,subj_predicate_agreement_gender_attractor,subj_predicate_agreement_gender_attractor,librusec,3
218286,Гринчук всего этого не знал.,Гринчук всего этого не знало.,знал,знало,Syntax,Subject-Predicate Agreement,subj_predicate_agreement_gender_attractor,subj_predicate_agreement_gender_attractor,librusec,2
202343,Однако мысль о Самандарове спасла меня.,Однако мысль о Самандарове спас меня.,спасла,спас,Syntax,Subject-Predicate Agreement,subj_predicate_agreement_gender_attractor,subj_predicate_agreement_gender_attractor,librusec,3
157794,Глебушка обо всем и сам знал.,Глебушка обо всем и сам знало.,знал,знало,Syntax,Subject-Predicate Agreement,subj_predicate_agreement_gender_attractor,subj_predicate_agreement_gender_attractor,librusec,3
212281,Да и медицина его не увлекала.,Да и медицина его не увлекал.,увлекала,увлекал,Syntax,Subject-Predicate Agreement,subj_predicate_agreement_gender_attractor,subj_predicate_agreement_gender_attractor,librusec,2
204862,Свеколт с беспокойством взглянула на Аббатикову.,Свеколт с беспокойством взглянуло на Аббатикову.,взглянула,взглянуло,Syntax,Subject-Predicate Agreement,subj_predicate_agreement_gender_attractor,subj_predicate_agreement_gender_attractor,librusec,3
195604,Улыбка По стала еще шире.,Улыбка По стал еще шире.,стала,стал,Syntax,Subject-Predicate Agreement,subj_predicate_agreement_gender_attractor,subj_predicate_agreement_gender_attractor,librusec,3
159448,Муж Глафире неплохой будто попался.,Муж Глафире неплохой будто попалась.,попался,попалась,Syntax,Subject-Predicate Agreement,subj_predicate_agreement_gender_attractor,subj_predicate_agreement_gender_attractor,librusec,2
158846,Лицо Козлова теперь выражало настоящее упоение.,Лицо Козлова теперь выражал настоящее упоение.,выражало,выражал,Syntax,Subject-Predicate Agreement,subj_predicate_agreement_gender_attractor,subj_predicate_agreement_gender_attractor,librusec,3
218735,Сердце Сендаруса замерло от страха.,Сердце Сендаруса замер от страха.,замерло,замер,Syntax,Subject-Predicate Agreement,subj_predicate_agreement_gender_attractor,subj_predicate_agreement_gender_attractor,librusec,3
