id,source_sentence,target_sentence,source_word,target_word,level,phenomenon,PID,subtype,domain,tree_depth
99921,На прошлой неделе этого не знал?,На будущей неделе этого не знал?,прошлой,будущей,Semantics,Tense,tense_marker,tense_marker_expression,librusec,2
93348,"В прошлом году, эва хватила!","В грядущем году, эва хватила!",прошлом,грядущем,Semantics,Tense,tense_marker,tense_marker_expression,librusec,2
101629,Пять было в прошлом году.,Пять было в будущем году.,прошлом,будущем,Semantics,Tense,tense_marker,tense_marker_expression,librusec,2
101322,В прошлый выход такого не было.,В грядущий выход такого не было.,прошлый,грядущий,Semantics,Tense,tense_marker,tense_marker_expression,librusec,2
94426,И священник в прошлом году умер.,И священник в грядущем году умер.,прошлом,грядущем,Semantics,Tense,tense_marker,tense_marker_expression,librusec,2
88262,На будущий год и эти бросим.,На минувший год и эти бросим.,будущий,минувший,Semantics,Tense,tense_marker,tense_marker_expression,librusec,3
99229,В прошлом году так сфотографировали даже.,В будущем году так сфотографировали даже.,прошлом,будущем,Semantics,Tense,tense_marker,tense_marker_expression,librusec,2
100039,А в прошлые революции было же?,А в будущие революции было же?,прошлые,будущие,Semantics,Tense,tense_marker,tense_marker_expression,librusec,2
96221,Гаррик унаследовал титул в прошлом году.,Гаррик унаследовал титул в грядущем году.,прошлом,грядущем,Semantics,Tense,tense_marker,tense_marker_expression,librusec,2
88677,В прошлом же году пригласили Вуджета.,В грядущем же году пригласили Вуджета.,прошлом,грядущем,Semantics,Tense,tense_marker,tense_marker_expression,librusec,3
88962,На прошлой неделе только были.,На будущей неделе только были.,прошлой,будущей,Semantics,Tense,tense_marker,tense_marker_expression,librusec,2
95895,Ты в прошлом году жил.,Ты в грядущем году жил.,прошлом,грядущем,Semantics,Tense,tense_marker,tense_marker_expression,librusec,2
99650,Они в прошлом годе туточки проходили.,Они в будущем годе туточки проходили.,прошлом,будущем,Semantics,Tense,tense_marker,tense_marker_expression,librusec,2
110356,Я занимался дома в прошлом году.,Я занимался дома в грядущем году.,прошлом,грядущем,Semantics,Tense,tense_marker,tense_marker_expression,librusec,2
98513,На прошлой неделе Лебедков привез одного.,На будущей неделе Лебедков привез одного.,прошлой,будущей,Semantics,Tense,tense_marker,tense_marker_expression,librusec,2
112496,В прошлом году сервы напали.,В грядущем году сервы напали.,прошлом,грядущем,Semantics,Tense,tense_marker,tense_marker_expression,librusec,2
99290,В прошлый раз вы туда написали!,В будущий раз вы туда написали!,прошлый,будущий,Semantics,Tense,tense_marker,tense_marker_expression,librusec,2
105350,Вот в прошлый мясоед отняла.,Вот в наступающий мясоед отняла.,прошлый,наступающий,Semantics,Tense,tense_marker,tense_marker_expression,librusec,2
91591,В прошлом году получил наследство.,В будущем году получил наследство.,прошлом,будущем,Semantics,Tense,tense_marker,tense_marker_expression,librusec,2
92119,Вот и написал в прошлой жизни.,Вот и написал в будущей жизни.,прошлой,будущей,Semantics,Tense,tense_marker,tense_marker_expression,librusec,2
93665,Окрестный люд в прошлом году поверил.,Окрестный люд в будущем году поверил.,прошлом,будущем,Semantics,Tense,tense_marker,tense_marker_expression,librusec,3
106301,В прошлом месяце и виделись.,В будущем месяце и виделись.,прошлом,будущем,Semantics,Tense,tense_marker,tense_marker_expression,librusec,2
90647,В прошлую среду приступ был.,В будущую среду приступ был.,прошлую,будущую,Semantics,Tense,tense_marker,tense_marker_expression,librusec,2
88329,Газ только в прошлом году провели.,Газ только в грядущем году провели.,прошлом,грядущем,Semantics,Tense,tense_marker,tense_marker_expression,librusec,2
111647,Это Ваха в прошлый приезд сообщил.,Это Ваха в будущий приезд сообщил.,прошлый,будущий,Semantics,Tense,tense_marker,tense_marker_expression,librusec,2
104584,В прошлом году праздник земляне пропустили.,В будущем году праздник земляне пропустили.,прошлом,будущем,Semantics,Tense,tense_marker,tense_marker_expression,librusec,2
91377,На прошлой неделе соскочил под залог.,На будущей неделе соскочил под залог.,прошлой,будущей,Semantics,Tense,tense_marker,tense_marker_expression,librusec,3
93557,В прошлом году тост произносила Панталоша.,В грядущем году тост произносила Панталоша.,прошлом,грядущем,Semantics,Tense,tense_marker,tense_marker_expression,librusec,2
111678,В прошлом месяце еще выписана.,В будущем месяце еще выписана.,прошлом,будущем,Semantics,Tense,tense_marker,tense_marker_expression,librusec,2
113315,На прошлой неделе один вазу выиграл.,На будущей неделе один вазу выиграл.,прошлой,будущей,Semantics,Tense,tense_marker,tense_marker_expression,librusec,3
88841,Мне в прошлый раз даос гадал.,Мне в будущий раз даос гадал.,прошлый,будущий,Semantics,Tense,tense_marker,tense_marker_expression,librusec,2
94216,Ранчера Вайдемоса приговорили на прошлой неделе.,Ранчера Вайдемоса приговорили на будущей неделе.,прошлой,будущей,Semantics,Tense,tense_marker,tense_marker_expression,librusec,3
95845,Наш кансама на прошлой неделе женился.,Наш кансама на будущей неделе женился.,прошлой,будущей,Semantics,Tense,tense_marker,tense_marker_expression,librusec,3
112897,Еще в прошлом годе потерял!,Еще в будущем годе потерял!,прошлом,будущем,Semantics,Tense,tense_marker,tense_marker_expression,librusec,2
93479,Поступила в прошлом году на исторический.,Поступила в будущем году на исторический.,прошлом,будущем,Semantics,Tense,tense_marker,tense_marker_expression,librusec,3
108750,В прошлом году многим пришлось вернуться.,В будущем году многим пришлось вернуться.,прошлом,будущем,Semantics,Tense,tense_marker,tense_marker_expression,librusec,2
98553,Мугни исчез в прошлом году.,Мугни исчез в будущем году.,прошлом,будущем,Semantics,Tense,tense_marker,tense_marker_expression,librusec,2
91967,Море Лена увидела в прошлом году.,Море Лена увидела в грядущем году.,прошлом,грядущем,Semantics,Tense,tense_marker,tense_marker_expression,librusec,2
89468,"Был, умер в прошлом году.","Был, умер в будущем году.",прошлом,будущем,Semantics,Tense,tense_marker,tense_marker_expression,librusec,3
94491,Унаследовал титул брата в прошлом году.,Унаследовал титул брата в грядущем году.,прошлом,грядущем,Semantics,Tense,tense_marker,tense_marker_expression,librusec,3
179994,Вчера от царевича вернулся еле жив.,Завтра от царевича вернулся еле жив.,Вчера,завтра,Semantics,Tense,tense_marker,tense_marker_simple,librusec,3
184540,Дашка не заметила этого вчера.,Дашка не заметила этого завтра.,вчера,завтра,Semantics,Tense,tense_marker,tense_marker_simple,librusec,1
189035,А может сама вчера подняла его?,А может сама завтра подняла его?,вчера,завтра,Semantics,Tense,tense_marker,tense_marker_simple,librusec,1
141675,Попадет за это лишь завтра.,Попадет за это лишь вчера.,завтра,вчера,Semantics,Tense,tense_marker,tense_marker_simple,librusec,3
204203,"Вчера ворожила, сожгла его воротник.","Завтра ворожила, сожгла его воротник.",Вчера,завтра,Semantics,Tense,tense_marker,tense_marker_simple,librusec,3
190045,А он вчера Кирилла не кусал?,А он завтра Кирилла не кусал?,вчера,завтра,Semantics,Tense,tense_marker,tense_marker_simple,librusec,1
184041,Варек вчера согласился служить не-мертвым.,Варек завтра согласился служить не-мертвым.,вчера,завтра,Semantics,Tense,tense_marker,tense_marker_simple,librusec,2
149611,Мне вчера его Генчик подарил.,Мне завтра его Генчик подарил.,вчера,завтра,Semantics,Tense,tense_marker,tense_marker_simple,librusec,1
139505,"Значит, прав оказался вчера Виктор.","Значит, прав оказался завтра Виктор.",вчера,завтра,Semantics,Tense,tense_marker,tense_marker_simple,librusec,2
220322,Сшиб ветр его вчера со свистом.,Сшиб ветр его завтра со свистом.,вчера,завтра,Semantics,Tense,tense_marker,tense_marker_simple,librusec,2
183739,Он куплен в Кадинске вчера.,Он куплен в Кадинске завтра.,вчера,завтра,Semantics,Tense,tense_marker,tense_marker_simple,librusec,2
151126,Ты вчера это легко делала!,Ты завтра это легко делала!,вчера,завтра,Semantics,Tense,tense_marker,tense_marker_simple,librusec,1
197513,Нелли дома – явилась вчера вечером!,Нелли дома – явилась завтра вечером!,вчера,завтра,Semantics,Tense,tense_marker,tense_marker_simple,librusec,3
151658,Вчера привезли на семнадцать телег меньше.,Завтра привезли на семнадцать телег меньше.,Вчера,завтра,Semantics,Tense,tense_marker,tense_marker_simple,librusec,3
204912,Вчера Вьянчи принес жалобу дарнигару.,Завтра Вьянчи принес жалобу дарнигару.,Вчера,завтра,Semantics,Tense,tense_marker,tense_marker_simple,librusec,1
244400,Вчера только еще семерых таких принесла.,Завтра только еще семерых таких принесла.,Вчера,завтра,Semantics,Tense,tense_marker,tense_marker_simple,librusec,3
245373,Еще вчера сломался – в Пряхине.,Еще завтра сломался – в Пряхине.,вчера,завтра,Semantics,Tense,tense_marker,tense_marker_simple,librusec,3
195127,Иваныч вчера же и разрядил.,Иваныч завтра же и разрядил.,вчера,завтра,Semantics,Tense,tense_marker,tense_marker_simple,librusec,2
223114,Йошитоми еще вчера приметил Лэнга.,Йошитоми еще завтра приметил Лэнга.,вчера,завтра,Semantics,Tense,tense_marker,tense_marker_simple,librusec,2
217796,Вот здесь вчера - повилика вилась.,Вот здесь завтра - повилика вилась.,вчера,завтра,Semantics,Tense,tense_marker,tense_marker_simple,librusec,3
140447,"Так, форму тоже завтра получишь.","Так, форму тоже вчера получишь.",завтра,вчера,Semantics,Tense,tense_marker,tense_marker_simple,librusec,3
141780,Так вот: вчера миамы ушли.,Так вот: завтра миамы ушли.,вчера,завтра,Semantics,Tense,tense_marker,tense_marker_simple,librusec,3
166585,Завтра Хью придется проветрить зал.,Вчера Хью придется проветрить зал.,Завтра,вчера,Semantics,Tense,tense_marker,tense_marker_simple,librusec,2
166282,Я на завтра потрачу сегодня.,Я на вчера потрачу сегодня.,завтра,вчера,Semantics,Tense,tense_marker,tense_marker_simple,librusec,2
155410,Вчера взяли Ковбоя и Даффуса.,Завтра взяли Ковбоя и Даффуса.,Вчера,завтра,Semantics,Tense,tense_marker,tense_marker_simple,librusec,3
141476,Завтра вообще без колес останетесь.,Вчера вообще без колес останетесь.,Завтра,вчера,Semantics,Tense,tense_marker,tense_marker_simple,librusec,2
169984,Завтра непеременно домой проситься стану.,Вчера непеременно домой проситься стану.,Завтра,вчера,Semantics,Tense,tense_marker,tense_marker_simple,librusec,2
142893,Тебе вчера Фокин зеленые дал?,Тебе завтра Фокин зеленые дал?,вчера,завтра,Semantics,Tense,tense_marker,tense_marker_simple,librusec,1
228495,Я вчера разговаривал с Вайтуленисом.,Я завтра разговаривал с Вайтуленисом.,вчера,завтра,Semantics,Tense,tense_marker,tense_marker_simple,librusec,2
225073,Райд уже светился здесь позавчера.,Райд уже светился здесь послезавтра.,позавчера,послезавтра,Semantics,Tense,tense_marker,tense_marker_simple,librusec,1
208292,Потом вчера приехал Ге старший.,Потом завтра приехал Ге старший.,вчера,завтра,Semantics,Tense,tense_marker,tense_marker_simple,librusec,2
177403,Завтра же начнем и парабиоз.,Вчера же начнем и парабиоз.,Завтра,вчера,Semantics,Tense,tense_marker,tense_marker_simple,librusec,3
141950,А вечер выдался вчера редкостный.,А вечер выдался завтра редкостный.,вчера,завтра,Semantics,Tense,tense_marker,tense_marker_simple,librusec,2
243442,Позавчера Франька Бригадир банк взял.,Послезавтра Франька Бригадир банк взял.,Позавчера,послезавтра,Semantics,Tense,tense_marker,tense_marker_simple,librusec,2
136942,"Вчера считал, что Костя погиб.","Завтра считал, что Костя погиб.",Вчера,завтра,Semantics,Tense,tense_marker,tense_marker_simple,librusec,2
220917,Мадену я отвез домой вчера вечером.,Мадену я отвез домой завтра вечером.,вчера,завтра,Semantics,Tense,tense_marker,tense_marker_simple,librusec,2
160167,Я завтра же покажу письмо Кнышу.,Я вчера же покажу письмо Кнышу.,завтра,вчера,Semantics,Tense,tense_marker,tense_marker_simple,librusec,3
204774,Вчера Сумеко назвала меня... девочкой!,Завтра Сумеко назвала меня... девочкой!,Вчера,завтра,Semantics,Tense,tense_marker,tense_marker_simple,librusec,2
240907,Это еще вчера все поняли.,Это еще завтра все поняли.,вчера,завтра,Semantics,Tense,tense_marker,tense_marker_simple,librusec,2
183799,Вчера люди Карабариса все выведали.,Завтра люди Карабариса все выведали.,Вчера,завтра,Semantics,Tense,tense_marker,tense_marker_simple,librusec,2
16979,В прошлом году Ерыгин женился.,В будущем году Ерыгин женился.,прошлом,будущем,Semantics,Tense,tense_marker,tense_marker_expression,wikinews,2
43867,В минувшем туре Ананд отдыхал.,В завтрашнем туре Ананд отдыхал.,минувшем,завтрашнем,Semantics,Tense,tense_marker,tense_marker_expression,wikinews,2
83495,В прошлом году рейсы регулярно меняли.,В грядущем году рейсы регулярно меняли.,прошлом,грядущем,Semantics,Tense,tense_marker,tense_marker_expression,wikinews,2
62419,В прошлом году хотели привлечь.,В грядущем году хотели привлечь.,прошлом,грядущем,Semantics,Tense,tense_marker,tense_marker_expression,wikinews,2
32470,Его Бутман подал на прошлой неделе.,Его Бутман подал на будущей неделе.,прошлой,будущей,Semantics,Tense,tense_marker,tense_marker_expression,wikinews,2
68768,История Кудиновой началась в прошлом году.,История Кудиновой началась в будущем году.,прошлом,будущем,Semantics,Tense,tense_marker,tense_marker_expression,wikinews,3
35381,В прошлом сезоне мы лимит донастроили.,В будущем сезоне мы лимит донастроили.,прошлом,будущем,Semantics,Tense,tense_marker,tense_marker_expression,wikinews,2
58069,В прошлом сезоне бесед не было.,В грядущем сезоне бесед не было.,прошлом,грядущем,Semantics,Tense,tense_marker,tense_marker_expression,wikinews,2
19204,В прошлом году они уничтожили Тимбукту.,В грядущем году они уничтожили Тимбукту.,прошлом,грядущем,Semantics,Tense,tense_marker,tense_marker_expression,wikinews,2
118885,Я уже видел вчера дизайн.,Я уже видел завтра дизайн.,вчера,завтра,Semantics,Tense,tense_marker,tense_marker_simple,wikinews,1
128300,Вчера город реализовал объект с торгов.,Завтра город реализовал объект с торгов.,Вчера,завтра,Semantics,Tense,tense_marker,tense_marker_simple,wikinews,2
128021,Такое вчера заключение врачи сделали.,Такое завтра заключение врачи сделали.,вчера,завтра,Semantics,Tense,tense_marker,tense_marker_simple,wikinews,2
119045,Вчера стало известно о дизбанде коллектива.,Завтра стало известно о дизбанде коллектива.,Вчера,завтра,Semantics,Tense,tense_marker,tense_marker_simple,wikinews,2
119565,Вчера игрок уже успешно прошел медосмотр.,Завтра игрок уже успешно прошел медосмотр.,Вчера,завтра,Semantics,Tense,tense_marker,tense_marker_simple,wikinews,2
115194,Вчера еще митинг вела зачем-то.,Завтра еще митинг вела зачем-то.,Вчера,завтра,Semantics,Tense,tense_marker,tense_marker_simple,wikinews,1
118550,Вчера команда рабочих осушила ров Усигафути.,Завтра команда рабочих осушила ров Усигафути.,Вчера,завтра,Semantics,Tense,tense_marker,tense_marker_simple,wikinews,3
127931,Вчера компания получила еще один удар.,Завтра компания получила еще один удар.,Вчера,завтра,Semantics,Tense,tense_marker,tense_marker_simple,wikinews,3
117264,Посла Беларуси мы вчера не вызвали...,Посла Беларуси мы завтра не вызвали...,вчера,завтра,Semantics,Tense,tense_marker,tense_marker_simple,wikinews,2
123285,Швы завтра на допросе покажу.,Швы вчера на допросе покажу.,завтра,вчера,Semantics,Tense,tense_marker,tense_marker_simple,wikinews,2
118107,Завтра за Сенцова приедет просить Макрон.,Вчера за Сенцова приедет просить Макрон.,Завтра,вчера,Semantics,Tense,tense_marker,tense_marker_simple,wikinews,3
114895,"Там папа прокурор, заходил вчера...","Там папа прокурор, заходил завтра...",вчера,завтра,Semantics,Tense,tense_marker,tense_marker_simple,wikinews,2
128858,Весь рейс вчера это видел.,Весь рейс завтра это видел.,вчера,завтра,Semantics,Tense,tense_marker,tense_marker_simple,wikinews,2
123265,"Ну все, кто вчера были.","Ну все, кто завтра были.",вчера,завтра,Semantics,Tense,tense_marker,tense_marker_simple,wikinews,2
126861,Деньги завтра им передам в сейф.,Деньги вчера им передам в сейф.,завтра,вчера,Semantics,Tense,tense_marker,tense_marker_simple,wikinews,2
120614,Утек документ в Сеть вчера.,Утек документ в Сеть завтра.,вчера,завтра,Semantics,Tense,tense_marker,tense_marker_simple,wikinews,2
113493,Вчера наконец отдышался от них.,Завтра наконец отдышался от них.,Вчера,завтра,Semantics,Tense,tense_marker,tense_marker_simple,wikipedia,2
94222,Она в прошлом году читала его работу.,Она в будущем году читала его работу.,прошлом,будущем,Semantics,Tense,tense_marker,tense_marker_expression,librusec,3
92358,В прошлом году Минг увлекся водной охотой.,В будущем году Минг увлекся водной охотой.,прошлом,будущем,Semantics,Tense,tense_marker,tense_marker_expression,librusec,3
112879,Этот Макс в прошлом году потерял отца.,Этот Макс в грядущем году потерял отца.,прошлом,грядущем,Semantics,Tense,tense_marker,tense_marker_expression,librusec,3
97839,В прошлые разы я наблюдалась на Курской.,В будущие разы я наблюдалась на Курской.,прошлые,будущие,Semantics,Tense,tense_marker,tense_marker_expression,librusec,3
98643,В прошлом году Варькиному Степке руку сломал.,В грядущем году Варькиному Степке руку сломал.,прошлом,грядущем,Semantics,Tense,tense_marker,tense_marker_expression,librusec,3
108982,Какие еще пройдут тут в грядущие века?,Какие еще пройдут тут в прошедшие века?,грядущие,прошедшие,Semantics,Tense,tense_marker,tense_marker_expression,librusec,3
105160,В прошлом году Василиса легко провела Гавра.,В будущем году Василиса легко провела Гавра.,прошлом,будущем,Semantics,Tense,tense_marker,tense_marker_expression,librusec,2
99837,В прошлый раз меня доставило четверо перяников.,В будущий раз меня доставило четверо перяников.,прошлый,будущий,Semantics,Tense,tense_marker,tense_marker_expression,librusec,3
103131,Я его на прошлой неделе прочихаться заставил.,Я его на будущей неделе прочихаться заставил.,прошлой,будущей,Semantics,Tense,tense_marker,tense_marker_expression,librusec,2
