id,source_sentence,target_sentence,source_word,target_word,level,phenomenon,PID,subtype,domain,tree_depth
170738,"Стар, пришел бы вчера, зайдите осенью.","Стар, пришел бы завтра, зайдите осенью.",вчера,завтра,Semantics,Tense,tense_marker,tense_marker_simple,librusec,3
194294,"А только вчера вопил, что уедет в Нарлак!","А только завтра вопил, что уедет в Нарлак!",вчера,завтра,Semantics,Tense,tense_marker,tense_marker_simple,librusec,4
191113,"Сереже лучше, — вчера ему дали пить.","Сереже лучше, — завтра ему дали пить.",вчера,завтра,Semantics,Tense,tense_marker,tense_marker_simple,librusec,2
164358,"Да рубаху сними, вчера ведь только постирала!","Да рубаху сними, завтра ведь только постирала!",вчера,завтра,Semantics,Tense,tense_marker,tense_marker_simple,librusec,2
155018,Вот Мох позавчера по одному адресу и пошел.,Вот Мох послезавтра по одному адресу и пошел.,позавчера,послезавтра,Semantics,Tense,tense_marker,tense_marker_simple,librusec,3
155200,Это Вы вчера Самойловых из двести пятой залили?,Это Вы завтра Самойловых из двести пятой залили?,вчера,завтра,Semantics,Tense,tense_marker,tense_marker_simple,librusec,2
215181,Лайм посмотрел на еще вчера такое красивое лицо брата.,Лайм посмотрел на еще завтра такое красивое лицо брата.,вчера,завтра,Semantics,Tense,tense_marker,tense_marker_simple,librusec,4
239799,"Вчера Вы сказали, что ум – это реальность...","Завтра Вы сказали, что ум – это реальность...",Вчера,завтра,Semantics,Tense,tense_marker,tense_marker_simple,librusec,2
185704,"Наверное, Дреймен вчера взял его и куда-то дел.","Наверное, Дреймен завтра взял его и куда-то дел.",вчера,завтра,Semantics,Tense,tense_marker,tense_marker_simple,librusec,3
238537,"Да, думаю, видно тоже вчера хорошо принял.","Да, думаю, видно тоже завтра хорошо принял.",вчера,завтра,Semantics,Tense,tense_marker,tense_marker_simple,librusec,4
134798,Завтра утром я подарю тебе Маску Великого Ангана.,Вчера утром я подарю тебе Маску Великого Ангана.,Завтра,вчера,Semantics,Tense,tense_marker,tense_marker_simple,librusec,4
227323,Он видел вчера их пробы - не взял.,Он видел завтра их пробы - не взял.,вчера,завтра,Semantics,Tense,tense_marker,tense_marker_simple,librusec,3
221377,Вчера Веруша купила одинаковые — себе и Даше.,Завтра Веруша купила одинаковые — себе и Даше.,Вчера,завтра,Semantics,Tense,tense_marker,tense_marker_simple,librusec,4
135775,"За вами завтра задет или Браток, или Михаил.","За вами вчера задет или Браток, или Михаил.",завтра,вчера,Semantics,Tense,tense_marker,tense_marker_simple,librusec,4
182106,Вчера ее половинка смотрела зверем – сожрать готова была.,Завтра ее половинка смотрела зверем – сожрать готова была.,Вчера,завтра,Semantics,Tense,tense_marker,tense_marker_simple,librusec,3
226635,Дядя Лорж молол вчера по этому поводу просто чепуху.,Дядя Лорж молол завтра по этому поводу просто чепуху.,вчера,завтра,Semantics,Tense,tense_marker,tense_marker_simple,librusec,4
182427,Кантор вчера выиграл там девяносто пять стаканов вина.,Кантор завтра выиграл там девяносто пять стаканов вина.,вчера,завтра,Semantics,Tense,tense_marker,tense_marker_simple,librusec,3
208773,"Боже, какой ленч приготовил нам вчера Анатоль!","Боже, какой ленч приготовил нам завтра Анатоль!",вчера,завтра,Semantics,Tense,tense_marker,tense_marker_simple,librusec,3
216858,Стерляди вчера взяли – всех родичей можно накормить.,Стерляди завтра взяли – всех родичей можно накормить.,вчера,завтра,Semantics,Tense,tense_marker,tense_marker_simple,librusec,4
176956,Вчера отправил к вратам Адерга не одного пирата.,Завтра отправил к вратам Адерга не одного пирата.,Вчера,завтра,Semantics,Tense,tense_marker,tense_marker_simple,librusec,4
193764,Ну ладно: вчера Хамир сделал мне предложение.,Ну ладно: завтра Хамир сделал мне предложение.,вчера,завтра,Semantics,Tense,tense_marker,tense_marker_simple,librusec,2
221464,По этому вчера сразу и не пошла ко дну.,По этому завтра сразу и не пошла ко дну.,вчера,завтра,Semantics,Tense,tense_marker,tense_marker_simple,librusec,3
135551,Ведь вчера вечером вас за столом называли Рейнар?,Ведь завтра вечером вас за столом называли Рейнар?,вчера,завтра,Semantics,Tense,tense_marker,tense_marker_simple,librusec,3
150916,Посмотреть собранные вчера Сушиным документы по шагам Кисилева.,Посмотреть собранные завтра Сушиным документы по шагам Кисилева.,вчера,завтра,Semantics,Tense,tense_marker,tense_marker_simple,librusec,4
226998,"Лично я убежден, что Илвисакера завтра схватят.","Лично я убежден, что Илвисакера вчера схватят.",завтра,вчера,Semantics,Tense,tense_marker,tense_marker_simple,librusec,3
207286,Нер вчера говорил правильно: люди начнут обживаться.,Нер завтра говорил правильно: люди начнут обживаться.,вчера,завтра,Semantics,Tense,tense_marker,tense_marker_simple,librusec,2
176831,"Завтра приду, про Сережку у начальника сведаю.","Вчера приду, про Сережку у начальника сведаю.",Завтра,вчера,Semantics,Tense,tense_marker,tense_marker_simple,librusec,4
140935,"Вчера развели огонь, едва выбравшись на твердое.","Завтра развели огонь, едва выбравшись на твердое.",Вчера,завтра,Semantics,Tense,tense_marker,tense_marker_simple,librusec,3
221023,Такер Гарретсон шагу не сделал по нашей земле вчера!,Такер Гарретсон шагу не сделал по нашей земле завтра!,вчера,завтра,Semantics,Tense,tense_marker,tense_marker_simple,librusec,3
135422,"Все, что вчера выиграл с вашей помощью!","Все, что завтра выиграл с вашей помощью!",вчера,завтра,Semantics,Tense,tense_marker,tense_marker_simple,librusec,3
189855,Почему Тим вчера не причинил зла Лауре или мальчику?,Почему Тим завтра не причинил зла Лауре или мальчику?,вчера,завтра,Semantics,Tense,tense_marker,tense_marker_simple,librusec,3
208900,"Кстати, что там Шарз вчера говорил про вино?","Кстати, что там Шарз завтра говорил про вино?",вчера,завтра,Semantics,Tense,tense_marker,tense_marker_simple,librusec,3
195071,Или не понял вчера – не с толпой воюем?,Или не понял завтра – не с толпой воюем?,вчера,завтра,Semantics,Tense,tense_marker,tense_marker_simple,librusec,3
174242,Да и на празднике тебя вчера все Катериниванили!,Да и на празднике тебя завтра все Катериниванили!,вчера,завтра,Semantics,Tense,tense_marker,tense_marker_simple,librusec,3
193754,Вчера чашку уронила – разбила – а все ты.,Завтра чашку уронила – разбила – а все ты.,Вчера,завтра,Semantics,Tense,tense_marker,tense_marker_simple,librusec,3
112036,В прошлом году за Кепского голоснул – Ваське и дали!,В грядущем году за Кепского голоснул – Ваське и дали!,прошлом,грядущем,Semantics,Tense,tense_marker,tense_marker_expression,librusec,4
113212,Я уж в прошлом году ходил в исполком – думал псевдоним взять.,Я уж в грядущем году ходил в исполком – думал псевдоним взять.,прошлом,грядущем,Semantics,Tense,tense_marker,tense_marker_expression,librusec,5
107920,Не это ли сказал ваш Совет Рониго в прошлый раз?,Не это ли сказал ваш Совет Рониго в будущий раз?,прошлый,будущий,Semantics,Tense,tense_marker,tense_marker_expression,librusec,4
99733,В прошлом году во время набега сиу Милли и мальчик были убиты.,В грядущем году во время набега сиу Милли и мальчик были убиты.,прошлом,грядущем,Semantics,Tense,tense_marker,tense_marker_expression,librusec,6
90955,На прошлой неделе у нас сутки буйствовал ферайн местного хлебобулочного бизнеса.,На будущей неделе у нас сутки буйствовал ферайн местного хлебобулочного бизнеса.,прошлой,будущей,Semantics,Tense,tense_marker,tense_marker_expression,librusec,5
101940,"Ох, любила Коваль в прошлой жизни подобных представителей мужского пола!","Ох, любила Коваль в будущей жизни подобных представителей мужского пола!",прошлой,будущей,Semantics,Tense,tense_marker,tense_marker_expression,librusec,5
89791,Только эта Анна тоже померла в прошлом году – родами.,Только эта Анна тоже померла в грядущем году – родами.,прошлом,грядущем,Semantics,Tense,tense_marker,tense_marker_expression,librusec,5
99241,В прошлый раз он у серогонов и лая-то не слышал.,В будущий раз он у серогонов и лая-то не слышал.,прошлый,будущий,Semantics,Tense,tense_marker,tense_marker_expression,librusec,4
106984,"В прошлом году Эл сдал все на твердое ""хорошо"".","В грядущем году Эл сдал все на твердое ""хорошо"".",прошлом,грядущем,Semantics,Tense,tense_marker,tense_marker_expression,librusec,4
106604,"Подозреваю, в прошлой жизни ты хорошо смекал в рубификации.","Подозреваю, в будущей жизни ты хорошо смекал в рубификации.",прошлой,будущей,Semantics,Tense,tense_marker,tense_marker_expression,librusec,4
92848,"Я чуял, на прошлой неделе вам камнем окно разбили?","Я чуял, на будущей неделе вам камнем окно разбили?",прошлой,будущей,Semantics,Tense,tense_marker,tense_marker_expression,librusec,3
112377,"Но этих можно не считать, их любовь завязалась в прошлом году.","Но этих можно не считать, их любовь завязалась в грядущем году.",прошлом,грядущем,Semantics,Tense,tense_marker,tense_marker_expression,librusec,5
108221,"Егору тоже дай, чтобы как в прошлый раз не вышло.","Егору тоже дай, чтобы как в будущий раз не вышло.",прошлый,будущий,Semantics,Tense,tense_marker,tense_marker_expression,librusec,3
108866,В прошлом году умер опасный враг — старый Ольгерд Литовский.,В грядущем году умер опасный враг — старый Ольгерд Литовский.,прошлом,грядущем,Semantics,Tense,tense_marker,tense_marker_expression,librusec,4
110590,"Факс Джозеф получил, Мария взглянула на дату, на прошлой неделе.","Факс Джозеф получил, Мария взглянула на дату, на будущей неделе.",прошлой,будущей,Semantics,Tense,tense_marker,tense_marker_expression,librusec,4
105980,"Аннхен сказала нам в прошлом году, что Ролло стал очень ленивый.","Аннхен сказала нам в будущем году, что Ролло стал очень ленивый.",прошлом,будущем,Semantics,Tense,tense_marker,tense_marker_expression,librusec,4
98414,В прошлом году мистер Фанцель пришил мне пуговицу к пальто бесплатно.,В будущем году мистер Фанцель пришил мне пуговицу к пальто бесплатно.,прошлом,будущем,Semantics,Tense,tense_marker,tense_marker_expression,librusec,4
101203,Не далее как на прошлой неделе утащил женщину из Коу.,Не далее как на будущей неделе утащил женщину из Коу.,прошлой,будущей,Semantics,Tense,tense_marker,tense_marker_expression,librusec,4
99649,"Теперь Ал пожалел, что в прошлом полугодии сократил бюджет секторальной полиции.","Теперь Ал пожалел, что в завтрашнем полугодии сократил бюджет секторальной полиции.",прошлом,завтрашнем,Semantics,Tense,tense_marker,tense_marker_expression,librusec,5
96002,В минувшем году Тиэко ходила поглядеть на Пиршество у извилистого ручья.,В будущем году Тиэко ходила поглядеть на Пиршество у извилистого ручья.,минувшем,будущем,Semantics,Tense,tense_marker,tense_marker_expression,librusec,5
102097,Тут у меня в августе прошлом трое как раз ночевали.,Тут у меня в августе будущем трое как раз ночевали.,прошлом,будущем,Semantics,Tense,tense_marker,tense_marker_expression,librusec,4
88857,В прошлый раз батюшка пировал у Чжэнов с его сестрой Айюэ.,В будущий раз батюшка пировал у Чжэнов с его сестрой Айюэ.,прошлый,будущий,Semantics,Tense,tense_marker,tense_marker_expression,librusec,4
101143,"Но в прошлом году, Трогэпл, случилась ужасная вещь.","Но в грядущем году, Трогэпл, случилась ужасная вещь.",прошлом,грядущем,Semantics,Tense,tense_marker,tense_marker_expression,librusec,4
108785,"Можешь взять тот, который Заунт пошил на прошлой неделе.","Можешь взять тот, который Заунт пошил на будущей неделе.",прошлой,будущей,Semantics,Tense,tense_marker,tense_marker_expression,librusec,5
104249,"Ты помнишь, В прошлый май Мы заблудились в чаще?","Ты помнишь, В будущий май Мы заблудились в чаще?",прошлый,будущий,Semantics,Tense,tense_marker,tense_marker_expression,librusec,4
110643,А возле Строкального озера в прошлом году осадили меня лисята.,А возле Строкального озера в грядущем году осадили меня лисята.,прошлом,грядущем,Semantics,Tense,tense_marker,tense_marker_expression,librusec,3
95064,Теперь же построенные в прошлом веке стены перекрывали путь старому ходу.,Теперь же построенные в грядущем веке стены перекрывали путь старому ходу.,прошлом,грядущем,Semantics,Tense,tense_marker,tense_marker_expression,librusec,6
88048,"В прошлый раз обсуждали, что Бондарчуков делаем на следующий номер.","В будущий раз обсуждали, что Бондарчуков делаем на следующий номер.",прошлый,будущий,Semantics,Tense,tense_marker,tense_marker_expression,librusec,4
105286,"Рядом стоит двойной пень, я шел тут в прошлом году.","Рядом стоит двойной пень, я шел тут в будущем году.",прошлом,будущем,Semantics,Tense,tense_marker,tense_marker_expression,librusec,4
99942,В прошлом году настоятель Каменного монастыря на Кубинском озере подарил замочек-то.,В грядущем году настоятель Каменного монастыря на Кубинском озере подарил замочек-то.,прошлом,грядущем,Semantics,Tense,tense_marker,tense_marker_expression,librusec,5
104529,"Это серьезные люди, Марк меня в прошлый приезд знакомил.","Это серьезные люди, Марк меня в будущий приезд знакомил.",прошлый,будущий,Semantics,Tense,tense_marker,tense_marker_expression,librusec,3
102391,В прошлом году под Авенлебом это стоило им очень дорого.,В грядущем году под Авенлебом это стоило им очень дорого.,прошлом,грядущем,Semantics,Tense,tense_marker,tense_marker_expression,librusec,4
99129,Азин в прошлом году в Ижевск пришел — кто орла сошвыривал?,Азин в грядущем году в Ижевск пришел — кто орла сошвыривал?,прошлом,грядущем,Semantics,Tense,tense_marker,tense_marker_expression,librusec,4
113062,"В прошлые годы они требовали, чтобы я учил студентов первоэлементам Марра.","В будущие годы они требовали, чтобы я учил студентов первоэлементам Марра.",прошлые,будущие,Semantics,Tense,tense_marker,tense_marker_expression,librusec,4
89738,Бывший тамбовец Сергей купил дом через улицу еще в прошлом году.,Бывший тамбовец Сергей купил дом через улицу еще в грядущем году.,прошлом,грядущем,Semantics,Tense,tense_marker,tense_marker_expression,librusec,4
98019,Мне в прошлом году на чемпионате так сразу три выбили!..,Мне в будущем году на чемпионате так сразу три выбили!..,прошлом,будущем,Semantics,Tense,tense_marker,tense_marker_expression,librusec,3
99521,"Видела одну на прошлой неделе, – с готовностью предложила Ли.","Видела одну на будущей неделе, – с готовностью предложила Ли.",прошлой,будущей,Semantics,Tense,tense_marker,tense_marker_expression,librusec,4
108234,В прошлом году вместе учились драться под руководством Горма Одноногого.,В грядущем году вместе учились драться под руководством Горма Одноногого.,прошлом,грядущем,Semantics,Tense,tense_marker,tense_marker_expression,librusec,4
111995,"Тогда становится понятно, почему в прошлое Посвящение появился Вельхеор.","Тогда становится понятно, почему в наступающее Посвящение появился Вельхеор.",прошлое,наступающее,Semantics,Tense,tense_marker,tense_marker_expression,librusec,3
92640,"Калле вспомнил турка, которому разбили бровь в прошлую субботу.","Калле вспомнил турка, которому разбили бровь в грядущую субботу.",прошлую,грядущую,Semantics,Tense,tense_marker,tense_marker_expression,librusec,4
108432,"Теперь красные не перли ордой, как в прошлый раз.","Теперь красные не перли ордой, как в будущий раз.",прошлый,будущий,Semantics,Tense,tense_marker,tense_marker_expression,librusec,2
97971,В прошлых сражениях по вине Несма Мифрил Халл понес тяжелые потери.,В завтрашних сражениях по вине Несма Мифрил Халл понес тяжелые потери.,прошлых,завтрашних,Semantics,Tense,tense_marker,tense_marker_expression,librusec,5
109872,В прошлом году несколько жителей Сто Сорок Второй навестило Землю.,В будущем году несколько жителей Сто Сорок Второй навестило Землю.,прошлом,будущем,Semantics,Tense,tense_marker,tense_marker_expression,librusec,4
107582,"Ялоська уже большая, а Каська в прошлом году померла.","Ялоська уже большая, а Каська в будущем году померла.",прошлом,будущем,Semantics,Tense,tense_marker,tense_marker_expression,librusec,3
90233,"На прошлой неделе попросила Пятенкова, чтоб унес в ларек.","На будущей неделе попросила Пятенкова, чтоб унес в ларек.",прошлой,будущей,Semantics,Tense,tense_marker,tense_marker_expression,librusec,4
91705,В прошлом году Чайхидзев приехал на Зеленую Косу в конце июня.,В будущем году Чайхидзев приехал на Зеленую Косу в конце июня.,прошлом,будущем,Semantics,Tense,tense_marker,tense_marker_expression,librusec,4
236956,У меня печник: вчера поставила драчену - получился сплошной закал.,У меня печник: завтра поставила драчену - получился сплошной закал.,вчера,завтра,Semantics,Tense,tense_marker,tense_marker_simple,librusec,5
135537,Ведь только вчера утром вы едва ли не вместе покинули Кэрфортин!,Ведь только завтра утром вы едва ли не вместе покинули Кэрфортин!,вчера,завтра,Semantics,Tense,tense_marker,tense_marker_simple,librusec,4
176020,Я ведь совсем было вчера решился у тебя Лариску увести.,Я ведь совсем было завтра решился у тебя Лариску увести.,вчера,завтра,Semantics,Tense,tense_marker,tense_marker_simple,librusec,5
149158,"Вчера он был закрыт, – располагающе бросил Аркаша вслед соседа.","Завтра он был закрыт, – располагающе бросил Аркаша вслед соседа.",Вчера,завтра,Semantics,Tense,tense_marker,tense_marker_simple,librusec,2
