id,source_sentence,target_sentence,source_word,target_word,level,phenomenon,PID,subtype,domain,tree_depth
113900,Мучительно сладко Клара Новелло Вчера мне напомнила вас!,Мучительно сладко Клара Новелло Завтра мне напомнила вас!,Вчера,завтра,Semantics,Tense,tense_marker,tense_marker_simple,wikipedia,3
96376,В прошлом месяце Ник забил и доставил в деревню Чиянна пятьдесят бычков.,В будущем месяце Ник забил и доставил в деревню Чиянна пятьдесят бычков.,прошлом,будущем,Semantics,Tense,tense_marker,tense_marker_expression,librusec,5
92888,"В прошлый год на погост бедного снесли, — покрестил лоб Курбский.","В грядущий год на погост бедного снесли, — покрестил лоб Курбский.",прошлый,грядущий,Semantics,Tense,tense_marker,tense_marker_expression,librusec,4
91112,"А в прошлом году любопытства ради поднялся до их ""норы"".","А в будущем году любопытства ради поднялся до их ""норы"".",прошлом,будущем,Semantics,Tense,tense_marker,tense_marker_expression,librusec,4
111059,"За компанию к тем двум нохам, что на прошлой неделе приговорили!","За компанию к тем двум нохам, что на будущей неделе приговорили!",прошлой,будущей,Semantics,Tense,tense_marker,tense_marker_expression,librusec,4
92639,Это в прошлом году Картошка по пьянке свернул лампу знаменем.,Это в будущем году Картошка по пьянке свернул лампу знаменем.,прошлом,будущем,Semantics,Tense,tense_marker,tense_marker_expression,librusec,3
112349,"Как не напутали и в прошлый раз, со временем смерти.","Как не напутали и в будущий раз, со временем смерти.",прошлый,будущий,Semantics,Tense,tense_marker,tense_marker_expression,librusec,3
88263,А в прошлом году приехал с шефами да здесь и остался.,А в грядущем году приехал с шефами да здесь и остался.,прошлом,грядущем,Semantics,Tense,tense_marker,tense_marker_expression,librusec,4
101217,В прошлый раз ему принесли фруктовый салат и С 1 ущенку.,В будущий раз ему принесли фруктовый салат и С 1 ущенку.,прошлый,будущий,Semantics,Tense,tense_marker,tense_marker_expression,librusec,4
91708,"На прошлой неделе, в среду, за Шейкина просватали.","На будущей неделе, в среду, за Шейкина просватали.",прошлой,будущей,Semantics,Tense,tense_marker,tense_marker_expression,librusec,4
88915,"Когда Паоло бодрствовал в прошлый раз, Карпал был возлюбленным Лайслы.","Когда Паоло бодрствовал в будущий раз, Карпал был возлюбленным Лайслы.",прошлый,будущий,Semantics,Tense,tense_marker,tense_marker_expression,librusec,3
92572,Вадим лично на прошлой неделе летал к ним на контроль.,Вадим лично на будущей неделе летал к ним на контроль.,прошлой,будущей,Semantics,Tense,tense_marker,tense_marker_expression,librusec,5
105595,В прошлом плавании по поводу Юби тоже было много тревожных предчувствий.,В грядущем плавании по поводу Юби тоже было много тревожных предчувствий.,прошлом,грядущем,Semantics,Tense,tense_marker,tense_marker_expression,librusec,6
98541,"И в прошлый год жильцы жили, и сейчас энтот вот приехал.","И в будущий год жильцы жили, и сейчас энтот вот приехал.",прошлый,будущий,Semantics,Tense,tense_marker,tense_marker_expression,librusec,3
107600,С этой проблемой Френки и столкнулся примерно в прошлом январе.,С этой проблемой Френки и столкнулся примерно в будущем январе.,прошлом,будущем,Semantics,Tense,tense_marker,tense_marker_expression,librusec,3
103583,На прошлой неделе на соседнюю со Свирой Зейду пожаловали три гостя.,На будущей неделе на соседнюю со Свирой Зейду пожаловали три гостя.,прошлой,будущей,Semantics,Tense,tense_marker,tense_marker_expression,librusec,6
113333,"Если Ралидж погибнет, Арлина не разминется с ним в будущей жизни...","Если Ралидж погибнет, Арлина не разминется с ним в прошлой жизни...",будущей,прошлой,Semantics,Tense,tense_marker,tense_marker_expression,librusec,4
100359,В прошлом году какой-то участок папиного управления случайно порвал правительственный кабель.,В будущем году какой-то участок папиного управления случайно порвал правительственный кабель.,прошлом,будущем,Semantics,Tense,tense_marker,tense_marker_expression,librusec,5
94518,"И только на прошлой неделе смотрели вас, а вы здесь!","И только на будущей неделе смотрели вас, а вы здесь!",прошлой,будущей,Semantics,Tense,tense_marker,tense_marker_expression,librusec,3
96797,В прошлом году отец отыскал один такой публичный дом в Европе.,В грядущем году отец отыскал один такой публичный дом в Европе.,прошлом,грядущем,Semantics,Tense,tense_marker,tense_marker_expression,librusec,4
102021,Это он председательствовал и на прошлой встрече — президент Франции!,Это он председательствовал и на завтрашней встрече — президент Франции!,прошлой,завтрашней,Semantics,Tense,tense_marker,tense_marker_expression,librusec,4
112079,"Пальто вот не справила в прошлом году, отдыхать поехала.","Пальто вот не справила в грядущем году, отдыхать поехала.",прошлом,грядущем,Semantics,Tense,tense_marker,tense_marker_expression,librusec,3
96351,"Нидем помер в прошлом месяце, и его вдова решила продать заведение.","Нидем помер в будущем месяце, и его вдова решила продать заведение.",прошлом,будущем,Semantics,Tense,tense_marker,tense_marker_expression,librusec,5
89865,"Вадик-то, за которого в прошлый раз базарила, его человек.","Вадик-то, за которого в будущий раз базарила, его человек.",прошлый,будущий,Semantics,Tense,tense_marker,tense_marker_expression,librusec,5
88678,"Иван Иванович уехал в прошлую среду, завтра — вы.","Иван Иванович уехал в завтрашнюю среду, завтра — вы.",прошлую,завтрашнюю,Semantics,Tense,tense_marker,tense_marker_expression,librusec,5
94596,В прошлый раз такая беседа закончилась наследством и виде здоровенного дома.,В будущий раз такая беседа закончилась наследством и виде здоровенного дома.,прошлый,будущий,Semantics,Tense,tense_marker,tense_marker_expression,librusec,6
106457,А янки в прошлом году обшарили весь дом и славно поживились.,А янки в будущем году обшарили весь дом и славно поживились.,прошлом,будущем,Semantics,Tense,tense_marker,tense_marker_expression,librusec,4
96836,Педдиуок именно в этом месте в прошлом году упустил победу.,Педдиуок именно в этом месте в будущем году упустил победу.,прошлом,будущем,Semantics,Tense,tense_marker,tense_marker_expression,librusec,3
88877,В прошлом году я к батюшке насчет Хэ Девятого просить ходила.,В будущем году я к батюшке насчет Хэ Девятого просить ходила.,прошлом,будущем,Semantics,Tense,tense_marker,tense_marker_expression,librusec,5
99904,Только в прошлый месяц тут пропали три торговых судна и посыльный клипер.,Только в будущий месяц тут пропали три торговых судна и посыльный клипер.,прошлый,будущий,Semantics,Tense,tense_marker,tense_marker_expression,librusec,4
92774,"Бруно знал, что Кертнера задержали в прошлом декабре сверх десяти дней.","Бруно знал, что Кертнера задержали в будущем декабре сверх десяти дней.",прошлом,будущем,Semantics,Tense,tense_marker,tense_marker_expression,librusec,4
88442,"На прошлой неделе передавали про одного, с планеты Клэн.","На будущей неделе передавали про одного, с планеты Клэн.",прошлой,будущей,Semantics,Tense,tense_marker,tense_marker_expression,librusec,4
101582,И еще сказали: в прошлом году умер Саша Коротков.,И еще сказали: в грядущем году умер Саша Коротков.,прошлом,грядущем,Semantics,Tense,tense_marker,tense_marker_expression,librusec,4
91824,В прошлый раз люди Арламдора заплатили за это страшную цену.,В будущий раз люди Арламдора заплатили за это страшную цену.,прошлый,будущий,Semantics,Tense,tense_marker,tense_marker_expression,librusec,5
101603,Ведь в прошлый раз меня ведь тоже лично не было?,Ведь в будущий раз меня ведь тоже лично не было?,прошлый,будущий,Semantics,Tense,tense_marker,tense_marker_expression,librusec,4
93522,С исключительными работами этого докая я знакомил тебя на прошлой неделе.,С исключительными работами этого докая я знакомил тебя на будущей неделе.,прошлой,будущей,Semantics,Tense,tense_marker,tense_marker_expression,librusec,4
93659,И вот в прошлом году вы вновь напали на Злобению!,И вот в будущем году вы вновь напали на Злобению!,прошлом,будущем,Semantics,Tense,tense_marker,tense_marker_expression,librusec,3
113058,В прошлом веке такое усиление частностей встречалось в сочинениях комических.,В будущем веке такое усиление частностей встречалось в сочинениях комических.,прошлом,будущем,Semantics,Tense,tense_marker,tense_marker_expression,librusec,4
112086,Только за ними и отпустила тебя в прошлое лето на фестиваль...,Только за ними и отпустила тебя в наступающее лето на фестиваль...,прошлое,наступающее,Semantics,Tense,tense_marker,tense_marker_expression,librusec,4
111620,"Об их любви и не упомянуто в прошлую зиму, не собралась.","Об их любви и не упомянуто в наступающую зиму, не собралась.",прошлую,наступающую,Semantics,Tense,tense_marker,tense_marker_expression,librusec,4
111624,Во прошлом году Матюшка Панфилов шел парусом по низам Большой собачьей.,Во будущем году Матюшка Панфилов шел парусом по низам Большой собачьей.,прошлом,будущем,Semantics,Tense,tense_marker,tense_marker_expression,librusec,5
234266,"Капитан сказал на дело пойдем завтра, что хочешь все твое.","Капитан сказал на дело пойдем вчера, что хочешь все твое.",завтра,вчера,Semantics,Tense,tense_marker,tense_marker_simple,librusec,5
147014,"Сегодня потру, а завтра осторожно дам знать... про гуттуральный голос.","Сегодня потру, а вчера осторожно дам знать... про гуттуральный голос.",завтра,вчера,Semantics,Tense,tense_marker,tense_marker_simple,librusec,4
166304,"А я достаточно громко смеялся, когда начальник вчера пошутил?","А я достаточно громко смеялся, когда начальник завтра пошутил?",вчера,завтра,Semantics,Tense,tense_marker,tense_marker_simple,librusec,3
170743,А вроде как вчера из Катней в Шмели на вечерки бегали.,А вроде как завтра из Катней в Шмели на вечерки бегали.,вчера,завтра,Semantics,Tense,tense_marker,tense_marker_simple,librusec,5
165802,"Ахнула — вчера ребенка видела, он был полностью здоров.","Ахнула — завтра ребенка видела, он был полностью здоров.",вчера,завтра,Semantics,Tense,tense_marker,tense_marker_simple,librusec,3
197582,"То-то Дадалион вчера говорил, что монастырь этот Гильдии магов Лутаки содержит!","То-то Дадалион завтра говорил, что монастырь этот Гильдии магов Лутаки содержит!",вчера,завтра,Semantics,Tense,tense_marker,tense_marker_simple,librusec,4
170850,Журналист этого не говорил — это Виктор ей сказал вчера.,Журналист этого не говорил — это Виктор ей сказал завтра.,вчера,завтра,Semantics,Tense,tense_marker,tense_marker_simple,librusec,2
157937,Вчера же хотела купить детям новый конструктор – пожалела денег!,Завтра же хотела купить детям новый конструктор – пожалела денег!,Вчера,завтра,Semantics,Tense,tense_marker,tense_marker_simple,librusec,5
231830,"Почти два года и рулю здесь, вот, кометы вчера смотрел...","Почти два года и рулю здесь, вот, кометы завтра смотрел...",вчера,завтра,Semantics,Tense,tense_marker,tense_marker_simple,librusec,5
180497,Вчера вон тоже сняли наблюдение – и привет на всю страну!,Завтра вон тоже сняли наблюдение – и привет на всю страну!,Вчера,завтра,Semantics,Tense,tense_marker,tense_marker_simple,librusec,3
221412,Вчера он опробовал кокиль — отлил и отработал пять моделей.,Завтра он опробовал кокиль — отлил и отработал пять моделей.,Вчера,завтра,Semantics,Tense,tense_marker,tense_marker_simple,librusec,4
245135,"Зато вчера, севернее против карты, открылся большой залив.","Зато завтра, севернее против карты, открылся большой залив.",вчера,завтра,Semantics,Tense,tense_marker,tense_marker_simple,librusec,5
140638,"Гарсон согласился сражаться с ябандзинами — похоже, вчера Абрайра говорила правду.","Гарсон согласился сражаться с ябандзинами — похоже, завтра Абрайра говорила правду.",вчера,завтра,Semantics,Tense,tense_marker,tense_marker_simple,librusec,5
140178,"Вчера продал Донца — на Дон, и увели его.","Завтра продал Донца — на Дон, и увели его.",Вчера,завтра,Semantics,Tense,tense_marker,tense_marker_simple,librusec,3
134978,"Вот он, дом, куда направил его вчера Эш.","Вот он, дом, куда направил его завтра Эш.",вчера,завтра,Semantics,Tense,tense_marker,tense_marker_simple,librusec,4
156843,А если пришла вчера и Руруа увязал эти два события?,А если пришла завтра и Руруа увязал эти два события?,вчера,завтра,Semantics,Tense,tense_marker,tense_marker_simple,librusec,3
131732,"Ну мать, ну пройда, специально вчера нам не сказала.","Ну мать, ну пройда, специально завтра нам не сказала.",вчера,завтра,Semantics,Tense,tense_marker,tense_marker_simple,librusec,3
142672,"Завтра или день сгодя уйду с Астрахани, время зовет!","Вчера или день сгодя уйду с Астрахани, время зовет!",Завтра,вчера,Semantics,Tense,tense_marker,tense_marker_simple,librusec,5
185062,"Васильич, вчера с группой Кузнецова на краже у Сиднюкова ты был?","Васильич, завтра с группой Кузнецова на краже у Сиднюкова ты был?",вчера,завтра,Semantics,Tense,tense_marker,tense_marker_simple,librusec,5
131714,"Он им сам позвонил, оказывается, Марина ему вчера телефон дала.","Он им сам позвонил, оказывается, Марина ему завтра телефон дала.",вчера,завтра,Semantics,Tense,tense_marker,tense_marker_simple,librusec,3
144539,"Эта, ваша, вчера посмотрела телик и рванула награду получать.","Эта, ваша, завтра посмотрела телик и рванула награду получать.",вчера,завтра,Semantics,Tense,tense_marker,tense_marker_simple,librusec,5
183796,"Вчера Жеврич притянул здоровенную бутыль то ли лозовача, то ли ракии.","Завтра Жеврич притянул здоровенную бутыль то ли лозовача, то ли ракии.",Вчера,завтра,Semantics,Tense,tense_marker,tense_marker_simple,librusec,6
152538,Нашли ли Роважински вчера ночью или сегодня утром... совсем недавно?,Нашли ли Роважински завтра ночью или сегодня утром... совсем недавно?,вчера,завтра,Semantics,Tense,tense_marker,tense_marker_simple,librusec,4
131650,"И потом, видела вчера Лидку, такое не сыграешь!","И потом, видела завтра Лидку, такое не сыграешь!",вчера,завтра,Semantics,Tense,tense_marker,tense_marker_simple,librusec,2
131831,"Теперь точно знала, где и во сколько найду завтра Ми.","Теперь точно знала, где и во сколько найду вчера Ми.",завтра,вчера,Semantics,Tense,tense_marker,tense_marker_simple,librusec,4
189229,Кстати — вчера Патриарх таки вынес твой вопрос на голосование.,Кстати — завтра Патриарх таки вынес твой вопрос на голосование.,вчера,завтра,Semantics,Tense,tense_marker,tense_marker_simple,librusec,4
134326,Я тебе завтра же из лавки полкуска красного атласу принесу.,Я тебе вчера же из лавки полкуска красного атласу принесу.,завтра,вчера,Semantics,Tense,tense_marker,tense_marker_simple,librusec,4
150143,"Только вот вчера произошло что-то, какая-то тайна навился надо мной...","Только вот завтра произошло что-то, какая-то тайна навился надо мной...",вчера,завтра,Semantics,Tense,tense_marker,tense_marker_simple,librusec,5
154678,"Неужели он все-таки заподозрил, что именно ее видел вчера в занане?","Неужели он все-таки заподозрил, что именно ее видел завтра в занане?",вчера,завтра,Semantics,Tense,tense_marker,tense_marker_simple,librusec,4
198479,"Вчера Хабалов долго поверить не мог, что казак – убил пристава.","Завтра Хабалов долго поверить не мог, что казак – убил пристава.",Вчера,завтра,Semantics,Tense,tense_marker,tense_marker_simple,librusec,4
194973,"А у меня, подлец, выпонтировал вчера сто рублей.","А у меня, подлец, выпонтировал завтра сто рублей.",вчера,завтра,Semantics,Tense,tense_marker,tense_marker_simple,librusec,4
181819,"А второй — женский день был, теперь уж вчера.","А второй — женский день был, теперь уж завтра.",вчера,завтра,Semantics,Tense,tense_marker,tense_marker_simple,librusec,4
162684,"Это его почуял Имлладд вчера, когда мы были на берегу.","Это его почуял Имлладд завтра, когда мы были на берегу.",вчера,завтра,Semantics,Tense,tense_marker,tense_marker_simple,librusec,3
155834,Вот завтра они увидятся на передаче – Алена и спросит.,Вот вчера они увидятся на передаче – Алена и спросит.,завтра,вчера,Semantics,Tense,tense_marker,tense_marker_simple,librusec,4
231652,"Змееслав вспомнил, как вчера гросайдечи затеяли возиться на площади.","Змееслав вспомнил, как завтра гросайдечи затеяли возиться на площади.",вчера,завтра,Semantics,Tense,tense_marker,tense_marker_simple,librusec,4
204074,Зато уж точно работал - вчера Торп упоминал при мне это название.,Зато уж точно работал - завтра Торп упоминал при мне это название.,вчера,завтра,Semantics,Tense,tense_marker,tense_marker_simple,librusec,5
190816,"А еще приходил запрос с базы, вчера пропал Жорик Бранкевич.","А еще приходил запрос с базы, завтра пропал Жорик Бранкевич.",вчера,завтра,Semantics,Tense,tense_marker,tense_marker_simple,librusec,5
206166,"Мандрика занял вчера третье место, а Бал немного выдохшийся.","Мандрика занял завтра третье место, а Бал немного выдохшийся.",вчера,завтра,Semantics,Tense,tense_marker,tense_marker_simple,librusec,4
205842,"Они была Алекс Руперта Свиткрофта, о чем и напомнила ему вчера.","Они была Алекс Руперта Свиткрофта, о чем и напомнила ему завтра.",вчера,завтра,Semantics,Tense,tense_marker,tense_marker_simple,librusec,4
