id,source_sentence,target_sentence,source_word,target_word,level,phenomenon,PID,subtype,domain,tree_depth
837,Виски были предусмотрительно облеплены пиявками.,Пиявки были предусмотрительно облеплены виски.,пиявками,виски,Semantics,Argument Structure,transitive_verb_passive,transitive_verb_passive_perm,librusec,1
749,Суд был назначен царем в тот же час.,Царь был назначен судом в тот же час.,царем,судом,Semantics,Argument Structure,transitive_verb_passive,transitive_verb_passive_perm,librusec,3
29624,Оба экземпляра были подписаны государем.,Оба государя были подписаны экземпляром.,государем,экземпляром,Semantics,Argument Structure,transitive_verb_passive,transitive_verb_passive_perm,librusec,2
846,Однако заговор был раскрыт предателем.,Однако предатель был раскрыт заговором.,предателем,заговором,Semantics,Argument Structure,transitive_verb_passive,transitive_verb_passive_perm,librusec,1
802,Заговор был организован генералом Каджаром.,Генерал был организован заговором Каджаром.,генералом,заговором,Semantics,Argument Structure,transitive_verb_passive,transitive_verb_passive_perm,librusec,2
816,Форт был атакован коммодором Стрингемом и генералом Батлером.,Коммодор был атакован фортом Стрингемом и генералом Батлером.,коммодором,фортом,Semantics,Argument Structure,transitive_verb_passive,transitive_verb_passive_perm,librusec,3
831,"Ею задумана игра, вы потом все поймете.","Игрой задумана она, вы потом все поймете.",Ею,игрой,Semantics,Argument Structure,transitive_verb_passive,transitive_verb_passive_perm,librusec,2
754,Порция была очарована малышкой Джозефин.,Малышка была очарована порцией Джозефин.,малышкой,порцией,Semantics,Argument Structure,transitive_verb_passive,transitive_verb_passive_perm,librusec,2
854,Им переведены на казахский язык три романа.,Романом переведены на казахский язык три его.,Им,романом,Semantics,Argument Structure,transitive_verb_passive,transitive_verb_passive_perm,librusec,3
830,Зато мода считалась с Донной Анной.,Зато донна считалась с Модой Анной.,Донной,модой,Semantics,Argument Structure,transitive_verb_passive,transitive_verb_passive_perm,librusec,2
29634,Псалтирь была отправлена леди Аликс.,Леди была отправлена псалтирью Аликс.,леди,псалтирью,Semantics,Argument Structure,transitive_verb_passive,transitive_verb_passive_perm,librusec,2
29643,"Словно замок захвачен врагом, подумала Мадлен.","Словно враг захвачен замком, подумала Мадлен.",врагом,замком,Semantics,Argument Structure,transitive_verb_passive,transitive_verb_passive_perm,librusec,2
798,"Объект атакован противником, – сообщает КОП.","Противник атакован объектом, – сообщает КОП.",противником,объектом,Semantics,Argument Structure,transitive_verb_passive,transitive_verb_passive_perm,librusec,2
6062,Двор был заполнен его людьми и армией Риза.,Двор был заполнен его выпусками и армией Риза.,людьми,выпусками,Semantics,Argument Structure,transitive_verb_passive,transitive_verb_passive_rand,librusec,3
6363,"Эс Мерлин понял, что решение им принято.","Эс Мерлин понял, что решение краном принято.",им,краном,Semantics,Argument Structure,transitive_verb_passive,transitive_verb_passive_rand,librusec,3
6547,Аббатство Глинобитная Обитель было поглощено ею.,Аббатство Глинобитная Обитель было поглощено тьмой.,ею,тьмой,Semantics,Argument Structure,transitive_verb_passive,transitive_verb_passive_rand,librusec,3
39624,"Замок построен Мерридом, третьим Главой Некромансеров.","Замок построен монитором, третьим Главой Некромансеров.",Мерридом,монитором,Semantics,Argument Structure,transitive_verb_passive,transitive_verb_passive_rand,librusec,3
6417,Орудие было впервые выпущено мастером из рук.,Орудие было впервые выпущено выдохом из рук.,мастером,выдохом,Semantics,Argument Structure,transitive_verb_passive,transitive_verb_passive_rand,librusec,2
6233,"Термин впервые использован Шиндевольфом, в 60-е годы.","Термин впервые использован критерием, в 60-е годы.",Шиндевольфом,критерием,Semantics,Argument Structure,transitive_verb_passive,transitive_verb_passive_rand,librusec,2
6156,Только последние пять стихов дописаны позже Иехасом.,Только последние пять стихов дописаны позже уколом.,Иехасом,уколом,Semantics,Argument Structure,transitive_verb_passive,transitive_verb_passive_rand,librusec,3
39621,Кургафен и Лауенбург были тоже заняты французами.,Кургафен и Лауенбург были тоже заняты дебютами.,французами,дебютами,Semantics,Argument Structure,transitive_verb_passive,transitive_verb_passive_rand,librusec,3
39570,И опять проект был сделан Феофановым.,И опять проект был сделан синдромом.,Феофановым,синдромом,Semantics,Argument Structure,transitive_verb_passive,transitive_verb_passive_rand,librusec,1
6428,Повесть была иллюстрирована в журнале Репиным.,Повесть была иллюстрирована в журнале сектором.,Репиным,сектором,Semantics,Argument Structure,transitive_verb_passive,transitive_verb_passive_rand,librusec,2
6310,Царьград будет отвоеван греками. в 1261-м году.,Царьград будет отвоеван шагами. в 1261-м году.,греками,шагами,Semantics,Argument Structure,transitive_verb_passive,transitive_verb_passive_rand,librusec,2
6585,Два монастыря устроены игуменами: Аркажский и Хутынь.,Два монастыря устроены гран-при: Аркажский и Хутынь.,игуменами,гран-при,Semantics,Argument Structure,transitive_verb_passive,transitive_verb_passive_rand,librusec,4
39678,Лингейн не всегда управлялся автархами.,Лингейн не всегда управлялся стоками.,автархами,стоками,Semantics,Argument Structure,transitive_verb_passive,transitive_verb_passive_rand,librusec,2
6208,"Мир был испорчен позже, Ахриманом.","Мир был испорчен позже, балетом.",Ахриманом,балетом,Semantics,Argument Structure,transitive_verb_passive,transitive_verb_passive_rand,librusec,2
6201,Его реформа была проведена масоретами.,Его реформа была проведена тиражами.,масоретами,тиражами,Semantics,Argument Structure,transitive_verb_passive,transitive_verb_passive_rand,librusec,2
6141,Империи создаются героями и стоят на них.,Империи создаются билетами и стоят на них.,героями,билетами,Semantics,Argument Structure,transitive_verb_passive,transitive_verb_passive_rand,librusec,3
6582,Сад разбит садовниками — рабами из Мерва.,Сад разбит десятками — рабами из Мерва.,садовниками,десятками,Semantics,Argument Structure,transitive_verb_passive,transitive_verb_passive_rand,librusec,4
6562,"Месть устроена совсем иначе, Люси.","Месть устроена совсем иначе, виллой.",Люси,виллой,Semantics,Argument Structure,transitive_verb_passive,transitive_verb_passive_rand,librusec,3
6462,Фабрика была построена извергинями на месте бывшего парка.,Фабрика была построена контактами на месте бывшего парка.,извергинями,контактами,Semantics,Argument Structure,transitive_verb_passive,transitive_verb_passive_rand,librusec,3
6351,Ее внимание было поглощено Домиником.,Ее внимание было поглощено терроризмом.,Домиником,терроризмом,Semantics,Argument Structure,transitive_verb_passive,transitive_verb_passive_rand,librusec,2
6604,Ни один контракт не был подписан Бобом.,Ни один контракт не был подписан пульсом.,Бобом,пульсом,Semantics,Argument Structure,transitive_verb_passive,transitive_verb_passive_rand,librusec,3
6607,Утро было испорчено позвонившим около часа назад Стефано.,Утро было испорчено позвонившим около часа назад рецептом.,Стефано,рецептом,Semantics,Argument Structure,transitive_verb_passive,transitive_verb_passive_rand,librusec,4
6029,Праздник Осхофорий был также учрежден Тесеем.,Праздник Осхофорий был также учрежден номером.,Тесеем,номером,Semantics,Argument Structure,transitive_verb_passive,transitive_verb_passive_rand,librusec,2
6670,Его мысли были заняты Анной.,Его мысли были заняты поэмой.,Анной,поэмой,Semantics,Argument Structure,transitive_verb_passive,transitive_verb_passive_rand,librusec,2
39656,Флора всецело была занята Аланом.,Флора всецело была занята обедом.,Аланом,обедом,Semantics,Argument Structure,transitive_verb_passive,transitive_verb_passive_rand,librusec,1
6099,Когда любовь Амором им дана.,Когда любовь каблуком им дана.,Амором,каблуком,Semantics,Argument Structure,transitive_verb_passive,transitive_verb_passive_rand,librusec,1
6044,Дом был выигран Девонбруками на пари.,Дом был выигран процессорами на пари.,Девонбруками,процессорами,Semantics,Argument Structure,transitive_verb_passive,transitive_verb_passive_rand,librusec,2
6309,Запад или Европа представлены были Эллинами.,Запад или Европа представлены были Кабинетами.,Эллинами,кабинетами,Semantics,Argument Structure,transitive_verb_passive,transitive_verb_passive_rand,librusec,3
39604,Но ропот был жестко подавлен Галей.,Но ропот был жестко подавлен стоком.,Галей,стоком,Semantics,Argument Structure,transitive_verb_passive,transitive_verb_passive_rand,librusec,1
6007,Ее внимание было полностью поглощено Танаки.,Ее внимание было полностью поглощено законом.,Танаки,законом,Semantics,Argument Structure,transitive_verb_passive,transitive_verb_passive_rand,librusec,2
28432,Проект разработан архитектором Норманом Фостером.,Архитектор разработан проектом Норманом Фостером.,архитектором,проектом,Semantics,Argument Structure,transitive_verb_passive,transitive_verb_passive_perm,wikinews,3
28435,Портрет не был подписан художником.,Художник не был подписан портретом.,художником,портретом,Semantics,Argument Structure,transitive_verb_passive,transitive_verb_passive_perm,wikinews,1
28451,Да и создан театр был продюсером Эдуардом Бояковым.,Да и создан продюсер был театром Эдуардом Бояковым.,продюсером,театром,Semantics,Argument Structure,transitive_verb_passive,transitive_verb_passive_perm,wikinews,4
28440,Документ представлен депутатом Мадлен Тальфон Кираль.,Депутат представлен документом Мадлен Тальфон Кираль.,депутатом,документом,Semantics,Argument Structure,transitive_verb_passive,transitive_verb_passive_perm,wikinews,3
34779,"Отмечается, что решение утверждено губернатором Орханом Озтурком.","Отмечается, что решение утверждено подоконником Орханом Озтурком.",губернатором,подоконником,Semantics,Argument Structure,transitive_verb_passive,transitive_verb_passive_rand,wikinews,4
34897,Сколько частей было создано Амадеем лично?,Сколько частей было создано эпизодом лично?,Амадеем,эпизодом,Semantics,Argument Structure,transitive_verb_passive,transitive_verb_passive_rand,wikinews,3
29089,План был сорван Человеком-пауком и Призраком.,Человеком-паук был сорван Планом и Призраком.,Человеком-пауком,планом,Semantics,Argument Structure,transitive_verb_passive,transitive_verb_passive_perm,wikipedia,3
148,По завершению второго раунда поединок был остановлен врачом.,По завершению второго раунда врач был остановлен поединком.,врачом,поединком,Semantics,Argument Structure,transitive_verb_passive,transitive_verb_passive_perm,wikipedia,3
382,Некрополь был разработан архитектором Марианом Спыхальским.,Архитектор был разработан некрополем Марианом Спыхальским.,архитектором,некрополем,Semantics,Argument Structure,transitive_verb_passive,transitive_verb_passive_perm,wikipedia,3
29455,На острове им был основан монастырь Бегг Эйре.,На острове монастырем был основан он Бегг Эйре.,им,монастырем,Semantics,Argument Structure,transitive_verb_passive,transitive_verb_passive_perm,wikipedia,4
29410,Проект был подготовлен архитектором Мухарремом Хилми Сеналпом.,Архитектор был подготовлен проектом Мухарремом Хилми Сеналпом.,архитектором,проектом,Semantics,Argument Structure,transitive_verb_passive,transitive_verb_passive_perm,wikipedia,3
29548,Мост спроектирован инженером Карлосом Фернандесом Касадо как балочный.,Инженер спроектирован мостом Карлосом Фернандесом Касадо как балочный.,инженером,мостом,Semantics,Argument Structure,transitive_verb_passive,transitive_verb_passive_perm,wikipedia,4
452,Фильм не был показан критика заранее.,Критик не был показан фильма заранее.,критика,фильма,Semantics,Argument Structure,transitive_verb_passive,transitive_verb_passive_perm,wikipedia,1
28742,Портрет исполнен художником в виде жанровой сцены.,Художник исполнен портретом в виде жанровой сцены.,художником,портретом,Semantics,Argument Structure,transitive_verb_passive,transitive_verb_passive_perm,wikipedia,3
29109,Им же были созданы алтарь и амвон.,Алтарем же были созданы он и амвон.,Им,алтарем,Semantics,Argument Structure,transitive_verb_passive,transitive_verb_passive_perm,wikipedia,4
337,Для этого им были учреждены три фонда.,Для этого фондом были учреждены три его.,им,фондом,Semantics,Argument Structure,transitive_verb_passive,transitive_verb_passive_perm,wikipedia,3
702,Коллектив неоднократно приглашался на концерты критиком Артемием Троицким.,Критик неоднократно приглашался на концерты коллективом Артемием Троицким.,критиком,коллективом,Semantics,Argument Structure,transitive_verb_passive,transitive_verb_passive_perm,wikipedia,4
29295,Термин был придуман эндокринологом Гансом Селье.,Эндокринолог был придуман термином Гансом Селье.,эндокринологом,термином,Semantics,Argument Structure,transitive_verb_passive,transitive_verb_passive_perm,wikipedia,3
690,Картина была создана художницей в возрасте десяти лет.,Художница была создана картиной в возрасте десяти лет.,художницей,картиной,Semantics,Argument Structure,transitive_verb_passive,transitive_verb_passive_perm,wikipedia,3
29341,Заказ был выполнен скульптором Гансом Педерсоном.,Скульптор был выполнен заказом Гансом Педерсоном.,скульптором,заказом,Semantics,Argument Structure,transitive_verb_passive,transitive_verb_passive_perm,wikipedia,3
46,Песня написана артисткой вместе с Милованом Бошковичем.,Артистка написана песней вместе с Милованом Бошковичем.,артисткой,песней,Semantics,Argument Structure,transitive_verb_passive,transitive_verb_passive_perm,wikipedia,4
29003,Позже велнес популяризован издателем Робертом Родейлом и другими.,Позже издатель популяризован велнесом Робертом Родейлом и другими.,издателем,велнесом,Semantics,Argument Structure,transitive_verb_passive,transitive_verb_passive_perm,wikipedia,4
28951,Термин был широко введен сэром Уинстоном Черчиллем.,Сэр был широко введен термином Уинстоном Черчиллем.,сэром,термином,Semantics,Argument Structure,transitive_verb_passive,transitive_verb_passive_perm,wikipedia,3
230,Однако впоследствии сбор был остановлен президентом Йовери Мусевени.,Однако впоследствии президент был остановлен сбором Йовери Мусевени.,президентом,сбором,Semantics,Argument Structure,transitive_verb_passive,transitive_verb_passive_perm,wikipedia,3
28746,В итоге фильм был приобретен продюсером и дистрибьютором.,В итоге продюсер был приобретен фильмом и дистрибьютором.,продюсером,фильмом,Semantics,Argument Structure,transitive_verb_passive,transitive_verb_passive_perm,wikipedia,4
220,Храм построен в необарочном стиле архитектором Иосифом Шевелевым.,Архитектор построен в необарочном стиле храмом Иосифом Шевелевым.,архитектором,храмом,Semantics,Argument Structure,transitive_verb_passive,transitive_verb_passive_perm,wikipedia,4
28600,Велосипед был приобретен ученым в 45-летнем возрасте.,Ученый был приобретен велосипедом в 45-летнем возрасте.,ученым,велосипедом,Semantics,Argument Structure,transitive_verb_passive,transitive_verb_passive_perm,wikipedia,2
28531,Герб и флаг территории были разработаны полковником Колмантом.,Полковник и флаг территории были разработаны гербом Колмантом.,полковником,гербом,Semantics,Argument Structure,transitive_verb_passive,transitive_verb_passive_perm,wikipedia,4
320,Псевдоним взят им по названию чеченского общества Чеберлой.,Он взят псевдонимом по названию чеченского общества Чеберлой.,им,псевдонимом,Semantics,Argument Structure,transitive_verb_passive,transitive_verb_passive_perm,wikipedia,3
454,Полный список: Несколько таксонов было пересмотрено энтомологами.,Полный список: Несколько энтомологов было пересмотрено таксонами.,энтомологами,таксонами,Semantics,Argument Structure,transitive_verb_passive,transitive_verb_passive_perm,wikipedia,3
29589,Выставка была оформлена лично художницей Пильви Оямаа.,Художница была оформлена лично выставкой Пильви Оямаа.,художницей,выставкой,Semantics,Argument Structure,transitive_verb_passive,transitive_verb_passive_perm,wikipedia,3
28821,Центр был открыт премьером Робертом Мензисом.,Премьер был открыт центром Робертом Мензисом.,премьером,центром,Semantics,Argument Structure,transitive_verb_passive,transitive_verb_passive_perm,wikipedia,3
701,Проект был подготовлен архитектором Эрнстом Загебилем.,Архитектор был подготовлен проектом Эрнстом Загебилем.,архитектором,проектом,Semantics,Argument Structure,transitive_verb_passive,transitive_verb_passive_perm,wikipedia,3
28820,СУЗИ озвучена актрисой Тришей Хелфер.,АКТРИСА озвучена сузи Тришей Хелфер.,актрисой,сузи,Semantics,Argument Structure,transitive_verb_passive,transitive_verb_passive_perm,wikipedia,3
28886,Бюст был изготовлен скульптором Йозефом Диалером.,Скульптор был изготовлен бюстом Йозефом Диалером.,скульптором,бюстом,Semantics,Argument Structure,transitive_verb_passive,transitive_verb_passive_perm,wikipedia,3
28963,Рисунок выполнен архитектором Мельхиором Берри.,Архитектор выполнен рисунком Мельхиором Берри.,архитектором,рисунком,Semantics,Argument Structure,transitive_verb_passive,transitive_verb_passive_perm,wikipedia,3
425,Сквер спроектирован архитектором Вячеславом Васильевичем Бугашевым.,Архитектор спроектирован сквером Вячеславом Васильевичем Бугашевым.,архитектором,сквером,Semantics,Argument Structure,transitive_verb_passive,transitive_verb_passive_perm,wikipedia,3
584,Бой был остановлен доктором после 8 раунда.,Доктор был остановлен боем после 8 раунда.,доктором,боем,Semantics,Argument Structure,transitive_verb_passive,transitive_verb_passive_perm,wikipedia,2
40,Автомобиль разработан дизайнером Людвигом Краусом.,Дизайнер разработан автомобилем Людвигом Краусом.,дизайнером,автомобилем,Semantics,Argument Structure,transitive_verb_passive,transitive_verb_passive_perm,wikipedia,3
579,Текст к печати был подготовлен муллой Усманом Ибрахимом.,Мулла к печати был подготовлен текстом Усманом Ибрахимом.,муллой,текстом,Semantics,Argument Structure,transitive_verb_passive,transitive_verb_passive_perm,wikipedia,4
