id,source_sentence,target_sentence,source_word,target_word,level,phenomenon,PID,subtype,domain,tree_depth
29289,"Для этого им были сконструированы передатчик, включающий в себя источник питания постоянного тока, катушку Румкорфа и антенну направленного действия — симметричный вибратор, и простейший приемник в виде металлической рамки с малым искровым промежутком, выполнявшим функции индикатора (детектора) волн.","Для этого передатчиком были сконструированы он, включающий в себя источник питания постоянного тока, катушку Румкорфа и антенну направленного действия — симметричный вибратор, и простейший приемник в виде металлической рамки с малым искровым промежутком, выполнявшим функции индикатора (детектора) волн.",им,передатчиком,Semantics,Argument Structure,transitive_verb_passive,transitive_verb_passive_perm,wikipedia,20
29330,"В короткой программе, допустив мелкие помарки (его прыжки были немного ""отминусованы"" судьями), швейцарец занял лишь четвертое место, уступив второму ровно 1 балл.","В короткой программе, допустив мелкие помарки (его судьи были немного ""отминусованы"" прыжками), швейцарец занял лишь четвертое место, уступив второму ровно 1 балл.",судьями,прыжками,Semantics,Argument Structure,transitive_verb_passive,transitive_verb_passive_perm,wikipedia,11
29428,"Несмотря на то, что Бродерик считает себя евреем, церемония была проведена его сестрой, Джанет Бродерик Крафт, епископальным священником.","Несмотря на то, что Бродерик считает себя евреем, сестра была проведена его церемонией, Джанет Бродерик Крафт, епископальным священником.",сестрой,церемонией,Semantics,Argument Structure,transitive_verb_passive,transitive_verb_passive_perm,wikipedia,7
29110,"В конце данной манги демонстрировалось что после апокалипсиса произошедшего в оригинальной манге мир был пересоздан богом, а главный герой, Джек, на самом деле является Акирой.","В конце данной манги демонстрировалось что после апокалипсиса произошедшего в оригинальной манге бог был пересоздан миром, а главный герой, Джек, на самом деле является Акирой.",богом,миром,Semantics,Argument Structure,transitive_verb_passive,transitive_verb_passive_perm,wikipedia,11
29580,"Вездеход успешно применяется изобретателем для перевозки различных грузов как в зимний, так и в летний период, и отличается хорошей проходимостью и подвижностью.","Изобретатель успешно применяется вездеходом для перевозки различных грузов как в зимний, так и в летний период, и отличается хорошей проходимостью и подвижностью.",изобретателем,вездеходом,Semantics,Argument Structure,transitive_verb_passive,transitive_verb_passive_perm,wikipedia,9
28507,"Там же он основал проблемную лабораторию по синтезу и испытаниям пестицидов, которой руководил до конца жизни. утилизации отхода хлоропренового каучука – 1,3-дихлорбутена-2, на основе которого им был получен гербицид кротилин, получивший широкое применение.","Там же он основал проблемную лабораторию по синтезу и испытаниям пестицидов, которой руководил до конца жизни. утилизации отхода хлоропренового каучука – 1,3-дихлорбутена-2, на основе которого гербицидом был получен он кротилин, получивший широкое применение.",им,гербицидом,Semantics,Argument Structure,transitive_verb_passive,transitive_verb_passive_perm,wikipedia,16
28607,"Как правило, бой-бэнд создается продюсером с чисто коммерческими целями, в противоположность группам, возникающим как объединение друзей, которые сами пишут песни и играют.","Как правило, продюсер создается боем-бэндом с чисто коммерческими целями, в противоположность группам, возникающим как объединение друзей, которые сами пишут песни и играют.",продюсером,боем-бэндом,Semantics,Argument Structure,transitive_verb_passive,transitive_verb_passive_perm,wikipedia,11
28572,"Романы, составившие ее, были хорошо приняты как критиками, отмечавшими резко контрастирующий с современным писателю модернизмом романтический стиль повествования и общую христианско-гуманистическую концепцию произведения, так и читателями.","Критики, составившие ее, были хорошо приняты как романами, отмечавшими резко контрастирующий с современным писателю модернизмом романтический стиль повествования и общую христианско-гуманистическую концепцию произведения, так и читателями.",критиками,романами,Semantics,Argument Structure,transitive_verb_passive,transitive_verb_passive_perm,wikipedia,11
28593,"Позднее Спенсер стал важной фигурой в движении белых супремацистов и президентом Института национальной политики, им был введен термин ""альт-правые"".","Позднее Спенсер стал важной фигурой в движении белых супремацистов и президентом Института национальной политики, термином был введен он ""альт-правые"".",им,термином,Semantics,Argument Structure,transitive_verb_passive,transitive_verb_passive_perm,wikipedia,10
29302,"Документ был выдан императором Карлом в ответ на переданную ему делегацией переселенцев петицию на действия графов, управлявших пограничными с Кордовским эмиратом землями империи.","Император был выдан документом Карлом в ответ на переданную ему делегацией переселенцев петицию на действия графов, управлявших пограничными с Кордовским эмиратом землями империи.",императором,документом,Semantics,Argument Structure,transitive_verb_passive,transitive_verb_passive_perm,wikipedia,12
28785,"По преданию меч был создан гномом Дайном и был заколдован: будучи вытащен из ножен, он не мог вернуться в них, пока не прольет чью-либо кровь.","По преданию гном был создан мечом Дайном и был заколдован: будучи вытащен из ножен, он не мог вернуться в них, пока не прольет чью-либо кровь.",гномом,мечом,Semantics,Argument Structure,transitive_verb_passive,transitive_verb_passive_perm,wikipedia,11
29131,"Этим же днем датируется и множество других писем папе — от Юстина, сообщающего о том, что ""либеллус"" был подписан патриархом без выражения несогласия, краткое послание от Юстиниана, в котором тот просил папу молиться за императора и империю.","Этим же днем датируется и множество других писем папе — от Юстина, сообщающего о том, что ""патриарх"" был подписан либеллусом без выражения несогласия, краткое послание от Юстиниана, в котором тот просил папу молиться за императора и империю.",патриархом,либеллусом,Semantics,Argument Structure,transitive_verb_passive,transitive_verb_passive_perm,wikipedia,18
218,"Однако это присуждение вызвало разногласия в научном сообществе, так как одновременно с французской группой и независимо от нее вирус был открыт американцем Робертом Галло.","Однако это присуждение вызвало разногласия в научном сообществе, так как одновременно с французской группой и независимо от нее американец был открыт вирусом Робертом Галло.",американцем,вирусом,Semantics,Argument Structure,transitive_verb_passive,transitive_verb_passive_perm,wikipedia,11
28,"Союзники (клан Отомо и полководцы Хидееси) прибыв к реке Хэцугигава, протекавшей рядом с замком Тосимицу, они обнаружили что замок захвачен противником.","Союзники (клан Отомо и полководцы Хидееси) прибыв к реке Хэцугигава, протекавшей рядом с замком Тосимицу, они обнаружили что противник захвачен замком.",противником,замком,Semantics,Argument Structure,transitive_verb_passive,transitive_verb_passive_perm,wikipedia,9
28622,"Им были захвачены Суйчэн и Личжоу, а к началу зимы он взял Тайминфу и повернул на восток, овладев значительной частью территории провинции Шаньдун.","Суйчэном были захвачены он и Личжоу, а к началу зимы он взял Тайминфу и повернул на восток, овладев значительной частью территории провинции Шаньдун.",Им,суйчэном,Semantics,Argument Structure,transitive_verb_passive,transitive_verb_passive_perm,wikipedia,11
28892,"Сам Тамерлан не принимал участия в завоевании Маджара, город был разграблен его военачальником Мираншахом по пути следования войска Мираншаха к устью Дона на соединение с основной армией.","Сам Тамерлан не принимал участия в завоевании Маджара, военачальник был разграблен его городом Мираншахом по пути следования войска Мираншаха к устью Дона на соединение с основной армией.",военачальником,городом,Semantics,Argument Structure,transitive_verb_passive,transitive_verb_passive_perm,wikipedia,11
29515,"Когда-то в молодости Иван убил монаха по неосторожности, монах явился ему после смерти и предсказал судьбу, что его жизнь обещана его матерью Богу.","Когда-то в молодости Иван убил монаха по неосторожности, монах явился ему после смерти и предсказал судьбу, что его мать обещана его жизнью Богу.",матерью,жизнью,Semantics,Argument Structure,transitive_verb_passive,transitive_verb_passive_perm,wikipedia,10
29081,"С урочищем связаны многочисленные легенды, где идет речь о пребывании возле валуна Степана Разина, о том, что там им зарыты клады, что валун им привезен для охраны сокровищ.","С урочищем связаны многочисленные легенды, где идет речь о пребывании возле валуна Степана Разина, о том, что там им зарыты клады, что он валуном привезен для охраны сокровищ.",им,валуном,Semantics,Argument Structure,transitive_verb_passive,transitive_verb_passive_perm,wikipedia,12
464,"Сумев в темноте уйти от преследователей, комбат вышел на позицию 1-го орудия, где ему была оказана помощь сандружинницей Зоей в землянке лейтенанта Скоромникова.","Сумев в темноте уйти от преследователей, комбат вышел на позицию 1-го орудия, где ему была оказана сандружинница помощью Зоей в землянке лейтенанта Скоромникова.",сандружинницей,помощью,Semantics,Argument Structure,transitive_verb_passive,transitive_verb_passive_perm,wikipedia,11
591,"Дальнейшее наступление корпуса было остановлено между Синельниково и Славгородом в связи с отсутствием горючего, после чего корпус был контратакован противником, расчленившим колонну на несколько частей, и приступившим к ее ликвидации.","Дальнейшее наступление корпуса было остановлено между Синельниково и Славгородом в связи с отсутствием горючего, после чего противник был контратакован корпусом, расчленившим колонну на несколько частей, и приступившим к ее ликвидации.",противником,корпусом,Semantics,Argument Structure,transitive_verb_passive,transitive_verb_passive_perm,wikipedia,13
499,"Пентоксил рекомендован производителем при лейкопения, агранулоцитарной ангине, алиментарно-токсической алейкии, интоксикации бензолом, инфекционно-воспалительных заболеваниях органов дыхания, иммунодефицитных состояниях, также, в составе комбинированной терапии, при пародонтозе.","Производитель рекомендован пентоксилом при лейкопения, агранулоцитарной ангине, алиментарно-токсической алейкии, интоксикации бензолом, инфекционно-воспалительных заболеваниях органов дыхания, иммунодефицитных состояниях, также, в составе комбинированной терапии, при пародонтозе.",производителем,пентоксилом,Semantics,Argument Structure,transitive_verb_passive,transitive_verb_passive_perm,wikipedia,11
119,"Мехмед Нешри приводит цифры, далекие от реалистичных: Как писал, река Ситница была переполнена не рыбой, а телами мертвых.","Мехмед Нешри приводит цифры, далекие от реалистичных: Как писал, рыба Ситница была переполнена не рекой, а телами мертвых.",рыбой,рекой,Semantics,Argument Structure,transitive_verb_passive,transitive_verb_passive_perm,wikipedia,10
29192,"Внезапно батальон был контратакован противником и тогда, не растерявшись и не поддавшись панике, Бастанджян, находясь на левом фланге батальона, организовал его оборону.","Внезапно противник был контратакован батальоном и тогда, не растерявшись и не поддавшись панике, Бастанджян, находясь на левом фланге батальона, организовал его оборону.",противником,батальоном,Semantics,Argument Structure,transitive_verb_passive,transitive_verb_passive_perm,wikipedia,7
29396,"После пожара, случившегося 5 февраля года (1773-й по венецианскому календарю), театр был перестроен архитектором на средства венецианских патрициев — при этом зрительный зал вместо полуциркульной приобрел традиционную для итальянского театра подковообразную форму.","После пожара, случившегося 5 февраля года (1773-й по венецианскому календарю), архитектор был перестроен театром на средства венецианских патрициев — при этом зрительный зал вместо полуциркульной приобрел традиционную для итальянского театра подковообразную форму.",архитектором,театром,Semantics,Argument Structure,transitive_verb_passive,transitive_verb_passive_perm,wikipedia,16
114,"Основатель индийской археологии Александр Каннингем сообщал, что спустя несколько лет после повторного открытия Кхаджурахо храмы тайно использовались йогами и индусами для проведения духовных практик.","Основатель индийской археологии Александр Каннингем сообщал, что спустя несколько лет после повторного открытия Кхаджурахо йоги тайно использовались храмами и индусами для проведения духовных практик.",йогами,храмами,Semantics,Argument Structure,transitive_verb_passive,transitive_verb_passive_perm,wikipedia,11
29239,"В дальнейшем, на основании изучения строения растения (в особенности морфологии плода) таксон был перенесен в состав нового рода ботаником Пером Хартвигом.","В дальнейшем, на основании изучения строения растения (в особенности морфологии плода) ботаник был перенесен в состав нового рода таксоном Пером Хартвигом.",ботаником,таксоном,Semantics,Argument Structure,transitive_verb_passive,transitive_verb_passive_perm,wikipedia,10
600,"Архитектором Николаем Садовниковым храм задумывался в неовизантийском стиле, но по разным причинам не все авторские идеи были реализованы, и основные признаки, присущие византийским храмам, остались только в проектных эскизах.","Храмом Николаем Садовниковым архитектор задумывался в неовизантийском стиле, но по разным причинам не все авторские идеи были реализованы, и основные признаки, присущие византийским храмам, остались только в проектных эскизах.",Архитектором,храмом,Semantics,Argument Structure,transitive_verb_passive,transitive_verb_passive_perm,wikipedia,13
577,"Если районы Герресхайм и Графенберг плотно заселены горожанами, имеющими средний и низкий достаток, то Хуббельрат — сельская фермерская зона с крестьянскими усадьбами, а район Люденберг в основном застроен богатыми виллами и прочими строениями с высоким качеством технического оснащения.","Если горожане Герресхайм и Графенберг плотно заселены районами, имеющими средний и низкий достаток, то Хуббельрат — сельская фермерская зона с крестьянскими усадьбами, а район Люденберг в основном застроен богатыми виллами и прочими строениями с высоким качеством технического оснащения.",горожанами,районами,Semantics,Argument Structure,transitive_verb_passive,transitive_verb_passive_perm,wikipedia,18
29207,"Через несколько дней после начала войны Минск был захвачен противником, ""безлошадная"" дивизия была отправлена для дальнейшего формирования и укомплектования вглубь страны.","Через несколько дней после начала войны противник был захвачен Минском, ""безлошадная"" дивизия была отправлена для дальнейшего формирования и укомплектования вглубь страны.",противником,минском,Semantics,Argument Structure,transitive_verb_passive,transitive_verb_passive_perm,wikipedia,9
543,"Разница лишь в масштабе духовного храма и в том, что Тадж воздвигнут в честь умершей жены шахом, а наша мечеть — в честь матери благодарным сыном.","Разница лишь в масштабе духовного храма и в том, что шах воздвигнут в честь умершей жены Таджем, а наша мечеть — в честь матери благодарным сыном.",шахом,таджем,Semantics,Argument Structure,transitive_verb_passive,transitive_verb_passive_perm,wikipedia,10
