id,source_sentence,target_sentence,source_word,target_word,level,phenomenon,PID,subtype,domain,tree_depth
38762,ТМАО используется акулами и некоторыми другими морскими животными в качестве природного осмолита.,ТМАО используется отраслями и некоторыми другими морскими животными в качестве природного осмолита.,акулами,отраслями,Semantics,Argument Structure,transitive_verb_passive,transitive_verb_passive_rand,wikipedia,5
3076,Станция была разработана архитекторами Дени Эйро и Жаком Трейнаром.,Станция была разработана кислородами Дени Эйро и Жаком Трейнаром.,архитекторами,кислородами,Semantics,Argument Structure,transitive_verb_passive,transitive_verb_passive_rand,wikipedia,4
36837,"Во время сражения шейд был ранен Муртагом, вследствие чего временно развоплотился.","Во время сражения шейд был ранен героизмом, вследствие чего временно развоплотился.",Муртагом,героизмом,Semantics,Argument Structure,transitive_verb_passive,transitive_verb_passive_rand,wikipedia,4
4507,Поселение Екапистла было основано ольмеками задолго до колонизации Мексики.,Поселение Екапистла было основано силуэтами задолго до колонизации Мексики.,ольмеками,силуэтами,Semantics,Argument Structure,transitive_verb_passive,transitive_verb_passive_rand,wikipedia,4
35446,"Надпись установлена Тоньюкуком, занимавшим пост главнокомандующего и визиря до эпохи Бильге-кагана.","Надпись установлена графиком, занимавшим пост главнокомандующего и визиря до эпохи Бильге-кагана.",Тоньюкуком,графиком,Semantics,Argument Structure,transitive_verb_passive,transitive_verb_passive_rand,wikipedia,7
5273,Но и в этих трех статуи были изуродованы хунвейбинами.,Но и в этих трех статуи были изуродованы транспортами.,хунвейбинами,транспортами,Semantics,Argument Structure,transitive_verb_passive,transitive_verb_passive_rand,wikipedia,3
37067,Музыка была написана композиторами Дэвидом Лейтзом и Кадзухиро Коюти.,Музыка была написана фундаментами Дэвидом Лейтзом и Кадзухиро Коюти.,композиторами,фундаментами,Semantics,Argument Structure,transitive_verb_passive,transitive_verb_passive_rand,wikipedia,4
36472,Скульптура была перевезена в Минск археологом Леонидом Давыдовичем Поболем.,Скульптура была перевезена в Минск когтем Леонидом Давыдовичем Поболем.,археологом,когтем,Semantics,Argument Structure,transitive_verb_passive,transitive_verb_passive_rand,wikipedia,4
3557,Как весовая и счетная единица Греции талант упоминался уже Гомером.,Как весовая и счетная единица Греции талант упоминался уже обходом.,Гомером,обходом,Semantics,Argument Structure,transitive_verb_passive,transitive_verb_passive_rand,wikipedia,4
5088,Город на плане Филарете окружен крепостной стеной и имеет форму восьмилучевой звезды.,Город на плане спросе окружен крепостной стеной и имеет форму восьмилучевой звезды.,Филарете,спросе,Semantics,Argument Structure,transitive_verb_passive,transitive_verb_passive_rand,wikipedia,6
35130,Вскоре перевал был отбит индусами и пакистанцы отступили к Матаяну.,Вскоре перевал был отбит роликами и пакистанцы отступили к Матаяну.,индусами,роликами,Semantics,Argument Structure,transitive_verb_passive,transitive_verb_passive_rand,wikipedia,3
35263,Обложка была разработана дизайнером Армандо Бусичем и фотографом Джо Раветцом.,Обложка была разработана коридором Армандо Бусичем и фотографом Джо Раветцом.,дизайнером,коридором,Semantics,Argument Structure,transitive_verb_passive,transitive_verb_passive_rand,wikipedia,5
228,"Для заведования музеем, Архипастырем был учрежден комитет, состоящий из 5 лиц.","Для заведования музеем, Комитетом был учрежден архипастырь, состоящий из 5 лиц.",Архипастырем,комитетом,Semantics,Argument Structure,transitive_verb_passive,transitive_verb_passive_perm,wikipedia,5
446,"После гибели отца замок Беббанбург был захвачен его дядей Эльфриком, младшим братом отца.","После гибели отца дядя Беббанбург был захвачен его замком Эльфриком, младшим братом отца.",дядей,замком,Semantics,Argument Structure,transitive_verb_passive,transitive_verb_passive_perm,wikipedia,5
29113,"Впервые песня была исполнена певицей Норой Бейс, которая на тот момент была женой Джека Норворта.","Впервые певица была исполнена песней Норой Бейс, которая на тот момент была женой Джека Норворта.",певицей,песней,Semantics,Argument Structure,transitive_verb_passive,transitive_verb_passive_perm,wikipedia,6
5,"Образ размещен художником на фоне зловещего неба с нависающими тяжелыми облаками, которые вверху пылают пожаром.","Художник размещен образом на фоне зловещего неба с нависающими тяжелыми облаками, которые вверху пылают пожаром.",художником,образом,Semantics,Argument Structure,transitive_verb_passive,transitive_verb_passive_perm,wikipedia,5
29176,Впервые на практике гироскоп был применен в 1880-х годах инженером Обри для стабилизации курса торпеды.,Впервые на практике инженер был применен в 1880-х годах гироскопом Обри для стабилизации курса торпеды.,инженером,гироскопом,Semantics,Argument Structure,transitive_verb_passive,transitive_verb_passive_perm,wikipedia,6
28698,"Согласно мифологическим представлениям коренных жителей атолла, народа кирибати, остров был создан богом Нареау.","Согласно мифологическим представлениям коренных жителей атолла, народа кирибати, бог был создан островом Нареау.",богом,островом,Semantics,Argument Structure,transitive_verb_passive,transitive_verb_passive_perm,wikipedia,6
29001,"Согласно этому докладу, наемниками были использованы не только автоматы, но и гранатометы.","Согласно этому докладу, автоматами были использованы не только наемники, но и гранатометы.",наемниками,автоматами,Semantics,Argument Structure,transitive_verb_passive,transitive_verb_passive_perm,wikipedia,6
29393,Согласно традиции псалом написан царем Давидом и по случаю основания жертвенника на месте будущего Иерусалимского Храма.,Согласно традиции царь написан псалмом Давидом и по случаю основания жертвенника на месте будущего Иерусалимского Храма.,царем,псалмом,Semantics,Argument Structure,transitive_verb_passive,transitive_verb_passive_perm,wikipedia,7
263,Кузов был спроектирован дизайнером Кеном Гринли — он использовал алюминиевый монокок со стеклопластиковыми панелями.,Дизайнер был спроектирован кузовом Кеном Гринли — он использовал алюминиевый монокок со стеклопластиковыми панелями.,дизайнером,кузовом,Semantics,Argument Structure,transitive_verb_passive,transitive_verb_passive_perm,wikipedia,6
79,"Спелеонимы — названия галерей, залов, озер даны спелеологами, картировавшими лабиринт пещеры.","Спелеологи — названия галерей, залов, озер даны спелеонимами, картировавшими лабиринт пещеры.",спелеологами,спелеонимами,Semantics,Argument Structure,transitive_verb_passive,transitive_verb_passive_perm,wikipedia,9
28703,Взрывы были устроены братьями Царнаевами и были местью США за их действия в Афганистане и Ираке.,Братья были устроены взрывами Царнаевами и были местью США за их действия в Афганистане и Ираке.,братьями,взрывами,Semantics,Argument Structure,transitive_verb_passive,transitive_verb_passive_perm,wikipedia,6
28942,Вид был открыт натуралистом Вильгельмом Петерсом на острове Мозамбик в середине девятнадцатого столетия.,Натуралист был открыт видом Вильгельмом Петерсом на острове Мозамбик в середине девятнадцатого столетия.,натуралистом,видом,Semantics,Argument Structure,transitive_verb_passive,transitive_verb_passive_perm,wikipedia,6
167,"На время пребывания на посту премьер-министра, банк управлялся его заместителем Павлом Кисилкой.","На время пребывания на посту премьер-министра, заместитель управлялся его банком Павлом Кисилкой.",заместителем,банком,Semantics,Argument Structure,transitive_verb_passive,transitive_verb_passive_perm,wikipedia,6
28968,"Андриск был разгромлен претором Квинтом Цецилием Метеллом, бежал к фракийцам, но был выдан римлянам.","Претор был разгромлен Андриском Квинтом Цецилием Метеллом, бежал к фракийцам, но был выдан римлянам.",претором,андриском,Semantics,Argument Structure,transitive_verb_passive,transitive_verb_passive_perm,wikipedia,6
29057,В этой местности сад был заложен адмиралом Грейгом во время его управления городом.,В этой местности адмирал был заложен садом Грейгом во время его управления городом.,адмиралом,садом,Semantics,Argument Structure,transitive_verb_passive,transitive_verb_passive_perm,wikipedia,5
31,"Структурно роман был разделен автором на отдельные книги, каждая из которых представляла собой законченную историю.","Структурно автор был разделен романом на отдельные книги, каждая из которых представляла собой законченную историю.",автором,романом,Semantics,Argument Structure,transitive_verb_passive,transitive_verb_passive_perm,wikipedia,6
28873,"По легенде, роду Комаров герб Комар был дан королем Ягайло на поле Грюнвальской битве.","По легенде, роду Комаров король Комар был дан гербом Ягайло на поле Грюнвальской битве.",королем,гербом,Semantics,Argument Structure,transitive_verb_passive,transitive_verb_passive_perm,wikipedia,7
28757,"Брак был устроен епископом Ганнером из Виборга, которого пара любила как отца.","Епископ был устроен браком Ганнером из Виборга, которого пара любила как отца.",епископом,браком,Semantics,Argument Structure,transitive_verb_passive,transitive_verb_passive_perm,wikipedia,6
28579,"Митра представлен юношей, облаченным в римскую тунику, длинные штаны и фригийский колпак.","Юноша представлен митрой, облаченным в римскую тунику, длинные штаны и фригийский колпак.",юношей,митрой,Semantics,Argument Structure,transitive_verb_passive,transitive_verb_passive_perm,wikipedia,6
29140,"Доля дается человеку прежде всего матерью, обусловлена родом, предками и определяется рожаницами.","Мать дается человеку прежде всего долей, обусловлена родом, предками и определяется рожаницами.",матерью,долей,Semantics,Argument Structure,transitive_verb_passive,transitive_verb_passive_perm,wikipedia,7
28561,"Отряд, посланный Толумнием штурмовать римский лагерь, был отбит легатом Марком Фабием.","Легат, посланный Толумнием штурмовать римский лагерь, был отбит отрядом Марком Фабием.",легатом,отрядом,Semantics,Argument Structure,transitive_verb_passive,transitive_verb_passive_perm,wikipedia,7
29138,"Бой был неоднозначно остановлен рефери Дэном Мираглиоттой, когда Вердум оседлал его и повалил на канвас.","Рефери был неоднозначно остановлен боем Дэном Мираглиоттой, когда Вердум оседлал его и повалил на канвас.",рефери,боем,Semantics,Argument Structure,transitive_verb_passive,transitive_verb_passive_perm,wikipedia,6
315,"Термин ""монголы трех рек"" впервые им был введен в монгольскую и мировую историческую науку.","Он ""монголы трех рек"" впервые термином был введен в монгольскую и мировую историческую науку.",им,термином,Semantics,Argument Structure,transitive_verb_passive,transitive_verb_passive_perm,wikipedia,7
28803,"Сгур прибыл в Арту, однако, вскоре город был захвачен авантюристом Вонко.","Сгур прибыл в Арту, однако, вскоре авантюрист был захвачен городом Вонко.",авантюристом,городом,Semantics,Argument Structure,transitive_verb_passive,transitive_verb_passive_perm,wikipedia,5
448,"Их язык был разработан доктором Полом Фроммером, лингвистом из Университета Южной Калифорнии.","Их доктор был разработан языком Полом Фроммером, лингвистом из Университета Южной Калифорнии.",доктором,языком,Semantics,Argument Structure,transitive_verb_passive,transitive_verb_passive_perm,wikipedia,7
28569,"Вид был назван орнитологом Джоном Латамом в честь этой области Австралии, называющейся Новая Голландия.","Орнитолог был назван видом Джоном Латамом в честь этой области Австралии, называющейся Новая Голландия.",орнитологом,видом,Semantics,Argument Structure,transitive_verb_passive,transitive_verb_passive_perm,wikipedia,7
28916,"Тартус был осажден эмиром Бильбаном, и крестоносцы были вынуждены бежать на соседний остров Арвад.","Эмир был осажден Тартусом Бильбаном, и крестоносцы были вынуждены бежать на соседний остров Арвад.",эмиром,тартусом,Semantics,Argument Structure,transitive_verb_passive,transitive_verb_passive_perm,wikipedia,5
29058,"По данным разведки мосты были хорошо защищены немцами, тщательно охранялись и были заминированы для уничтожения.","По данным разведки немцы были хорошо защищены мостами, тщательно охранялись и были заминированы для уничтожения.",немцами,мостами,Semantics,Argument Structure,transitive_verb_passive,transitive_verb_passive_perm,wikipedia,5
307,"Очаков был взят фельдмаршалом Христофором Минихом, но год спустя был покинут и возвращен Турции.","Фельдмаршал был взят Очаковом Христофором Минихом, но год спустя был покинут и возвращен Турции.",фельдмаршалом,очаковом,Semantics,Argument Structure,transitive_verb_passive,transitive_verb_passive_perm,wikipedia,6
29151,Диск был выпущен музыкантом и продюсером Вадимом Горшковым с согласия и в содействии с Галиной Евдокимовой.,Музыкант был выпущен диском и продюсером Вадимом Горшковым с согласия и в содействии с Галиной Евдокимовой.,музыкантом,диском,Semantics,Argument Structure,transitive_verb_passive,transitive_verb_passive_perm,wikipedia,7
29426,"В провинции Кхам районы Дерге, Кандзе и Ньягронг по-прежнему заселены тибетцами — последователями этой религии.","В провинции Кхам тибетцы Дерге, Кандзе и Ньягронг по-прежнему заселены районами — последователями этой религии.",тибетцами,районами,Semantics,Argument Structure,transitive_verb_passive,transitive_verb_passive_perm,wikipedia,9
29271,"Брак узаконен священником, свидетели — Альфредо Амарозо и Розалия Соломене, служанка Филумены.","Священник узаконен браком, свидетели — Альфредо Амарозо и Розалия Соломене, служанка Филумены.",священником,браком,Semantics,Argument Structure,transitive_verb_passive,transitive_verb_passive_perm,wikipedia,5
524,"Термин введен филологом Карлом Моргенштерном в 1820-х годах для определения ""формирующегося"" совершеннолетнего человека.","Филолог введен термином Карлом Моргенштерном в 1820-х годах для определения ""формирующегося"" совершеннолетнего человека.",филологом,термином,Semantics,Argument Structure,transitive_verb_passive,transitive_verb_passive_perm,wikipedia,7
28845,"Дом Такэда-но-мия был основан принцем Цунэхисой, старшим сыном принца Китасиракавы Есихисы (второй Китасиракава-но-мия).","Принц Такэда-но-мия был основан домом Цунэхисой, старшим сыном принца Китасиракавы Есихисы (второй Китасиракава-но-мия).",принцем,домом,Semantics,Argument Structure,transitive_verb_passive,transitive_verb_passive_perm,wikipedia,7
78,"Эти места обитаемы с древнейших времен: археологами здесь обнаружены артефакты, относящиеся к Трипольской культуре.","Эти места обитаемы с древнейших времен: артефактами здесь обнаружены археологи, относящиеся к Трипольской культуре.",археологами,артефактами,Semantics,Argument Structure,transitive_verb_passive,transitive_verb_passive_perm,wikipedia,7
29078,"Топир был перестроен императором Траяном, как часть провинциальной политики, направленной на урбанизацию Фракии.","Император был перестроен Топиром Траяном, как часть провинциальной политики, направленной на урбанизацию Фракии.",императором,топиром,Semantics,Argument Structure,transitive_verb_passive,transitive_verb_passive_perm,wikipedia,6
38867,"Однако и много лет назад выясняется, что книга уже давно куплена Кэлом.","Однако и много лет назад выясняется, что книга уже давно куплена клипом.",Кэлом,клипом,Semantics,Argument Structure,transitive_verb_passive,transitive_verb_passive_rand,wikipedia,5
5982,"Она, по мнению Тулузаковой, является вершиной треугольника, в который вписана художником сцена.","Она, по мнению Тулузаковой, является вершиной треугольника, в который вписана рекордом сцена.",художником,рекордом,Semantics,Argument Structure,transitive_verb_passive,transitive_verb_passive_rand,wikipedia,6
37880,"Название ""силиква"" дано историками, подлинное название этого вида монет неизвестно.","Название ""силиква"" дано останками, подлинное название этого вида монет неизвестно.",историками,останками,Semantics,Argument Structure,transitive_verb_passive,transitive_verb_passive_rand,wikipedia,6
39046,"Группа была основана в Москве вокалистом Александром Андреевым, басистом Григорием Машталиром и ударником Владимиром Ткачевым.","Группа была основана в Москве доступом Александром Андреевым, басистом Григорием Машталиром и ударником Владимиром Ткачевым.",вокалистом,доступом,Semantics,Argument Structure,transitive_verb_passive,transitive_verb_passive_rand,wikipedia,8
38794,Движение основано раввином Меиром Каханой — основателем Лиги защиты евреев и израильской партии Ках.,Движение основано доступом Меиром Каханой — основателем Лиги защиты евреев и израильской партии Ках.,раввином,доступом,Semantics,Argument Structure,transitive_verb_passive,transitive_verb_passive_rand,wikipedia,7
