id,source_sentence,target_sentence,source_word,target_word,level,phenomenon,PID,subtype,domain,tree_depth
4907,Группировка была создана в конце 1980-х годов бизнесменом Игорем Вугиным и его знакомым Максимом Шенковым.,Группировка была создана в конце 1980-х годов кишечником Игорем Вугиным и его знакомым Максимом Шенковым.,бизнесменом,кишечником,Semantics,Argument Structure,transitive_verb_passive,transitive_verb_passive_rand,wikipedia,7
38213,"Им также была написана картина, изображающая историю творения мира и находящаяся справа от хоров.","Таймом также была написана картина, изображающая историю творения мира и находящаяся справа от хоров.",Им,таймом,Semantics,Argument Structure,transitive_verb_passive,transitive_verb_passive_rand,wikipedia,8
4830,"Группа основана гитаристом Джереми Вагнером, вокалистом Джо Птасеком и ударником Райном Станеком.","Группа основана откликом Джереми Вагнером, вокалистом Джо Птасеком и ударником Райном Станеком.",гитаристом,откликом,Semantics,Argument Structure,transitive_verb_passive,transitive_verb_passive_rand,wikipedia,7
5104,"Фраза, возможно, была изобретена либо писателем Барнаби Конрадом, либо автомобильным автором Кеном Парди.","Фраза, возможно, была изобретена либо разъездом Барнаби Конрадом, либо автомобильным автором Кеном Парди.",писателем,разъездом,Semantics,Argument Structure,transitive_verb_passive,transitive_verb_passive_rand,wikipedia,6
35760,"Сход завершился традиционной религиозной присягой о круговой поруке, ее текст был написан Уратадзе.","Сход завершился традиционной религиозной присягой о круговой поруке, ее текст был написан хребтом.",Уратадзе,хребтом,Semantics,Argument Structure,transitive_verb_passive,transitive_verb_passive_rand,wikipedia,5
38081,"Впрочем, в отличие от соседних городов, отсутствуют сведения, Тамариндито был захвачен врагами.","Впрочем, в отличие от соседних городов, отсутствуют сведения, Тамариндито был захвачен въездами.",врагами,въездами,Semantics,Argument Structure,transitive_verb_passive,transitive_verb_passive_rand,wikipedia,5
5235,"В это же время его талант был замечен его земляками, Патриком Ивути и Джимми Муинди.","В это же время его талант был замечен его дипломами, Патриком Ивути и Джимми Муинди.",земляками,дипломами,Semantics,Argument Structure,transitive_verb_passive,transitive_verb_passive_rand,wikipedia,7
37243,"Позже появляется живой Мандсон, который заявляет, что самоубийство было подстроено им из ревности.","Позже появляется живой Мандсон, который заявляет, что самоубийство было подстроено шкафом из ревности.",им,шкафом,Semantics,Argument Structure,transitive_verb_passive,transitive_verb_passive_rand,wikipedia,5
36231,Одновременно с вручением документов в Иерусалиме на Аллее Праведников по традиции Жанисом было посажено дерево.,Одновременно с вручением документов в Иерусалиме на Аллее Праведников по традиции очерком было посажено дерево.,Жанисом,очерком,Semantics,Argument Structure,transitive_verb_passive,transitive_verb_passive_rand,wikipedia,6
37574,"По словам поэта, изопы были созданы им в качестве противовеса чтецкой поэзии.","По словам поэта, изопы были созданы стуком в качестве противовеса чтецкой поэзии.",им,стуком,Semantics,Argument Structure,transitive_verb_passive,transitive_verb_passive_rand,wikipedia,5
39052,Группа была основана фотографами Уиллардом Ван Дайком и Анселем Адамсом с целью распространения новых изобразительных принципов.,Группа была основана символами Уиллардом Ван Дайком и Анселем Адамсом с целью распространения новых изобразительных принципов.,фотографами,символами,Semantics,Argument Structure,transitive_verb_passive,transitive_verb_passive_rand,wikipedia,8
5430,"Ахмаров считал, что название ""мишар"" навязано татарам Поволжья мещерского формирования казанцами.","Ахмаров считал, что название ""мишар"" навязано татарам Поволжья мещерского формирования поцелуями.",казанцами,поцелуями,Semantics,Argument Structure,transitive_verb_passive,transitive_verb_passive_rand,wikipedia,7
35419,"Песня была написана Мадонной, Куэйво, Старрой, Клементом Пикардом и Максин Пикард.","Песня была написана тенденцией, Куэйво, Старрой, Клементом Пикардом и Максин Пикард.",Мадонной,тенденцией,Semantics,Argument Structure,transitive_verb_passive,transitive_verb_passive_rand,wikipedia,6
37528,"Трек был написан Айлиш и ее братом Финнеасом О ’ Коннеллом, который также спродюсировал его.","Трек был написан песней и ее братом Финнеасом О ’ Коннеллом, который также спродюсировал его.",Айлиш,песней,Semantics,Argument Structure,transitive_verb_passive,transitive_verb_passive_rand,wikipedia,6
38774,"Песня была написана Томасом и Итаалом Шуром, и исполнена Томасом под аккомпанемент Карлоса Сантаны.","Песня была написана опросом и Итаалом Шуром, и исполнена Томасом под аккомпанемент Карлоса Сантаны.",Томасом,опросом,Semantics,Argument Structure,transitive_verb_passive,transitive_verb_passive_rand,wikipedia,6
37193,"Первоначально дом построен Баграковым, затем принадлежал Штольценвальд, называется домом Волкова по имени последнего владельца.","Первоначально дом построен переходом, затем принадлежал Штольценвальд, называется домом Волкова по имени последнего владельца.",Баграковым,переходом,Semantics,Argument Structure,transitive_verb_passive,transitive_verb_passive_rand,wikipedia,6
3055,"Группа основана тремя музыкантами — гитаристом Михаилом Ленц, басистом Сергеем Ермолаевым и ударником Дмитрием Мазмановым.","Группа основана тремя столиками — гитаристом Михаилом Ленц, басистом Сергеем Ермолаевым и ударником Дмитрием Мазмановым.",музыкантами,столиками,Semantics,Argument Structure,transitive_verb_passive,transitive_verb_passive_rand,wikipedia,8
39264,"Из его стальной хватки мир был вырван лишь Иллиданом, эльфами крови и нагами.","Из его стальной хватки мир был вырван лишь ордером, эльфами крови и нагами.",Иллиданом,ордером,Semantics,Argument Structure,transitive_verb_passive,transitive_verb_passive_rand,wikipedia,5
35922,"Фильм был хорошо принят критиками, хотя исполнение роли Урмилой Мартондкар было названо недостаточно эмоциональным.","Фильм был хорошо принят толками, хотя исполнение роли Урмилой Мартондкар было названо недостаточно эмоциональным.",критиками,толками,Semantics,Argument Structure,transitive_verb_passive,transitive_verb_passive_rand,wikipedia,6
4933,"Город был населен джиннами и генаси, а также их многочисленными рабами — людьми и полуросликами.","Город был населен призами и генаси, а также их многочисленными рабами — людьми и полуросликами.",джиннами,призами,Semantics,Argument Structure,transitive_verb_passive,transitive_verb_passive_rand,wikipedia,7
36004,"К вечеру холм Милл был взят итальянцами, разбившими северородезийский полк, после тяжелых боев.","К вечеру холм Милл был взят сюрпризами, разбившими северородезийский полк, после тяжелых боев.",итальянцами,сюрпризами,Semantics,Argument Structure,transitive_verb_passive,transitive_verb_passive_rand,wikipedia,7
37990,"Оказалось, что шлюп был уведен французами из Куланд-бей, Тобаго, с грузом сахара.","Оказалось, что шлюп был уведен носками из Куланд-бей, Тобаго, с грузом сахара.",французами,носками,Semantics,Argument Structure,transitive_verb_passive,transitive_verb_passive_rand,wikipedia,4
35914,Однако их объединенные войска были разбиты генералом Фези на реке Хулхулау у селения Автуры.,Однако их объединенные войска были разбиты триумфом Фези на реке Хулхулау у селения Автуры.,генералом,триумфом,Semantics,Argument Structure,transitive_verb_passive,transitive_verb_passive_rand,wikipedia,5
780,"Слушая, как он распоряжается, чтобы его записка была немедленно доставлена леди Лоуден, Элизабет почувствовала, что совершенно обезоружена.","Слушая, как он распоряжается, чтобы его леди была немедленно доставлена запиской Лоуден, Элизабет почувствовала, что совершенно обезоружена.",леди,запиской,Semantics,Argument Structure,transitive_verb_passive,transitive_verb_passive_perm,librusec,7
772,"Из останков Тиамат богом создан Космос, а из крови демона Кингу — главный союзник Тиамат — человек.","Из останков Тиамат космосом создан Бог, а из крови демона Кингу — главный союзник Тиамат — человек.",богом,космосом,Semantics,Argument Structure,transitive_verb_passive,transitive_verb_passive_perm,librusec,6
29647,"Морган видел, что Изабель изо всех сил старалась мыть, а не возбуждать его, но битва была проиграна ею.","Морган видел, что Изабель изо всех сил старалась мыть, а не возбуждать его, но она была проиграна битвой.",ею,битвой,Semantics,Argument Structure,transitive_verb_passive,transitive_verb_passive_perm,librusec,6
29631,"По слухам, он был отравлен, а яд будто бы был дан ему доминиканцем во время причастия.","По слухам, он был отравлен, а доминиканец будто бы был дан ему ядом во время причастия.",доминиканцем,ядом,Semantics,Argument Structure,transitive_verb_passive,transitive_verb_passive_perm,librusec,6
758,"На участке роты Патлюка был деревянный мост, но посредник предупредил, что мост ""взорван противником"".","На участке роты Патлюка был деревянный мост, но посредник предупредил, что противник ""взорван мостом"".",противником,мостом,Semantics,Argument Structure,transitive_verb_passive,transitive_verb_passive_perm,librusec,6
768,"По предположению Порфирия, вскоре после этого опустошения, Афон был отдан императором Константином Погонатом для обитания монахам.","По предположению Порфирия, вскоре после этого опустошения, император был отдан Афоном Константином Погонатом для обитания монахам.",императором,афоном,Semantics,Argument Structure,transitive_verb_passive,transitive_verb_passive_perm,librusec,7
774,"Не сострадания вашего, но готовности вашей — вот чего ожидает от вас человек другой, если попран им страх его.","Не сострадания вашего, но готовности вашей — вот чего ожидает от вас человек другой, если попран страхом он его.",им,страхом,Semantics,Argument Structure,transitive_verb_passive,transitive_verb_passive_perm,librusec,8
743,"Но Таня и не помышляет о поступлении на литературный факультет, заранее зная, что ее выбор не будет одобрен отцом.","Но Таня и не помышляет о поступлении на литературный факультет, заранее зная, что ее отец не будет одобрен выбором.",отцом,выбором,Semantics,Argument Structure,transitive_verb_passive,transitive_verb_passive_perm,librusec,6
775,"Но это не означает, что закон был Им упразднен и нам дано право нарушать его принципы.","Но это не означает, что он был Законом упразднен и нам дано право нарушать его принципы.",Им,законом,Semantics,Argument Structure,transitive_verb_passive,transitive_verb_passive_perm,librusec,6
760,"Поскольку форт был единственным препятствием на пути к Чарльз-тауну, не исключено, что город уже взят неприятелем.","Поскольку форт был единственным препятствием на пути к Чарльз-тауну, не исключено, что неприятель уже взят городом.",неприятелем,городом,Semantics,Argument Structure,transitive_verb_passive,transitive_verb_passive_perm,librusec,5
835,"Эту последнюю он принял за продолжение Шилькара, а потому Шилькар и часть Шунгала названы им одним именем Амур.","Эту последнюю он принял за продолжение Шилькара, а потому он и часть Шунгала названы Шилькаром одним именем Амур.",им,шилькаром,Semantics,Argument Structure,transitive_verb_passive,transitive_verb_passive_perm,librusec,7
863,"Дэмьен предположил, что перстень не был снят похитителем с руки, а отрублен вместе с пальцем.","Дэмьен предположил, что похититель не был снят перстнем с руки, а отрублен вместе с пальцем.",похитителем,перстнем,Semantics,Argument Structure,transitive_verb_passive,transitive_verb_passive_perm,librusec,6
755,"Медальон был выполнен скульптором Швердтнером: на одной стороне был портрет Зигмунда, на другой – царя Эдипа, отвечающего сфинксу.","Скульптор был выполнен медальоном Швердтнером: на одной стороне был портрет Зигмунда, на другой – царя Эдипа, отвечающего сфинксу.",скульптором,медальоном,Semantics,Argument Structure,transitive_verb_passive,transitive_verb_passive_perm,librusec,7
868,"Случилось так, что его корабль был потоплен противником, – не успев отплыть далеко от порта.","Случилось так, что его противник был потоплен кораблем, – не успев отплыть далеко от порта.",противником,кораблем,Semantics,Argument Structure,transitive_verb_passive,transitive_verb_passive_perm,librusec,7
29619,"Он тщательно изучил историю авиационных катастроф — те случаи, когда самолеты были взорваны людьми, стремившимися таким путем получить страховку.","Он тщательно изучил историю авиационных катастроф — те случаи, когда люди были взорваны самолетами, стремившимися таким путем получить страховку.",людьми,самолетами,Semantics,Argument Structure,transitive_verb_passive,transitive_verb_passive_perm,librusec,9
29646,"Скальп был обнаружен палеонтологом Чарлзом Стонором в небольшом монастыре, находящемся на склонах Пангбоче на территории Непала.","Палеонтолог был обнаружен скальпом Чарлзом Стонором в небольшом монастыре, находящемся на склонах Пангбоче на территории Непала.",палеонтологом,скальпом,Semantics,Argument Structure,transitive_verb_passive,transitive_verb_passive_perm,librusec,7
784,"По прихоти покойного Эниште ни один рисунок не был выполнен одним художником, над большинством рисунков работали все трое мастеров.","По прихоти покойного Эниште ни один художник не был выполнен одним рисунком, над большинством рисунков работали все трое мастеров.",художником,рисунком,Semantics,Argument Structure,transitive_verb_passive,transitive_verb_passive_perm,librusec,10
832,"Совершенно очевидно, что увиденный Иаковом парящий в воздухе аппарат был сразу же идентифицирован им как принадлежащий Элогим, или богам.","Совершенно очевидно, что увиденный Иаковом парящий в воздухе он был сразу же идентифицирован аппаратом как принадлежащий Элогим, или богам.",им,аппаратом,Semantics,Argument Structure,transitive_verb_passive,transitive_verb_passive_perm,librusec,10
809,"Портрет писан художником не с известной гравюры, а по моим сугубым указаниям, вот ты и не узнал.","Художник писан портретом не с известной гравюры, а по моим сугубым указаниям, вот ты и не узнал.",художником,портретом,Semantics,Argument Structure,transitive_verb_passive,transitive_verb_passive_perm,librusec,4
834,"Иногда Трумб гаснет даже дважды за этот срок, и тогда храмы переполнены жрецами, пытающимися отвратить несчастье.","Иногда Трумб гаснет даже дважды за этот срок, и тогда жрецы переполнены храмами, пытающимися отвратить несчастье.",жрецами,храмами,Semantics,Argument Structure,transitive_verb_passive,transitive_verb_passive_perm,librusec,7
6463,"Поскольку же сам Фроди сделать этого не может, то вира будет выплачена родичами или взыскана с имущества покойного.","Поскольку же сам Фроди сделать этого не может, то вира будет выплачена металлами или взыскана с имущества покойного.",родичами,металлами,Semantics,Argument Structure,transitive_verb_passive,transitive_verb_passive_rand,librusec,6
6017,"Один раз он упомянул, что Бельфонтен был построен его дедом перед женитьбой на бабушке, Филиппа.","Один раз он упомянул, что Бельфонтен был построен его поясом перед женитьбой на бабушке, Филиппа.",дедом,поясом,Semantics,Argument Structure,transitive_verb_passive,transitive_verb_passive_rand,librusec,6
6386,"На эту книгу им была написана критика, часть которой посвящена технике перевода, другая же описывала магозскую жизнь самого Кемаля.","На эту книгу крахом была написана критика, часть которой посвящена технике перевода, другая же описывала магозскую жизнь самого Кемаля.",им,крахом,Semantics,Argument Structure,transitive_verb_passive,transitive_verb_passive_rand,librusec,10
6515,"Что-то за всем этим кроется, решил лорд Манвилл, и тут его мысли были прерваны Лэйс.","Что-то за всем этим кроется, решил лорд Манвилл, и тут его мысли были прерваны синтезом.",Лэйс,синтезом,Semantics,Argument Structure,transitive_verb_passive,transitive_verb_passive_rand,librusec,6
39649,"С первого взгляда видно: здание воздвигнуто фирексийцами – и именно здесь расположен мозг Ратха, отсюда расходятся потоки странного камня.","С первого взгляда видно: здание воздвигнуто коридорами – и именно здесь расположен мозг Ратха, отсюда расходятся потоки странного камня.",фирексийцами,коридорами,Semantics,Argument Structure,transitive_verb_passive,transitive_verb_passive_rand,librusec,9
